id,recipe_name,recipe_ingredients,recipe_nutrition,recipe_servings
374,Quick and Easy Baked Carrots,"1 bunch carrots, trimmed , butter-flavored cooking spray (such as I Can't Believe It's Not Butter®) , 1 teaspoon ground nutmeg , 1 teaspoon ground cinnamon , 1 teaspoon white sugar",total fat: 0.6g saturated fat: 0.2g cholesterol: 0mg sodium: 101mg potassium: 466mg carbohydrates: 15.7g fiber: 4.5g sugar: 8g protein: 1.4g exchange other carbs: 1 vitamin a iu: 24059IU niacin equivalents: 2mg vitamin b6: 0mg vitamin c: 9mg folate: 28mcg calcium: 55mg iron: 1mg magnesium: 19mg thiamin: 0mg,4
375,Divine French Fries,"cooking spray , 1 pound potatoes, cut into strips - or more to taste , salt and ground black pepper to taste , 1 tablespoon white truffle oil, or to taste , 2 teaspoons chopped fresh parsley, or more to taste",total fat: 3.7g saturated fat: 0.5g cholesterol: 0mg sodium: 7mg potassium: 481mg carbohydrates: 19.9g fiber: 2.5g sugar: 1g protein: 2.3g exchange other carbs: 2 vitamin a iu: 55IU niacin equivalents: 2mg vitamin b6: 0mg vitamin c: 23mg folate: 19mcg calcium: 14mg iron: 1mg magnesium: 26mg thiamin: 0mg,4
376,Roasted Red Pepper Spread,"6 pounds red bell peppers , 1 pound Italian plum tomatoes , 2 cloves garlic, unpeeled , 1 small white onion , ½ cup red wine vinegar , 2 tablespoons finely chopped fresh basil , 1 tablespoon sugar , 1 teaspoon salt , 5 Ball® or Kerr® Half-pint (8 oz) Jars with lids and bands",total fat: 0.3g saturated fat: 0g cholesterol: 0mg sodium: 82mg potassium: 236mg carbohydrates: 7.1g fiber: 2.1g sugar: 5g protein: 1.1g exchange other carbs: 1 vitamin a iu: 2978IU niacin equivalents: 1mg vitamin b6: 0mg vitamin c: 118mg folate: 45mcg calcium: 9mg iron: 0mg magnesium: 13mg thiamin: 0mg,30
377,Asian Brussels Sprouts,"1 tablespoon olive oil , 1 pound Brussels sprouts, trimmed and thinly sliced , 1 ½ cups Swanson® Chicken Broth or Swanson® Certified Organic Chicken Broth or Swanson® Natural Goodness® Chicken Broth , 2 tablespoons cornstarch , 3 tablespoons hoisin sauce , 2 tablespoons lime juice , 2 tablespoons honey , 1 teaspoon sriracha hot chili sauce (optional)",total fat: 2.9g saturated fat: 0.4g cholesterol: 1mg sodium: 427mg potassium: 314mg carbohydrates: 19.3g fiber: 3.2g sugar: 10g protein: 3.1g exchange other carbs: 2 vitamin a iu: 701IU niacin equivalents: 1mg vitamin b6: 0mg vitamin c: 66mg folate: 49mcg calcium: 36mg iron: 1mg magnesium: 20mg thiamin: 0mg,6
378,Balsamic Roasted Fennel and Acorn Squash Rice Casserole,"1 acorn squash - cut in half lengthwise, seeded and cut into 12 wedges , 1 large fennel bulb - trimmed, cored and cut into 8 pieces , 2 tablespoons extra-virgin olive oil , 2 tablespoons balsamic vinegar , 3 cloves garlic, minced , 1 tablespoon chopped fresh rosemary , ½ teaspoon salt , ¼ teaspoon ground black pepper , 1 (6 ounce) box UNCLE BEN'S® Basmati Medley Savory Herb , 2 teaspoons chopped fresh parsley",total fat: 3.8g saturated fat: 0.5g cholesterol: 0mg sodium: 409mg potassium: 463mg carbohydrates: 27.7g fiber: 3.2g sugar: 2g protein: 3.2g exchange other carbs: 2 vitamin a iu: 338IU niacin equivalents: 1mg vitamin b6: 0mg vitamin c: 15mg folate: 27mcg calcium: 53mg iron: 1mg magnesium: 30mg thiamin: 0mg,8
379,Lemon Herb Quinoa,"2 cups water , 1 cup quinoa , 1 lemon, juiced and zested , 1 tablespoon chopped fresh parsley , 1 tablespoon chopped fresh basil , 1 teaspoon minced garlic , 1 teaspoon roasted red pepper and garlic seasoning blend",total fat: 1.8g saturated fat: 0.2g cholesterol: 0mg sodium: 82mg potassium: 195mg carbohydrates: 20.5g fiber: 2.9g sugar: 0g protein: 4.3g exchange other carbs: 2 vitamin a iu: 86IU niacin equivalents: 1mg vitamin b6: 0mg vitamin c: 15mg folate: 55mcg calcium: 30mg iron: 2mg magnesium: 60mg thiamin: 0mg,6
380,Sous Vide Cauliflower,"1 head cauliflower, cut into 2-inch chunks , 1 teaspoon soy sauce , 1 teaspoon fish sauce , ¼ teaspoon cayenne pepper , ground black pepper to taste",total fat: 0.2g saturated fat: 0g cholesterol: 0mg sodium: 209mg potassium: 447mg carbohydrates: 8g fiber: 3.7g sugar: 4g protein: 3g exchange other carbs: 1 vitamin a iu: 66IU niacin equivalents: 1mg vitamin b6: 0mg vitamin c: 67mg folate: 83mcg calcium: 34mg iron: 1mg magnesium: 25mg thiamin: 0mg,4
381,Scotch Broth I,"2 pounds meaty beef soup bones , 2 quarts water , 6 whole black peppercorns , 1 cup chopped carrots , 1 cup turnips, chopped , 1 cup chopped celery , ½ cup chopped onion , ¼ cup pearl barley",total fat: 0.2g saturated fat: 0g cholesterol: 0mg sodium: 42mg potassium: 165mg carbohydrates: 9.3g fiber: 2.3g sugar: 2g protein: 1.2g exchange other carbs: 1 vitamin a iu: 2744IU niacin equivalents: 1mg vitamin b6: 0mg vitamin c: 6mg folate: 14mcg calcium: 31mg iron: 1mg magnesium: 15mg thiamin: 0mg,8
382,Blueberry Bake,"1 cup whole wheat pastry flour,1 teaspoon baking powder,1/2 teaspoon baking soda,1 tablespoon white sugar,1/2 cup lowfat buttermilk,2 tablespoons honey,1 tablespoon white sugar,1 tablespoon cornstarch,1 teaspoon ground cinnamon,1 cup water,2 tablespoons lemon juice,3 cups fresh blueberries",Total Fat: 0.7gSaturated Fat: 0.0gCholesterol: < 1mgSodium: 209mgPotassium: 144mgTotal Carbohydrates: 35.2gDietary Fiber: 3.5gProtein: 3.3gSugars: 18gVitamin A: 47IUVitamin C: 10mgCalcium: 88mgIron: 1mgThiamin: 0mgNiacin: 1mgVitamin B6: 0mgMagnesium: 8mgFolate: 6mcg,6
383,Elderberry Soup,"5 ounces elderberries,1 quart water, divided,1 1/2 teaspoons cornstarch,1/2 pound apples - peeled, cored and diced,1 lemon peel,white sugar to taste",Total Fat: 0.3gSaturated Fat: 0.0gCholesterol: 0mgSodium: 10mgPotassium: 165mgTotal Carbohydrates: 16.6gDietary Fiber: 4gProtein: 0.4gSugars: 7gVitamin A: 244IUVitamin C: 17mgCalcium: 26mgIron: 1mgThiamin: 0mgNiacin: 0mgVitamin B6: 0mgMagnesium: 7mgFolate: 4mcg,4
384,Cape Malay Pickled Fish,"1/2 cup vegetable oil for frying,3 pounds cod fillets, cut into 2 to 3 ounce portions,salt to taste,2 large onions, peeled and sliced into rings,2 cloves garlic, chopped,8 whole black peppercorns,4 whole allspice berries,3 bay leaves,1 red chile pepper, seeded and sliced lengthwise,2 cups red wine vinegar,1/2 cup water,1/2 cup packed brown sugar, or to taste,2 tablespoons curry powder,1 teaspoon ground turmeric,2 teaspoons ground cumin,2 teaspoons ground coriander",Total Fat: 4.1gSaturated Fat: 1.0gCholesterol: 97mgSodium: 150mgPotassium: 719mgTotal Carbohydrates: 32.7gDietary Fiber: 2.6gProtein: 41.9gSugars: 20gVitamin A: 196IUVitamin C: 17mgCalcium: 86mgIron: 3mgThiamin: 0mgNiacin: 12mgVitamin B6: 1mgMagnesium: 95mgFolate: 29mcg,6
385,Herbed Cauliflower Rice,"1 head cauliflower, cut into florets , 2 teaspoons chopped fresh chives , 2 teaspoons chopped fresh parsley , ¼ teaspoon garlic powder , ¼ teaspoon onion powder , salt and ground black pepper to taste",total fat: 0.2g saturated fat: 0g cholesterol: 0mg sodium: 82mg potassium: 444mg carbohydrates: 7.9g fiber: 3.7g sugar: 4g protein: 2.9g exchange other carbs: 1 vitamin a iu: 93IU niacin equivalents: 1mg vitamin b6: 0mg vitamin c: 68mg folate: 84mcg calcium: 34mg iron: 1mg magnesium: 22mg thiamin: 0mg,4
386,Air Fryer French Fries,"1 pound russet potatoes, peeled , 2 teaspoons vegetable oil , 1 pinch cayenne pepper , ½ teaspoon kosher salt",total fat: 2.4g saturated fat: 0.4g cholesterol: 0mg sodium: 247mg potassium: 479mg carbohydrates: 19.9g fiber: 2.5g sugar: 1g protein: 2.3g exchange other carbs: 2 vitamin a iu: 23IU niacin equivalents: 2mg vitamin b6: 0mg vitamin c: 22mg folate: 18mcg calcium: 14mg iron: 1mg magnesium: 26mg thiamin: 0mg,4
387,Slow Cooker Vegetarian Curry,"1 head cauliflower, chopped,1 1/2 cups green peas,3 potatoes, chopped,3 tomatoes, chopped,1 cup water,1 1/2 teaspoons ground cumin,1 teaspoon curry powder,3/4 teaspoon ground turmeric,1/2 teaspoon chili powder",Total Fat: 0.7gSaturated Fat: 0.0gCholesterol: 0mgSodium: 45mgPotassium: 999mgTotal Carbohydrates: 32.1gDietary Fiber: 7.6gProtein: 6.7gSugars: 5gVitamin A: 834IUVitamin C: 88mgCalcium: 58mgIron: 3mgThiamin: 0mgNiacin: 4mgVitamin B6: 1mgMagnesium: 62mgFolate: 105mcg,6
388,Strawberry-Banana Freezer Oatmeal,"1 cup white sugar, divided,2 cups fresh strawberries, sliced,3 cups water,2 cups almond milk,2 1/2 cups old-fashioned oats,1 1/2 cups bananas, mashed,1 teaspoon cinnamon,1 teaspoon vanilla extract,1/4 teaspoon salt,1/8 teaspoon ground nutmeg,1/2 cup pecans, chopped",Total Fat: 3.3gSaturated Fat: 0.0gCholesterol: 0mgSodium: 52mgPotassium: 171mgTotal Carbohydrates: 25.9gDietary Fiber: 2.5gProtein: 2.2gSugars: 15gVitamin A: 75IUVitamin C: 13mgCalcium: 38mgIron: 1mgThiamin: 0mgNiacin: 1mgVitamin B6: 0mgMagnesium: 29mgFolate: 12mcg,18
389,Fruit Bake,"6 fresh peaches, pitted and chopped,2 pears - peeled, cored and chopped,4 stalks rhubarb, cut into 1/2 inch pieces,2 tablespoons raisins,1 large papaya - peeled, seeded and cubed (optional),2 tablespoons biscuit baking mix,1/4 cup light brown sugar,1 tablespoon margarine, softened",Total Fat: 1.8gSaturated Fat: 0.0gCholesterol: 0mgSodium: 44mgPotassium: 219mgTotal Carbohydrates: 20gDietary Fiber: 2.3gProtein: 0.8gSugars: 14gVitamin A: 368IUVitamin C: 20mgCalcium: 42mgIron: 0mgThiamin: 0mgNiacin: 0mgVitamin B6: 0mgMagnesium: 10mgFolate: 14mcg,8
390,James' Fire Salad,"1 head red leaf lettuce - rinsed, dried and torn,4 fresh jalapeno peppers, seeded and sliced into rings,3 medium ripe tomatoes, chopped,1 Anaheim pepper, seeded and diced,1/2 red onion, sliced and separated into rings,1/4 cup chopped fresh cilantro",Total Fat: 0.4gSaturated Fat: 0.0gCholesterol: 0mgSodium: 22mgPotassium: 365mgTotal Carbohydrates: 7gDietary Fiber: 2.3gProtein: 1.9gSugars: 4gVitamin A: 5092IUVitamin C: 39mgCalcium: 34mgIron: 1mgThiamin: 0mgNiacin: 1mgVitamin B6: 0mgMagnesium: 21mgFolate: 43mcg,5
391,Boyd's Pinto Beans,"1 pound dry pinto beans , ⅓ pound smoked pork neck bones , 4 cups water , 2 tablespoons shortening",total fat: 1.3g saturated fat: 0.3g cholesterol: 0mg sodium: 2mg potassium: 264mg carbohydrates: 11.8g fiber: 2.9g sugar: 0g protein: 4.1g exchange other carbs: 1 vitamin a iu: 0IU niacin equivalents: 1mg vitamin b6: 0mg vitamin c: 1mg folate: 99mcg calcium: 21mg iron: 1mg magnesium: 33mg thiamin: 0mg,24
392,Sweet and Sour Asparagus,"2 pounds fresh asparagus, trimmed , ¾ cup distilled white vinegar , ½ cup water , ½ cup white sugar , 3 cinnamon sticks , 1 teaspoon whole cloves , 1 teaspoon celery seed , ½ teaspoon salt",total fat: 0.3g saturated fat: 0.1g cholesterol: 0mg sodium: 161mg potassium: 238mg carbohydrates: 17.9g fiber: 2.8g sugar: 14g protein: 2.6g exchange other carbs: 1 vitamin a iu: 1031IU niacin equivalents: 2mg vitamin b6: 0mg vitamin c: 8mg folate: 152mcg calcium: 42mg iron: 1mg magnesium: 16mg thiamin: 0mg,8
393,Wasabi Pea Gnocchi,"2 cups mashed potatoes,3/4 cup frozen green peas, thawed,2 teaspoons minced garlic,1 teaspoon minced fresh ginger root,1 teaspoon wasabi paste, or to taste,salt and pepper to taste,1 large egg,2 cups all-purpose flour, divided",Total Fat: 1.3gSaturated Fat: 0.0gCholesterol: 24mgSodium: 216mgPotassium: 223mgTotal Carbohydrates: 35.7gDietary Fiber: 2.2gProtein: 5.8gSugars: 2gVitamin A: 332IUVitamin C: 6mgCalcium: 25mgIron: 2mgThiamin: 0mgNiacin: 4mgVitamin B6: 0mgMagnesium: 21mgFolate: 72mcg,8
394,Cold Fruit Explosion Soup,"4 cups cubed seeded watermelon,2 cups cubed honeydew,2 cups fresh blueberries, divided,1 1/2 teaspoons minced fresh ginger root,1/2 teaspoon ground nutmeg",Total Fat: 0.5gSaturated Fat: 0.0gCholesterol: 0mgSodium: 12mgPotassium: 283mgTotal Carbohydrates: 20gDietary Fiber: 2.1gProtein: 1.3gSugars: 16gVitamin A: 631IUVitamin C: 23mgCalcium: 14mgIron: 0mgThiamin: 0mgNiacin: 1mgVitamin B6: 0mgMagnesium: 19mgFolate: 17mcg,6
395,Kabocha Squash Pie (Japanese Pumpkin Pie),"¾ cup graham crackers, crushed , ½ cup all-purpose flour , ⅛ cup light soy butter , 1 tablespoon soy milk , ¼ teaspoon ground cinnamon , 2 ⅓ cups kabocha squash - halved, peeled, seeded and cut into 1 1/2 inch cubes , ⅔ cup silken tofu , 1 teaspoon vanilla extract , ¼ cup white sugar , ½ teaspoon ground cinnamon , ¼ teaspoon ground nutmeg",total fat: 3.3g saturated fat: 0.5g cholesterol: 0mg sodium: 65mg potassium: 61mg carbohydrates: 23.1g fiber: 1.3g sugar: 10g protein: 4.2g exchange other carbs: 2 vitamin a iu: 1380IU niacin equivalents: 2mg vitamin b6: 0mg vitamin c: 4mg folate: 21mcg calcium: 87mg iron: 2mg magnesium: 11mg thiamin: 0mg,8
396,Stovetop Beety Ginger Chicken,"1 ½ tablespoons minced fresh ginger root , 1 pound skinless, boneless chicken breast meat - cut into bite-size pieces , 1 (15 ounce) can sliced beets with liquid , 5 large mushrooms, sliced , 1 onion, sliced",total fat: 2.6g saturated fat: 0.7g cholesterol: 59mg sodium: 257mg potassium: 440mg carbohydrates: 11.5g fiber: 2.7g sugar: 7g protein: 24.2g exchange other carbs: 1 vitamin a iu: 41IU niacin equivalents: 12mg vitamin b6: 0mg vitamin c: 7mg folate: 44mcg calcium: 33mg iron: 3mg magnesium: 43mg thiamin: 0mg,4
397,Chicken Veggie Soup I,"2 (14.5 ounce) cans chicken broth , 1 cup baby carrots, halved , 2 potatoes, peeled and cubed , ½ (4.5 ounce) can mushrooms, drained",total fat: 0.2g saturated fat: 0g cholesterol: 0mg sodium: 99mg potassium: 548mg carbohydrates: 22.2g fiber: 3.7g sugar: 3g protein: 2.7g exchange other carbs: 2 vitamin a iu: 4622IU niacin equivalents: 2mg vitamin b6: 0mg vitamin c: 22mg folate: 28mcg calcium: 25mg iron: 1mg magnesium: 30mg thiamin: 0mg,4
398,Wendy Jae's Hummus,"3 tablespoons chopped roasted garlic , ¼ cup chopped red onion , 2 (15 ounce) cans garbanzo beans, drained , 1 ½ teaspoons dried sage , 1 ½ teaspoons dried basil , 1 ½ teaspoons dried oregano , 1 ½ teaspoons dried parsley , 1 tablespoon lemon juice , 1 tablespoon olive oil",total fat: 2.6g saturated fat: 0.3g cholesterol: 0mg sodium: 211mg potassium: 158mg carbohydrates: 17.9g fiber: 3.5g sugar: 0g protein: 3.8g exchange other carbs: 1 vitamin a iu: 70IU niacin equivalents: 1mg vitamin b6: 0mg vitamin c: 5mg folate: 50mcg calcium: 41mg iron: 1mg magnesium: 23mg thiamin: 0mg,8
399,Best Soup This Side Of The Mississippi,"1 pound dry black-eyed peas , 1 (5 ounce) can ham , 1 carrot, chopped , 1 small onion, chopped , salt and pepper to taste",total fat: 2.7g saturated fat: 0.9g cholesterol: 6mg sodium: 171mg potassium: 479mg carbohydrates: 23.8g fiber: 4.3g sugar: 3g protein: 10.9g exchange other carbs: 2 vitamin a iu: 868IU niacin equivalents: 3mg vitamin b6: 0mg vitamin c: 2mg folate: 242mcg calcium: 45mg iron: 3mg magnesium: 72mg thiamin: 0mg,12
400,Tuna and Mandarin Salad,"1 tablespoon olive oil,1 (5 ounce) can tuna, drained and flaked,1 (10 ounce) package mixed baby greens,1 Granny Smith apple - peeled, cored and diced,1 (11 ounce) can mandarin orange segments, drained",Total Fat: 3.8gSaturated Fat: 1.0gCholesterol: 9mgSodium: 40mgPotassium: 353mgTotal Carbohydrates: 13.6gDietary Fiber: 2.1gProtein: 9.6gSugars: 11gVitamin A: 5935IUVitamin C: 41mgCalcium: 39mgIron: 1mgThiamin: 0mgNiacin: 7mgVitamin B6: 0mgMagnesium: 28mgFolate: 32mcg,4
401,Fruit Skewers with Apple Cinnamon Dipping Sauce,"½ cup vanilla Greek-style yogurt , 2 tablespoons applesauce (such as Mott's® Natural Applesauce) , ⅛ teaspoon almond extract , ⅛ teaspoon ground cinnamon , 1 cup seedless grapes , 1 cup fresh strawberries , 1 cup apple chunks , 1 cup pineapple chunks , 8 (6 inch) wooden skewers",total fat: 1.3g saturated fat: 0.7g cholesterol: 2mg sodium: 9mg potassium: 252mg carbohydrates: 26.2g fiber: 2.6g sugar: 23g protein: 2.5g exchange other carbs: 2 vitamin a iu: 78IU niacin equivalents: 1mg vitamin b6: 0mg vitamin c: 35mg folate: 15mcg calcium: 23mg iron: 0mg magnesium: 18mg thiamin: 0mg,4
402,Cinnamon Sugar Snap Peas,"1 (8 ounce) package sugar snap peas , 1 teaspoon olive oil, or to taste , sea salt and freshly ground black pepper to taste , ½ teaspoon ground cinnamon, or to taste , ½ teaspoon white sugar, or to taste",total fat: 2.4g saturated fat: 0.3g cholesterol: 0mg sodium: 160mg potassium: 4mg carbohydrates: 11.1g fiber: 3g sugar: 1g protein: 2.8g exchange other carbs: 1 vitamin a iu: 275IU niacin equivalents: 0mg vitamin b6: 0mg vitamin c: 12mg folate: 0mcg calcium: 61mg iron: 3mg magnesium: 3mg thiamin: 0mg,2
403,One-Ingredient Sorbet,"12 fresh strawberries, hulled and chopped,5 bananas, peeled and chopped",Total Fat: 0.4gSaturated Fat: 0.0gCholesterol: 0mgSodium: 1mgPotassium: 407mgTotal Carbohydrates: 25.2gDietary Fiber: 3.3gProtein: 1.3gSugars: 14gVitamin A: 67IUVitamin C: 30mgCalcium: 11mgIron: 0mgThiamin: 0mgNiacin: 1mgVitamin B6: 0mgMagnesium: 31mgFolate: 28mcg,6
404,Baked Banana Chips,"2 just-ripe bananas, sliced in 1/10-inch-thick rounds, or more as needed , 1 teaspoon lemon juice, or to taste",total fat: 0.4g saturated fat: 0.1g cholesterol: 0mg sodium: 1mg potassium: 426mg carbohydrates: 27.2g fiber: 3.1g sugar: 14g protein: 1.3g exchange other carbs: 2 vitamin a iu: 76IU niacin equivalents: 1mg vitamin b6: 0mg vitamin c: 12mg folate: 24mcg calcium: 6mg iron: 0mg magnesium: 32mg thiamin: 0mg,2
405,Grown-Up Dole® Whip,"2 cups diced frozen pineapple,2 (1.5 fluid ounce) jiggers coconut-flavored vodka,1 tablespoon chilled low-fat coconut milk, or as needed",Total Fat: 0.9gSaturated Fat: 0.0gCholesterol: 0mgSodium: 3mgPotassium: 180mgTotal Carbohydrates: 21.8gDietary Fiber: 2.3gProtein: 1gSugars: 16gVitamin A: 96IUVitamin C: 79mgCalcium: 21mgIron: 0mgThiamin: 0mgNiacin: 1mgVitamin B6: 0mgMagnesium: 20mgFolate: 30mcg,2
406,Quick and Tart Cabbage Side Salad,"2 cups coleslaw mix,1 tomato, diced small,1/2 cucumber, diced small,1 tablespoon rice vinegar,1 teaspoon Dijon mustard,1/2 teaspoon agave nectar,salt and ground black pepper to taste",Total Fat: 2.1gSaturated Fat: 0.0gCholesterol: 6mgSodium: 84mgPotassium: 405mgTotal Carbohydrates: 16gDietary Fiber: 2.4gProtein: 2gSugars: 4gVitamin A: 947IUVitamin C: 34mgCalcium: 50mgIron: 1mgThiamin: 0mgNiacin: 1mgVitamin B6: 0mgMagnesium: 24mgFolate: 35mcg,2
407,Lemon Pea Salad,"1 cup raw peas,1/2 lemon, juiced,salt and ground black pepper to taste",Total Fat: 0.2gSaturated Fat: 0.0gCholesterol: 0mgSodium: 159mgPotassium: 224mgTotal Carbohydrates: 9.3gDietary Fiber: 2.6gProtein: 2.8gSugars: 4gVitamin A: 1070IUVitamin C: 69mgCalcium: 44mgIron: 2mgThiamin: 0mgNiacin: 1mgVitamin B6: 0mgMagnesium: 25mgFolate: 44mcg,1
408,Tomato Freekeh,"1 cup freekeh , 4 cups vegetable broth , 1 cup water , 1 tablespoon olive oil , 2 tablespoons tomato paste , ½ teaspoon paprika , ¼ teaspoon cumin , ¼ teaspoon ground turmeric , salt and ground black pepper to taste",total fat: 3.8g saturated fat: 0.3g cholesterol: 0mg sodium: 351mg potassium: 64mg carbohydrates: 27.4g fiber: 5.6g sugar: 3g protein: 5.5g exchange other carbs: 2 vitamin a iu: 851IU niacin equivalents: 0mg vitamin b6: 0mg vitamin c: 1mg folate: 1mcg calcium: 18mg iron: 1mg magnesium: 4mg thiamin: 0mg,6
409,Red Lentil Burgers,"1 1/2 cups hot water,1 cup red lentils,1 large onion, minced,1/4 cup chopped fresh cilantro,5 cloves garlic, minced,1 tablespoon spicy Dijon mustard, or more to taste,1 tablespoon ground cumin,1 teaspoon dried parsley,1 teaspoon garlic powder,1/2 teaspoon red pepper flakes,2 tablespoons all-purpose flour, or as needed,cooking spray",Total Fat: 1.1gSaturated Fat: 0.0gCholesterol: 0mgSodium: 106mgPotassium: 595mgTotal Carbohydrates: 38.9gDietary Fiber: 15.9gProtein: 14gSugars: 3gVitamin A: 401IUVitamin C: 8mgCalcium: 64mgIron: 5mgThiamin: 0mgNiacin: 4mgVitamin B6: 0mgMagnesium: 72mgFolate: 247mcg,4
410,Crunch's Lentil Salad,"2 1/2 cups water,1 cup lentils,1/2 cup bulgur,salt to taste,1 teaspoon olive oil,1 onion, chopped,3 cloves garlic, minced, or more to taste,3 roma (plum) tomatoes, seeded and diced, or more to taste,1 red bell pepper, chopped,1/4 cup balsamic vinegar, or to taste,2 tablespoons olive oil, or to taste",Total Fat: 4.5gSaturated Fat: 1.0gCholesterol: 0mgSodium: 10mgPotassium: 383mgTotal Carbohydrates: 25.7gDietary Fiber: 9.8gProtein: 7.9gSugars: 3gVitamin A: 670IUVitamin C: 24mgCalcium: 30mgIron: 2mgThiamin: 0mgNiacin: 3mgVitamin B6: 0mgMagnesium: 50mgFolate: 130mcg,8
411,Citrus Carrot Salad,"1 cup shredded carrots,1/4 cup raisins,1 teaspoon lemon juice,1 teaspoon lime juice,1 teaspoon white sugar,1 tablespoon miniature marshmallows (optional)",Total Fat: 0.2gSaturated Fat: 0.0gCholesterol: 0mgSodium: 43mgPotassium: 337mgTotal Carbohydrates: 23.6gDietary Fiber: 2.3gProtein: 1.2gSugars: 16gVitamin A: 9190IUVitamin C: 6mgCalcium: 29mgIron: 1mgThiamin: 0mgNiacin: 1mgVitamin B6: 0mgMagnesium: 14mgFolate: 12mcg,2
412,Corn and Jalapenos,"2 teaspoons olive oil , 1 large jalapeno pepper, minced , 2 tablespoons diced onion , 1 ½ cups frozen corn, thawed , salt and ground black pepper to taste , 1 tablespoon chopped fresh cilantro",total fat: 3.8g saturated fat: 0.5g cholesterol: 0mg sodium: 3mg potassium: 197mg carbohydrates: 18g fiber: 2.2g sugar: 3g protein: 2.6g exchange other carbs: 1 vitamin a iu: 262IU niacin equivalents: 2mg vitamin b6: 0mg vitamin c: 8mg folate: 34mcg calcium: 6mg iron: 0mg magnesium: 17mg thiamin: 0mg,3
413,Low-Fat Celery and Peas with Cream,"cooking spray , 1 celery rib with leaves, chopped , 1 cup frozen peas, thawed , ¼ cup low-fat plain Greek-style yogurt , 2 tablespoons fat-free milk , 1 tablespoon minced fresh parsley , 1 pinch white pepper",total fat: 1.3g saturated fat: 0.6g cholesterol: 2mg sodium: 224mg potassium: 541mg carbohydrates: 17.3g fiber: 5.4g sugar: 8g protein: 8.1g exchange other carbs: 1 vitamin a iu: 2418IU niacin equivalents: 3mg vitamin b6: 0mg vitamin c: 21mg folate: 98mcg calcium: 103mg iron: 2mg magnesium: 39mg thiamin: 0mg,2
414,Nancy's Fruit Salad,"1 cantaloupe - peeled, seeded, and cubed,2 red apples, thinly sliced,1 cup red grapes,1 (12 ounce) can mandarin oranges in juice,1/4 cup sweetened flaked coconut (optional)",Total Fat: 1gSaturated Fat: 1.0gCholesterol: 0mgSodium: 21mgPotassium: 323mgTotal Carbohydrates: 19.2gDietary Fiber: 2.1gProtein: 1.1gSugars: 17gVitamin A: 2730IUVitamin C: 44mgCalcium: 15mgIron: 0mgThiamin: 0mgNiacin: 1mgVitamin B6: 0mgMagnesium: 17mgFolate: 19mcg,8
415,Cider-Maple Roasted Roots,"1 ½ pounds slender carrots , 1 ½ pounds slender parsnips , ⅔ cup apple cider , 2 tablespoons apple cider vinegar , 2 tablespoons pure maple syrup , 2 tablespoons olive oil , 2 teaspoons chopped fresh thyme, plus more for garnish , 1 teaspoon cracked black pepper , ¼ teaspoon salt , ⅛ teaspoon cayenne pepper",total fat: 3.9g saturated fat: 0.5g cholesterol: 0mg sodium: 143mg potassium: 610mg carbohydrates: 29.8g fiber: 6.7g sugar: 14g protein: 1.9g exchange other carbs: 2 vitamin a iu: 14243IU niacin equivalents: 2mg vitamin b6: 0mg vitamin c: 20mg folate: 73mcg calcium: 64mg iron: 1mg magnesium: 37mg thiamin: 0mg,8
416,Vegan Granola Bars,"1 cup raisins , 1 ½ cups rolled oats , 1 chopped raw almonds , 1 banana , ¼ cup unsalted raw peanut butter , ½ teaspoon vanilla extract , 1 pinch salt , 1 tablespoon water (optional)",total fat: 4.8g saturated fat: 0.7g cholesterol: 0mg sodium: 39mg potassium: 284mg carbohydrates: 28.3g fiber: 2.9g sugar: 13g protein: 4.3g exchange other carbs: 2 vitamin a iu: 8IU niacin equivalents: 1mg vitamin b6: 0mg vitamin c: 2mg folate: 19mcg calcium: 21mg iron: 1mg magnesium: 42mg thiamin: 0mg,9
417,Easy Microwave Potatoes and Tuna,"1 pound small red potatoes, unpeeled,1/3 cup sliced green onions,1 small clove garlic, minced,1/3 cup white wine vinegar,1 (5 ounce) can Bumble Bee® Solid White Albacore Tuna in Water, drained and chunked,2 teaspoons olive oil,2 teaspoons Dijon mustard,Salt and pepper to taste,1 tablespoon chopped fresh parsley",Total Fat: 2.6gSaturated Fat: 0.0gCholesterol: 16mgSodium: 201mgPotassium: 549mgTotal Carbohydrates: 19.5gDietary Fiber: 2.2gProtein: 10.6gSugars: 1gVitamin A: 174IUVitamin C: 13mgCalcium: 21mgIron: 1mgThiamin: 0mgNiacin: 2mgVitamin B6: 0mgMagnesium: 27mgFolate: 27mcg,4
418,"Zucchini ""Ratatouille""","1 tablespoon olive oil , 1 ½ cups chopped onion , 1 cup (1-inch) pieces sweet bell pepper , 4 cups (1-inch) pieces zucchini , 1 ½ cups water , 1 (6 ounce) can tomato paste , 4 cloves garlic, crushed , ½ teaspoon dried oregano , salt and ground black pepper to taste",total fat: 2.7g saturated fat: 0.4g cholesterol: 0mg sodium: 237mg potassium: 628mg carbohydrates: 14.3g fiber: 3.4g sugar: 8g protein: 3.1g exchange other carbs: 1 vitamin a iu: 1385IU niacin equivalents: 2mg vitamin b6: 0mg vitamin c: 56mg folate: 47mcg calcium: 41mg iron: 1mg magnesium: 35mg thiamin: 0mg,6
419,Fresh Tomato Salsa Restaurant-Style,"4 large tomatoes, quartered and grated , 4 scallions (green onions), chopped , 1 clove garlic, pressed , 2 slices canned jalapeno pepper, finely chopped , ½ lime, juiced , 2 tablespoons chopped fresh cilantro, or to taste , ¼ teaspoon onion salt , salt to taste",total fat: 0.4g saturated fat: 0.1g cholesterol: 0mg sodium: 159mg potassium: 496mg carbohydrates: 9.6g fiber: 2.9g sugar: 5g protein: 2g exchange other carbs: 1 vitamin a iu: 1801IU niacin equivalents: 1mg vitamin b6: 0mg vitamin c: 29mg folate: 39mcg calcium: 35mg iron: 1mg magnesium: 25mg thiamin: 0mg,4
420,Kathy's Sauteed Kale,"1 tablespoon olive oil , 1 teaspoon minced garlic , 12 cups chopped kale , ¼ cup water , ½ teaspoon vegetable bouillon base (such as Better Than Bouillon® Vegetable Base), or more to taste , 1 splash soy sauce, or more to taste , 1 pinch ground black pepper, or more to taste",total fat: 2.4g saturated fat: 0.3g cholesterol: 0mg sodium: 85mg potassium: 455mg carbohydrates: 10.4g fiber: 2.1g sugar: 0g protein: 3.4g exchange other carbs: 1 vitamin a iu: 15453IU niacin equivalents: 2mg vitamin b6: 0mg vitamin c: 121mg folate: 29mcg calcium: 137mg iron: 2mg magnesium: 35mg thiamin: 0mg,8
