id,recipe_name,recipe_ingredients,recipe_nutrition,recipe_servings
362,Runaway Bay Jamaican Chicken,"1 large red onion , 3 cloves garlic , 1 habanero pepper, seeded , 1 tablespoon fresh ginger root , ¼ cup olive oil , ¼ cup brown sugar , 3 tablespoons red wine vinegar , 3 tablespoons orange juice concentrate, thawed , 1 teaspoon soy sauce , 2 teaspoons ground cinnamon , ½ teaspoon ground nutmeg , ¼ teaspoon ground cloves , ½ cup chopped cilantro , ½ teaspoon salt and pepper to taste , 6 skinless, boneless chicken breast halves",total fat: 12g saturated fat: 2.1g cholesterol: 67mg sodium: 309mg potassium: 359mg carbohydrates: 17g fiber: 1.2g sugar: 13g protein: 25.3g exchange other carbs: 1 vitamin a iu: 322IU niacin equivalents: 16mg vitamin b6: 1mg vitamin c: 16mg folate: 25mcg calcium: 43mg iron: 1mg magnesium: 33mg thiamin: 0mg,6
363,Taco Soup IV,"2 pounds ground beef , 1 onion, chopped , 1 (10.75 ounce) can tomato puree , 1 (15 ounce) can tomato sauce , 1 cup water , 1 (15 ounce) can pinto beans, drained and rinsed , 1 (15 ounce) can whole kernel corn, drained , 1 (1.25 ounce) package taco seasoning mix",total fat: 31.1g saturated fat: 12.4g cholesterol: 96mg sodium: 1093mg potassium: 779mg carbohydrates: 26g fiber: 4.4g sugar: 7g protein: 23.5g exchange other carbs: 2 vitamin a iu: 398IU niacin equivalents: 11mg vitamin b6: 0mg vitamin c: 9mg folate: 65mcg calcium: 45mg iron: 4mg magnesium: 55mg thiamin: 0mg,8
364,Hummingbird,"1 fluid ounce rum cream liqueur,1 fluid ounce coffee flavored liqueur,1 fluid ounce milk,1/2 fluid ounce strawberry flavored syrup,1/2 banana,1 cup crushed ice",,1
365,Gandule Rice,"1 cup vegetable oil , 3 pounds pork shoulder, cubed , 3 tablespoons achiote (annatto) seeds , 2 cups chopped onion , 2 cups chopped fresh cilantro , 12 cloves garlic, crushed , 2 tablespoons salt , 1 teaspoon ground black pepper , 2 (8 ounce) cans tomato sauce , 1 (15 ounce) can pigeon peas, drained , 15 ounces black olives, pitted and halved , 8 cups uncooked calrose rice, rinsed , 9 cups water",total fat: 27.6g saturated fat: 6.6g cholesterol: 48mg sodium: 1112mg potassium: 427mg carbohydrates: 71.7g fiber: 4.7g sugar: 2g protein: 18.6g exchange other carbs: 5 vitamin a iu: 481IU niacin equivalents: 10mg vitamin b6: 0mg vitamin c: 6mg folate: 207mcg calcium: 44mg iron: 6mg magnesium: 44mg thiamin: 1mg,20
366,Fresh Tasting Black Beans With Rice,"¾ cup uncooked white rice , 2 cups water , 1 (15 ounce) can black beans; drain and reserve liquid , 2 tablespoons lemon juice , 1 tablespoon garlic powder , 1 ½ teaspoons dried cilantro",total fat: 0.5g saturated fat: 0.1g cholesterol: 0mg sodium: 6mg potassium: 164mg carbohydrates: 60g fiber: 1.4g sugar: 1g protein: 5.8g exchange other carbs: 4 vitamin a iu: 29IU niacin equivalents: 4mg vitamin b6: 0mg vitamin c: 10mg folate: 164mcg calcium: 29mg iron: 3mg magnesium: 24mg thiamin: 0mg,2
367,Brazilian Passion Fruit Mousse (Maracuja),"8 passion fruits,1 tablespoon white sugar,1 (14 ounce) can sweetened condensed milk,2 cups cream",Total Fat: 35.2gSaturated Fat: 22.0gCholesterol: 131mgSodium: 120mgPotassium: 385mgTotal Carbohydrates: 45.4gDietary Fiber: 2.5gProtein: 7.3gSugars: 41gVitamin A: 1509IUVitamin C: 9mgCalcium: 240mgIron: 1mgThiamin: 0mgNiacin: 2mgVitamin B6: 0mgMagnesium: 30mgFolate: 14mcg,6
368,Anne's Homemade Chorizo,"2 pounds ground beef , 1 pound ground pork , ¾ cup chili powder , ¾ teaspoon dried oregano , 3 cloves garlic, minced , 2 teaspoons salt , ¾ cup dry red wine , ¼ cup white vinegar",total fat: 15.6g saturated fat: 5.7g cholesterol: 71mg sodium: 531mg potassium: 426mg carbohydrates: 5g fiber: 2.8g sugar: 1g protein: 20.4g exchange other carbs: 1 vitamin a iu: 2364IU niacin equivalents: 9mg vitamin b6: 1mg vitamin c: 6mg folate: 15mcg calcium: 38mg iron: 3mg magnesium: 32mg thiamin: 0mg,12
369,Oat Soup,"3 tablespoons olive oil,1 cup oats,5 large tomatoes, halved and sliced,1/3 cup onion, chopped,1 clove garlic, chopped,3 cups water, divided,1/2 bunch fresh cilantro,2 teaspoons chicken bouillon granules,1/2 teaspoon salt",Total Fat: 12.1gSaturated Fat: 2.0gCholesterol: < 1mgSodium: 493mgPotassium: 676mgTotal Carbohydrates: 24.6gDietary Fiber: 5.2gProtein: 5.2gSugars: 7gVitamin A: 2368IUVitamin C: 32mgCalcium: 45mgIron: 2mgThiamin: 0mgNiacin: 3mgVitamin B6: 0mgMagnesium: 57mgFolate: 48mcg,4
370,Tembleque Puerto Rican Coconut Pudding,"2 (14 ounce) cans coconut milk,3/4 cup sugar,1/4 teaspoon kosher salt,1/2 cup cornstarch,1 pinch ground cinnamon",Total Fat: 27.9gSaturated Fat: 25.0gCholesterol: 0mgSodium: 98mgPotassium: 289mgTotal Carbohydrates: 38.5gDietary Fiber: 1.6gProtein: 2.7gSugars: 25gVitamin A: 0IUVitamin C: 1mgCalcium: 26mgIron: 4mgThiamin: 0mgNiacin: 1mgVitamin B6: 0mgMagnesium: 61mgFolate: 18mcg,6
371,Chef John's Cuban Bread,"½ teaspoon active dry yeast , ½ cup warm water , ½ cup flour , 1 package active dry yeast , 2 teaspoons white sugar , ¾ cup warm water , 3 tablespoons lard , 2 teaspoons fine salt , 3 cups all-purpose flour, or as needed - divided , 1 tablespoon cornmeal , Water to spray tops of loaves",total fat: 3.6g saturated fat: 1.3g cholesterol: 3mg sodium: 389mg potassium: 55mg carbohydrates: 29.4g fiber: 1.2g sugar: 1g protein: 4.1g exchange other carbs: 2 vitamin a iu: 2IU niacin equivalents: 3mg vitamin b6: 0mg vitamin c: 0mg folate: 86mcg calcium: 7mg iron: 2mg magnesium: 9mg thiamin: 0mg,12
372,Chef John's Chicken Tinga,"3 pounds skinless, boneless chicken thighs , 3 peeled whole garlic cloves , 1 large yellow onion, halved , 2 teaspoons kosher salt, plus more to taste , ½ teaspoon dried oregano , 4 cups chicken stock , 1 cup water , 2 tablespoons olive oil , 1 large onion, diced , 1 (7 ounce) can chipotle peppers in adobo sauce , 1 (28 ounce) can peeled plum tomatoes (preferably San Marzano) , 2 tablespoons crumbled cotija cheese, or to taste , 3 tablespoons chopped fresh cilantro, or more to taste",total fat: 29.5g saturated fat: 7.8g cholesterol: 137mg sodium: 1915mg potassium: 592mg carbohydrates: 13.6g fiber: 3.3g sugar: 6g protein: 38.8g exchange other carbs: 1 vitamin a iu: 436IU niacin equivalents: 15mg vitamin b6: 0mg vitamin c: 17mg folate: 30mcg calcium: 107mg iron: 4mg magnesium: 51mg thiamin: 0mg,6
373,"Daddy Eddie's Roast Pork (Pernil), Puerto Rican-Style","¼ cup olive oil , 3 tablespoons white vinegar , 10 cloves garlic, or more to taste , 2 tablespoons dried oregano , 1 tablespoon salt , 1 ½ teaspoons ground black pepper , 5 pounds pork shoulder, trimmed of excess fat",total fat: 23.7g saturated fat: 6.9g cholesterol: 112mg sodium: 966mg potassium: 468mg carbohydrates: 2.2g fiber: 0.7g sugar: 0g protein: 31.8g exchange other carbs: 0 vitamin a iu: 88IU niacin equivalents: 12mg vitamin b6: 0mg vitamin c: 3mg folate: 9mcg calcium: 49mg iron: 3mg magnesium: 30mg thiamin: 1mg,8
374,Bacalao a la Vizcaina (Basque Style Codfish Stew),"1 pound salted cod fish,4 potatoes, sliced thick,2 onions, sliced,4 hard-boiled eggs, sliced,2 teaspoons capers,2 large cloves garlic, minced,1/4 cup pitted green olives,1 (4 ounce) jar roasted red bell peppers, drained,1/2 cup golden raisins,1 bay leaf,1 (8 ounce) can tomato sauce,1/2 cup extra virgin olive oil,1 cup water,1/4 cup white wine",Total Fat: 18.9gSaturated Fat: 3.0gCholesterol: 192mgSodium: 4353mgPotassium: 1521mgTotal Carbohydrates: 31.6gDietary Fiber: 3.8gProtein: 42.3gSugars: 9gVitamin A: 916IUVitamin C: 36mgCalcium: 139mgIron: 3mgThiamin: 0mgNiacin: 14mgVitamin B6: 1mgMagnesium: 115mgFolate: 51mcg,8
375,Baja Style Fish Tacos,"6 tomatoes, diced,1 small onion, diced,1/2 cup chopped fresh cilantro,2 tablespoons canned diced jalapeno peppers, or more to taste (juice reserved),1/2 teaspoon garlic salt,1/2 lime, juiced,3 cups coleslaw mix,3 tablespoons ranch dressing,2 cups vegetable oil for frying,1 (9 ounce) box batter mix (such as Shore Lunch®),1 (12 fluid ounce) can or bottle Mexican beer,24 corn tortillas,1 pound cod fillets, cut into 2-inch chunks,2 cups shredded Mexican cheese blend,2 limes, sliced into wedges,1 dash chile-garlic sauce (such as Sriracha®) (optional)",Total Fat: 17.6gSaturated Fat: 7.0gCholesterol: 39mgSodium: 443mgPotassium: 482mgTotal Carbohydrates: 50.8gDietary Fiber: 5.3gProtein: 16gSugars: 3gVitamin A: 1039IUVitamin C: 19mgCalcium: 223mgIron: 2mgThiamin: 0mgNiacin: 3mgVitamin B6: 0mgMagnesium: 57mgFolate: 24mcg,12
376,Aracely's Flan,"10 egg yolks,1 (14 ounce) can sweetened condensed milk,1 (12 ounce) can evaporated milk,3 tablespoons margarine,3 tablespoons brown sugar",Total Fat: 13.6gSaturated Fat: 6.0gCholesterol: 228mgSodium: 132mgPotassium: 274mgTotal Carbohydrates: 29.4gDietary Fiber: 0gProtein: 8.1gSugars: 29gVitamin A: 564IUVitamin C: 2mgCalcium: 226mgIron: 1mgThiamin: 0mgNiacin: 2mgVitamin B6: 0mgMagnesium: 20mgFolate: 31mcg,10
377,Cuban Mojito,"2 teaspoons white sugar,1 lime, cut into 4 wedges,4 sprigs fresh mint,1/2 cup white rum,2 cups club soda,2 cups crushed ice,2 wedges lime, as garnish",,2
378,Feijoada (Brazilian Black Bean Stew),"1 (12 ounce) package dry black beans, soaked overnight , 1 ½ cups chopped onion, divided , ½ cup green onions, chopped , 1 clove garlic, chopped , 2 smoked ham hocks , 8 ounces diced ham , ½ pound thickly sliced bacon, diced , 1 tablespoon olive oil , 2 bay leaves, crushed , ⅛ teaspoon ground coriander , salt and pepper to taste , ½ cup chopped fresh cilantro (optional) , ¼ cup chopped fresh parsley (optional)",total fat: 18g saturated fat: 5.7g cholesterol: 52mg sodium: 450mg potassium: 956mg carbohydrates: 31g fiber: 7.5g sugar: 2g protein: 24.1g exchange other carbs: 2 vitamin a iu: 427IU niacin equivalents: 9mg vitamin b6: 0mg vitamin c: 8mg folate: 207mcg calcium: 77mg iron: 3mg magnesium: 95mg thiamin: 1mg,8
379,Pork Empanadas,"2 pounds pork butt roast , 1 onion, quartered , 2 cloves garlic , ½ teaspoon salt , 1 teaspoon dried oregano , 1 teaspoon ground cumin , 2 bay leaves , 1 ½ cups all-purpose flour , ¾ cup masa harina , 1 teaspoon baking powder , ¼ teaspoon salt , ½ cup lard , 1 egg, beaten , ½ cup milk , 1 cup chipotle salsa",total fat: 12.6g saturated fat: 4.7g cholesterol: 41mg sodium: 270mg potassium: 191mg carbohydrates: 15.4g fiber: 1.5g sugar: 1g protein: 8.5g exchange other carbs: 1 vitamin a iu: 100IU niacin equivalents: 4mg vitamin b6: 0mg vitamin c: 1mg folate: 39mcg calcium: 48mg iron: 2mg magnesium: 18mg thiamin: 0mg,16
380,Caipirinha,"1/2 lime, quartered,1 teaspoon white sugar,2 1/2 fluid ounces cachaca,1 cup ice cubes",,1
381,Mexican Sugar Cookies,"2 ½ cups shortening , 1 cup white sugar , 1 teaspoon anise seed, ground , 2 eggs , 6 cups all-purpose flour , 1 tablespoon baking powder , ½ tablespoon cream of tartar , ½ teaspoon salt , ¼ cup orange juice , 3 tablespoons ground cinnamon , 1 cup white sugar",total fat: 44.2g saturated fat: 11g cholesterol: 31mg sodium: 232mg potassium: 161mg carbohydrates: 83.6g fiber: 2.6g sugar: 34g protein: 7.6g exchange other carbs: 6 vitamin a iu: 57IU niacin equivalents: 5mg vitamin b6: 0mg vitamin c: 3mg folate: 120mcg calcium: 101mg iron: 3mg magnesium: 17mg thiamin: 1mg,12
382,Chicken and Red Bell Pepper Salad Sandwiches,"2 skinless, boneless chicken breast halves , ½ red bell pepper, seeded , ¼ cup mayonnaise , 1 tablespoon heavy cream , salt and pepper to taste , 4 slices white bread",total fat: 32g saturated fat: 6.9g cholesterol: 78mg sodium: 548mg potassium: 257mg carbohydrates: 28.2g fiber: 1.8g sugar: 4g protein: 25.3g exchange other carbs: 2 vitamin a iu: 1180IU niacin equivalents: 9mg vitamin b6: 1mg vitamin c: 38mg folate: 73mcg calcium: 94mg iron: 3mg magnesium: 33mg thiamin: 0mg,2
383,Slow Cooker Machaca,"3 pounds beef rump roast , 3 pounds pork loin roast , 2 teaspoons salt , 1 teaspoon ground black pepper , 2 (14.5 ounce) cans green enchilada sauce , 2 (4 ounce) cans diced green chiles",total fat: 32.5g saturated fat: 11.7g cholesterol: 170mg sodium: 1074mg potassium: 1220mg carbohydrates: 6.9g fiber: 1.2g sugar: 1g protein: 57.3g exchange other carbs: 1 vitamin a iu: 512IU niacin equivalents: 23mg vitamin b6: 2mg vitamin c: 21mg folate: 17mcg calcium: 39mg iron: 4mg magnesium: 78mg thiamin: 1mg,10
384,Caribbean-Spiced Pork Side Ribs,"2 tablespoons brown sugar , 2 teaspoons fresh ginger root, grated , ¼ teaspoon cayenne pepper , ¼ teaspoon ground clove , ½ teaspoon ground cinnamon , 1 teaspoon paprika , 1 teaspoon dried oregano , 2 teaspoons black pepper , 1 teaspoon salt , 2 limes, zested and juiced , 1 cup orange juice , 1 rack pork spareribs, cut in half",total fat: 40.4g saturated fat: 14.8g cholesterol: 160mg sodium: 514mg potassium: 563mg carbohydrates: 12.3g fiber: 1.3g sugar: 8g protein: 39.2g exchange other carbs: 1 vitamin a iu: 359IU niacin equivalents: 16mg vitamin b6: 1mg vitamin c: 28mg folate: 21mcg calcium: 89mg iron: 3mg magnesium: 42mg thiamin: 1mg,6
385,Mexican Wedding Cakes I,"¾ cup sifted confectioners' sugar , 1 cup butter, softened , 2 teaspoons vanilla extract , 1 teaspoon ground cinnamon , 1 cup ground blanched almonds , 2 ½ cups sifted all-purpose flour",total fat: 8.7g saturated fat: 4.1g cholesterol: 16mg sodium: 45mg potassium: 47mg carbohydrates: 12.1g fiber: 0.8g sugar: 3g protein: 2.2g exchange other carbs: 1 vitamin a iu: 190IU niacin equivalents: 1mg vitamin b6: 0mg vitamin c: 0mg folate: 21mcg calcium: 15mg iron: 1mg magnesium: 16mg thiamin: 0mg,30
386,Caribbean Chicken,"1 teaspoon paprika , 1 teaspoon onion powder , 1 teaspoon garlic powder , 1 teaspoon dried parsley , ½ teaspoon dried oregano , 1 teaspoon salt , 1 teaspoon pepper , 4 boneless, skinless chicken breast halves , ¼ cup duck sauce , ¼ cup marinara sauce , 1 teaspoon mango hot sauce , ¾ cup fresh pink grapefruit juice, divided , 1 cup Italian seasoned bread crumbs , 1 ripe nectarine, pitted and sliced",total fat: 3.7g saturated fat: 0.5g cholesterol: 68mg sodium: 1239mg potassium: 517mg carbohydrates: 37.8g fiber: 2.4g sugar: 12g protein: 32.9g exchange other carbs: 3 vitamin a iu: 723IU niacin equivalents: 19mg vitamin b6: 1mg vitamin c: 23mg folate: 15mcg calcium: 73mg iron: 3mg magnesium: 47mg thiamin: 0mg,4
387,Spicy Shrimp Tacos,"8 Mission® Small/Fajita Super Soft Flour Tortillas,1 pound medium shrimp, peeled and deveined,1 teaspoon salt,1/4 teaspoon ground black pepper,1/4 teaspoon crushed red pepper flakes,2 tablespoons fresh lime juice,1 tablespoon olive oil,1/2 cup diced fresh mango,1/2 cup diced red onion,1/2 cup fresh cilantro, coarsely chopped,1 tablespoon Sriracha sauce,1/2 cup Ranch dressing,Fresh lime wedges, as needed",Total Fat: 44.1gSaturated Fat: 8.0gCholesterol: 361mgSodium: 2750mgPotassium: 291mgTotal Carbohydrates: 43.2gDietary Fiber: 2.5gProtein: 46.5gSugars: 5gVitamin A: 937IUVitamin C: 17mgCalcium: 59mgIron: 3mgThiamin: 0mgNiacin: 7mgVitamin B6: 0mgMagnesium: 37mgFolate: 16mcg,4
388,Horchata de Arroz (Rice Drink),"1 cup uncooked long grain white rice,3 1/2 cups cold water,1 (12 fluid ounce) can evaporated milk,1/2 cup white sugar,1/2 teaspoon ground cinnamon,1 teaspoon vanilla extract",Total Fat: 7.5gSaturated Fat: 4.0gCholesterol: 27mgSodium: 109mgPotassium: 345mgTotal Carbohydrates: 71.8gDietary Fiber: 0.8gProtein: 9.7gSugars: 35gVitamin A: 221IUVitamin C: 2mgCalcium: 269mgIron: 2mgThiamin: 0mgNiacin: 4mgVitamin B6: 0mgMagnesium: 37mgFolate: 114mcg,4
389,Tex-Mex Enchiladas,"2 (11.25 ounce) cans chili without beans,1 cup enchilada sauce,1/2 cup vegetable oil,1 tablespoon chili powder,15 corn tortillas,1 pound shredded Cheddar cheese,1 onion, chopped",Total Fat: 59gSaturated Fat: 24.0gCholesterol: 108mgSodium: 1776mgPotassium: 1007mgTotal Carbohydrates: 69.1gDietary Fiber: 10gProtein: 35.1gSugars: 10gVitamin A: 3094IUVitamin C: 13mgCalcium: 789mgIron: 5mgThiamin: 0mgNiacin: 9mgVitamin B6: 1mgMagnesium: 123mgFolate: 47mcg,5
390,Cuban-Style Pork and Sweet Potatoes,"1 ½ pounds sweet potatoes, cut into 1/2-inch cubes , 1 pound pork, cut into 1-inch squares , 1 (15 ounce) can diced tomatoes with green chile peppers , ¼ cup orange juice , 1 ½ tablespoons lime juice , 2 cloves garlic, pressed , ¼ teaspoon ground cumin , ¼ teaspoon salt , ¼ teaspoon ground black pepper , ¼ cup chopped fresh cilantro, or to taste",total fat: 9.7g saturated fat: 3.3g cholesterol: 48mg sodium: 483mg potassium: 769mg carbohydrates: 27.3g fiber: 4.3g sugar: 6g protein: 17.4g exchange other carbs: 2 vitamin a iu: 16538IU niacin equivalents: 8mg vitamin b6: 1mg vitamin c: 15mg folate: 24mcg calcium: 68mg iron: 2mg magnesium: 55mg thiamin: 1mg,6
391,Canja,"3 pounds boneless, skinless chicken meat,1 onion, chopped,6 cups chicken stock,1/4 cup long-grain white rice,3/4 cup tomato - peeled, seeded and chopped,1/2 cup chopped carrots,salt to taste,ground black pepper to taste,3/4 cup diced ham,1 tablespoon chopped fresh parsley",Total Fat: 27.2gSaturated Fat: 8.0gCholesterol: 165mgSodium: 1306mgPotassium: 635mgTotal Carbohydrates: 11.4gDietary Fiber: 1gProtein: 50.4gSugars: 3gVitamin A: 2247IUVitamin C: 6mgCalcium: 39mgIron: 2mgThiamin: 0mgNiacin: 31mgVitamin B6: 1mgMagnesium: 62mgFolate: 37mcg,6
392,Colombian Stewed Flank,"2 tablespoons corn oil , 1 pound flank steak , 1 large Spanish onion, thinly sliced , 4 large cloves garlic, chopped , 5 Roma tomatoes, chopped , ½ teaspoon salt , 2 teaspoons black pepper, or to taste , 1 ½ teaspoons ground cumin , 2 ½ cups water , 2 cubes beef bouillon, crumbled",total fat: 15.6g saturated fat: 4.4g cholesterol: 36mg sodium: 770mg potassium: 466mg carbohydrates: 9.2g fiber: 2.1g sugar: 5g protein: 15.4g exchange other carbs: 1 vitamin a iu: 659IU niacin equivalents: 6mg vitamin b6: 0mg vitamin c: 14mg folate: 23mcg calcium: 45mg iron: 3mg magnesium: 32mg thiamin: 0mg,4
393,Hot Banana Salsa,"1 large firm banana, peeled and diced , ½ cup red bell pepper, seeded and diced , ½ cup green bell pepper, seeded and diced , ½ cup yellow bell pepper, seeded and diced , 3 tablespoons chopped fresh cilantro , 2 green onions, chopped , 2 tablespoons fresh lime juice , 1 tablespoon brown sugar , 2 teaspoons minced fresh ginger root , 2 teaspoons olive oil , 1 teaspoon minced habanero pepper , salt to taste",total fat: 0.4g saturated fat: 0.1g cholesterol: 0mg sodium: 1mg potassium: 47mg carbohydrates: 2.6g fiber: 0.3g sugar: 2g protein: 0.2g exchange other carbs: 0 vitamin a iu: 157IU niacin equivalents: 0mg vitamin b6: 0mg vitamin c: 13mg folate: 5mcg calcium: 3mg iron: 0mg magnesium: 3mg thiamin: 0mg,24
394,Mexican Atole,"1/2 cup masa (corn flour),5 cups water,1 tablespoon ground cinnamon,5 tablespoons piloncillo, brown sugar cones,1 tablespoon vanilla extract",Total Fat: 0.4gSaturated Fat: 0.0gCholesterol: 0mgSodium: 8mgPotassium: 46mgTotal Carbohydrates: 14.1gDietary Fiber: 2.3gProtein: 1.1gSugars: 4gVitamin A: 28IUVitamin C: 0mgCalcium: 37mgIron: 1mgThiamin: 0mgNiacin: 1mgVitamin B6: 0mgMagnesium: 16mgFolate: 27mcg,5
395,Mexican Pintos with Cactus,"2 cups dry pinto beans, rinsed , 3 tablespoons salt, divided , 3 slices bacon, chopped , 2 large flat cactus leaves (nopales) , 1 jalapeno pepper, seeded and chopped , 2 slices onion",total fat: 1.6g saturated fat: 0.5g cholesterol: 3mg sodium: 2162mg potassium: 590mg carbohydrates: 25.2g fiber: 6.3g sugar: 1g protein: 9.5g exchange other carbs: 2 vitamin a iu: 41IU niacin equivalents: 3mg vitamin b6: 0mg vitamin c: 5mg folate: 205mcg calcium: 59mg iron: 2mg magnesium: 74mg thiamin: 0mg,10
396,Cuban Water Bread,"2 ¼ teaspoons active dry yeast , 2 cups warm water (110 degrees F/45 degrees C) , 1 tablespoon white sugar , 1 tablespoon salt , 8 cups all-purpose flour , 1 tablespoon cornmeal , 1 tablespoon sesame seeds (optional) , 2 tablespoons cold water",total fat: 0.6g saturated fat: 0.1g cholesterol: 0mg sodium: 292mg potassium: 54mg carbohydrates: 32.8g fiber: 1.3g sugar: 1g protein: 4.5g exchange other carbs: 2 vitamin a iu: 1IU niacin equivalents: 4mg vitamin b6: 0mg vitamin c: 0mg folate: 86mcg calcium: 10mg iron: 2mg magnesium: 11mg thiamin: 0mg,24
397,Bahamian Style Peas and Rice,"¼ cup butter , 2 ounces sliced bacon, diced , 1 large onion, diced , 1 stalk celery, diced , 1 large tomato, diced , ½ (6 ounce) can tomato paste , 1 tablespoon ketchup , salt and pepper to taste , 1 (15 ounce) can pigeon peas, with liquid , 1 ⅔ cups water , 1 ½ cups uncooked long-grain white rice , 1 sprig fresh thyme, chopped",total fat: 19.2g saturated fat: 9.8g cholesterol: 40mg sodium: 746mg potassium: 716mg carbohydrates: 80.7g fiber: 6.6g sugar: 6g protein: 13.6g exchange other carbs: 6 vitamin a iu: 1162IU niacin equivalents: 7mg vitamin b6: 0mg vitamin c: 17mg folate: 236mcg calcium: 74mg iron: 5mg magnesium: 70mg thiamin: 1mg,4
398,Coquito II,"6 egg yolks,1/2 teaspoon ground cinnamon,4 tablespoons vanilla extract,1 (14 ounce) can sweetened condensed milk,5 (12 fluid ounce) cans evaporated milk,1 (10 ounce) can unsweetened coconut milk,1 (14 ounce) can sweetened cream of coconut (such as Coco Lopez®),4 1/4 cups light rum",,16
399,Home-style Tacos al Pastor (Chile and Pineapple Pork Tacos),"For the pork:,5 Goya Guajillo Chiles,5 Goya Pasilla Chiles or Goya Ancho Chiles,1 chipotle pepper from a can of Goya Chipotle Chile in Adobo Sauce,1 medium white onion, halved,1 (20 ounce) can Goya Pineapple Chunks,1/4 cup Goya White Vinegar,2 tablespoons Goya Minced Garlic,1 teaspoon Goya Cumin,Goya Adobo with Pepper, to taste,1 (2 1/2 pound) boneless, skinless pork butt, cut into 1/2-inch cubes,2 tablespoons Goya Vegetable Oil,For the garnish:,1 (10 ounce) package Goya Corn Tortillas, warmed,2 tablespoons finely chopped fresh cilantro,1 lime, cut into wedges",,6
400,Dark 'n' Stormy Cocktail,"2 fluid ounces dark rum,4 fluid ounces ginger beer,1/2 cup ice",Total Fat: 0gSaturated Fat: 0.0gCholesterol: 0mgSodium: 6mgPotassium: 2mgTotal Carbohydrates: 13.2gDietary Fiber: 0gProtein: 0gSugars: 13gVitamin A: 0IUVitamin C: 0mgCalcium: 4mgIron: 0mgThiamin: 0mgNiacin: 0mgVitamin B6: 0mgMagnesium: 1mgFolate: 0mcg,1
401,Pollo Oaxaca,"3 tablespoons vegetable oil , 3 pounds chicken, cut into pieces , 1 ½ tablespoons dried oregano , 2 cloves minced garlic , salt and pepper to taste , 1 onion, sliced , 10 fresh tomatillos, husks removed , ½ bunch cilantro , 2 jalapeno pepper, seeds and ribs removed , 2 cloves garlic , 1 lime, juiced , salt to taste , ½ cup shredded Monterey Jack cheese",total fat: 44.7g saturated fat: 12.8g cholesterol: 179mg sodium: 214mg potassium: 688mg carbohydrates: 8.1g fiber: 2.5g sugar: 3g protein: 45.8g exchange other carbs: 1 vitamin a iu: 891IU niacin equivalents: 25mg vitamin b6: 1mg vitamin c: 19mg folate: 32mcg calcium: 132mg iron: 3mg magnesium: 67mg thiamin: 0mg,6
402,Easy Pina Colada French Toast,"8 eggs,2/3 cup milk,1/2 cup bottled pina colada drink mix,1 tablespoon butter, or as needed,12 (1/2 inch thick) slices French bread,2 bananas, sliced",Total Fat: 10.5gSaturated Fat: 4.0gCholesterol: 255mgSodium: 445mgPotassium: 349mgTotal Carbohydrates: 43.5gDietary Fiber: 2.3gProtein: 15.7gSugars: 12gVitamin A: 461IUVitamin C: 5mgCalcium: 93mgIron: 3mgThiamin: 0mgNiacin: 6mgVitamin B6: 0mgMagnesium: 37mgFolate: 117mcg,6
403,Mango Guacamole,"2 tablespoons minced white onion , 2 limes, juiced , 2 serrano chile peppers, or to taste , 2 limes, juiced , sea salt to taste , 4 ripe avocados, peeled and pitted , ¼ cup chopped fresh cilantro , 1 large mango - peeled, seeded, and chopped",total fat: 14.9g saturated fat: 2.2g cholesterol: 0mg sodium: 49mg potassium: 598mg carbohydrates: 19g fiber: 8.5g sugar: 7g protein: 2.5g exchange other carbs: 2 vitamin a iu: 568IU niacin equivalents: 3mg vitamin b6: 0mg vitamin c: 32mg folate: 91mcg calcium: 29mg iron: 1mg magnesium: 36mg thiamin: 0mg,8
404,Bolivian Saltenas,"1 (.25 ounce) package unflavored gelatin , 3 potatoes, peeled , 1 ½ tablespoons olive oil , 1 onion, chopped , 1 ½ pounds ground beef , 1 (10 ounce) package frozen petite peas, thawed , 1 spring onion, sliced , ½ cup fresh parsley, chopped , 4 teaspoons white sugar , 2 teaspoons paprika , ¼ teaspoon ground cumin , 1 ½ teaspoons salt , ¼ teaspoon black pepper , 3 tablespoons jalapeno sauce (optional) , ½ cup cold water , 3 hard-cooked eggs, peeled and chopped , 1 (2.25 ounce) can sliced black olives, drained , 1 cup raisins, soaked in water and drained , 6 cups all-purpose flour , ¼ cup white sugar , 1 teaspoon salt , 1 cup butter, cubed , 1 ½ cups hot water , 2 eggs, beaten , 2 teaspoons water , 1 tablespoon paprika",total fat: 20.3g saturated fat: 10g cholesterol: 108mg sodium: 551mg potassium: 480mg carbohydrates: 59g fiber: 4g sugar: 12g protein: 16.6g exchange other carbs: 4 vitamin a iu: 1347IU niacin equivalents: 9mg vitamin b6: 0mg vitamin c: 17mg folate: 119mcg calcium: 48mg iron: 4mg magnesium: 39mg thiamin: 0mg,16
405,Lisa's Jerk Chicken,"1 cup orange juice , 1 cup white vinegar , ½ cup olive oil , ½ cup soy sauce , 1 lime, juiced , 3 onions, chopped , 6 Scotch bonnet chiles, chopped (wear gloves) , 8 cloves garlic, chopped , 2 tablespoons white sugar , 2 tablespoons dried thyme , 2 tablespoons ground allspice , 2 tablespoons salt , 2 teaspoons ground black pepper , 1 teaspoon ground cinnamon, or more to taste , 1 teaspoon ground nutmeg, or more to taste , 1 teaspoon ground ginger, or more to taste , 3 pounds bone-in chicken breast halves with skin",total fat: 23g saturated fat: 4.6g cholesterol: 96mg sodium: 2734mg potassium: 572mg carbohydrates: 20.4g fiber: 3.2g sugar: 10g protein: 36.8g exchange other carbs: 2 vitamin a iu: 269IU niacin equivalents: 22mg vitamin b6: 1mg vitamin c: 29mg folate: 38mcg calcium: 88mg iron: 4mg magnesium: 59mg thiamin: 0mg,8
