id,recipe_name,recipe_ingredients,recipe_nutrition,recipe_servings
240,Mexican Bean and Rice Salad,"2 cups cooked brown rice,1 (15 ounce) can kidney beans, rinsed and drained,1 (15 ounce) can black beans, rinsed and drained,1 (15.25 ounce) can whole kernel corn, drained,1 small onion, diced,1 green bell pepper, diced,2 jalapeno peppers, seeded and diced,1 lime, zested and juiced,1/4 cup chopped cilantro leaves,1 teaspoon minced garlic,1 1/2 teaspoons ground cumin,salt to taste",Total Fat: 1gSaturated Fat: 0.0gCholesterol: 0mgSodium: 220mgPotassium: 145mgTotal Carbohydrates: 26gDietary Fiber: 4.8gProtein: 4.7gSugars: 2gVitamin A: 171IUVitamin C: 14mgCalcium: 28mgIron: 1mgThiamin: 0mgNiacin: 1mgVitamin B6: 0mgMagnesium: 28mgFolate: 25mcg,10
241,Mexican Casserole,"1 (16 ounce) can refried beans , ¾ onion, diced , 5 (10 inch) flour tortillas , 1 cup salsa , 2 cups shredded Cheddar or Colby Jack cheese",total fat: 20.3g saturated fat: 12.5g cholesterol: 68mg sodium: 1505mg potassium: 697mg carbohydrates: 74g fiber: 10.3g sugar: 4g protein: 29.3g exchange other carbs: 5 vitamin a iu: 755IU niacin equivalents: 8mg vitamin b6: 0mg vitamin c: 9mg folate: 139mcg calcium: 581mg iron: 6mg magnesium: 88mg thiamin: 1mg,4
242,Mexican Rice,"3 tablespoons vegetable oil , ⅔ cup diced onion , 1 ½ cups uncooked white rice , 1 cup chopped green bell pepper , 1 teaspoon ground cumin , 1 teaspoon chili powder , 1 ½ (8 ounce) cans tomato sauce , 2 teaspoons salt , 1 clove garlic, minced , ⅛ teaspoon powdered saffron , 3 cups water",total fat: 5.6g saturated fat: 0.8g cholesterol: 0mg sodium: 809mg potassium: 236mg carbohydrates: 33.8g fiber: 1.8g sugar: 3g protein: 3.4g exchange other carbs: 3 vitamin a iu: 317IU niacin equivalents: 3mg vitamin b6: 0mg vitamin c: 19mg folate: 94mcg calcium: 21mg iron: 2mg magnesium: 25mg thiamin: 0mg,8
243,Tomato Enchilada Bake,"3 cups cooked chicken meat , 1 cup sour cream , 1 (14.5 ounce) can diced tomatoes , 1 teaspoon chili powder , ¼ cup chopped onion , 2 green onions, chopped , 1 tomato, diced , 1 (6.5 ounce) can canned tomato sauce , ½ cup salsa , 2 teaspoons chili powder , ¼ teaspoon dried oregano , ¼ teaspoon dried parsley , 8 (8 inch) flour tortillas , 6 ounces shredded Cheddar cheese , 1 (2 ounce) can chopped black olives, drained",total fat: 42.2g saturated fat: 20.4g cholesterol: 157mg sodium: 1577mg potassium: 967mg carbohydrates: 70.1g fiber: 7.1g sugar: 7g protein: 52.4g exchange other carbs: 5 vitamin a iu: 2931IU niacin equivalents: 21mg vitamin b6: 1mg vitamin c: 19mg folate: 161mcg calcium: 505mg iron: 9mg magnesium: 88mg thiamin: 1mg,4
244,Chicken Taco Filling,"1 (1.25 ounce) package dry taco seasoning mix , 1 cup chicken broth , 1 pound skinless, boneless chicken breasts",total fat: 2.3g saturated fat: 0.6g cholesterol: 59mg sodium: 695mg potassium: 142mg carbohydrates: 6g fiber: 0g sugar: 2g protein: 22g exchange other carbs: 1 vitamin a iu: 14IU niacin equivalents: 11mg vitamin b6: 0mg vitamin c: 0mg folate: 2mcg calcium: 10mg iron: 1mg magnesium: 18mg thiamin: 0mg,4
245,Conchas (Mexican Sweet Bread),"2 ½ teaspoons yeast , ½ cup warm water , ½ cup evaporated milk , ⅜ cup white sugar , 1 teaspoon salt , ⅓ cup butter or margarine, melted , 1 egg , 4 cups all-purpose flour , ½ teaspoon ground cinnamon , ⅔ cup white sugar , ½ cup butter or margarine , 1 cup all-purpose flour , 2 teaspoons ground cinnamon , 1 teaspoon vanilla extract",total fat: 14.5g saturated fat: 8.8g cholesterol: 52mg sodium: 303mg potassium: 117mg carbohydrates: 58.9g fiber: 1.8g sugar: 19g protein: 7.1g exchange other carbs: 4 vitamin a iu: 440IU niacin equivalents: 5mg vitamin b6: 0mg vitamin c: 0mg folate: 118mcg calcium: 47mg iron: 3mg magnesium: 16mg thiamin: 0mg,12
246,Taco Bake II,"1 ½ pounds lean ground beef , 1 (14.5 ounce) can diced tomatoes with green chile peppers, drained , ½ cup water , 1 cup sour cream , 1 (1.25 ounce) package taco seasoning mix , 8 ounces shredded Colby-Monterey Jack cheese , 1 (18 ounce) package corn tortilla chips",total fat: 40.2g saturated fat: 15.9g cholesterol: 95mg sodium: 1076mg potassium: 431mg carbohydrates: 48.3g fiber: 3.8g sugar: 1g protein: 28.6g exchange other carbs: 3 vitamin a iu: 386IU niacin equivalents: 8mg vitamin b6: 0mg vitamin c: 3mg folate: 26mcg calcium: 160mg iron: 3mg magnesium: 114mg thiamin: 0mg,8
247,Veracruz-Style Red Snapper,"2 tablespoons olive oil,1/2 white onion, diced,3 cloves garlic, minced,1 tablespoon capers,1 tablespoon caper juice,1 cup cherry tomatoes, halved,1/3 cup pitted, sliced green olives (such as Castelvetrano),1 jalapeno pepper, seeded and chopped,2 teaspoons chopped fresh oregano,2 teaspoons olive oil,2 (7 ounce) red snapper fillets, cut in half,salt and pepper to taste,1/2 teaspoon cayenne pepper, or more to taste,2 limes, juiced",Total Fat: 25.2gSaturated Fat: 4.0gCholesterol: 73mgSodium: 1034mgPotassium: 1148mgTotal Carbohydrates: 16.2gDietary Fiber: 4.1gProtein: 43.1gSugars: 3gVitamin A: 958IUVitamin C: 44mgCalcium: 131mgIron: 2mgThiamin: 0mgNiacin: 9mgVitamin B6: 1mgMagnesium: 85mgFolate: 37mcg,2
248,Taco Pizza,"10 fluid ounces warm water , ¾ teaspoon salt , 3 tablespoons vegetable oil , 4 cups all-purpose flour , 2 teaspoons active dry yeast , 1 (6 ounce) can tomato paste , ¾ cup water , 1 (1.25 ounce) package taco seasoning mix, divided , 1 teaspoon chili powder, or to taste , ½ teaspoon cayenne pepper, or to taste , 1 (16 ounce) can fat-free refried beans , ⅓ cup salsa , ¼ cup chopped onion , ½ pound ground beef , 4 cups shredded Cheddar cheese",total fat: 16.1g saturated fat: 8g cholesterol: 42mg sodium: 708mg potassium: 236mg carbohydrates: 32.7g fiber: 3g sugar: 2g protein: 14.8g exchange other carbs: 2 vitamin a iu: 533IU niacin equivalents: 6mg vitamin b6: 0mg vitamin c: 3mg folate: 77mcg calcium: 225mg iron: 3mg magnesium: 23mg thiamin: 0mg,16
249,Bob's Mexican Stuffed Chicken,"2 cups crushed corn flakes , 1 tablespoon chili powder , 1 (1.27 ounce) packet dry fajita seasoning , ¼ cup chopped red bell pepper , ¼ cup chopped yellow bell pepper , ¼ cup chopped orange bell pepper , ⅓ cup chopped fresh mushrooms , ½ medium red onion, diced , 4 skinless, boneless chicken breast halves - pounded thin , 1 cup shredded Cheddar cheese, divided , ¼ cup salsa , toothpicks",total fat: 14.8g saturated fat: 8.2g cholesterol: 103mg sodium: 1105mg potassium: 439mg carbohydrates: 24.6g fiber: 2g sugar: 4g protein: 35.2g exchange other carbs: 2 vitamin a iu: 1591IU niacin equivalents: 22mg vitamin b6: 1mg vitamin c: 52mg folate: 92mcg calcium: 277mg iron: 6mg magnesium: 45mg thiamin: 0mg,4
250,Slow Cooker Chicken Mole,"1 large onion, chopped , ½ cup raisins , 3 cloves garlic, chopped , 2 tablespoons toasted sesame seeds (optional) , 1 finely chopped canned chipotle chile in adobo sauce , 3 tablespoons peanut butter , 1 (28 ounce) can crushed tomatoes , 1 teaspoon sugar , 1 teaspoon ground cinnamon , 4 teaspoons chili powder , 1 teaspoon ground cumin , ½ teaspoon ground coriander , ⅛ teaspoon ground nutmeg , 3 tablespoons unsweetened cocoa powder , 1 ½ pounds skinless, boneless chicken breasts",total fat: 9.2g saturated fat: 2.1g cholesterol: 59mg sodium: 290mg potassium: 808mg carbohydrates: 28.1g fiber: 6.1g sugar: 10g protein: 28.3g exchange other carbs: 2 vitamin a iu: 1458IU niacin equivalents: 15mg vitamin b6: 1mg vitamin c: 16mg folate: 36mcg calcium: 118mg iron: 4mg magnesium: 92mg thiamin: 0mg,6
251,Green Chicken Enchilada,"1 pound skinless, boneless chicken breast halves , 12 (10 inch) flour tortillas , 1 (8 ounce) package shredded Monterey Jack cheese , 1 (19 ounce) can green enchilada sauce",total fat: 29.2g saturated fat: 13.3g cholesterol: 89mg sodium: 1134mg potassium: 547mg carbohydrates: 77.2g fiber: 5.8g sugar: 3g protein: 36.8g exchange other carbs: 5 vitamin a iu: 597IU niacin equivalents: 17mg vitamin b6: 0mg vitamin c: 9mg folate: 159mcg calcium: 495mg iron: 6mg magnesium: 69mg thiamin: 1mg,6
252,Enchilada Casserole,"1 (15 ounce) can black beans, rinsed and drained , 2 cloves garlic, minced , 1 onion, chopped , 1 (4 ounce) can diced green chile peppers , 1 jalapeno pepper, seeded and minced , 1 (8 ounce) package tempeh, crumbled , 6 (6 inch) corn tortillas , 1 (19 ounce) can enchilada sauce , 1 (6 ounce) can sliced black olives , 8 ounces shredded Cheddar cheese",total fat: 24g saturated fat: 11.5g cholesterol: 54mg sodium: 709mg potassium: 324mg carbohydrates: 24.9g fiber: 5.7g sugar: 1g protein: 17.4g exchange other carbs: 2 vitamin a iu: 948IU niacin equivalents: 4mg vitamin b6: 0mg vitamin c: 17mg folate: 22mcg calcium: 307mg iron: 3mg magnesium: 55mg thiamin: 0mg,8
253,"Black Beans, Corn, and Yellow Rice","1 (8 ounce) package yellow rice mix , 1 ¼ cups water , 2 tablespoons olive oil , 1 (15 ounce) can black beans, rinsed and drained , 1 (15.25 ounce) can whole kernel corn, drained , 2 teaspoons lime juice , 1 teaspoon ground cumin",total fat: 4.4g saturated fat: 0.6g cholesterol: 0mg sodium: 195mg potassium: 141mg carbohydrates: 15.1g fiber: 1.4g sugar: 2g protein: 2g exchange other carbs: 1 vitamin a iu: 161IU niacin equivalents: 1mg vitamin b6: 0mg vitamin c: 5mg folate: 25mcg calcium: 15mg iron: 1mg magnesium: 14mg thiamin: 0mg,8
254,Mexican Taco Meatloaf,"1 ½ pounds lean ground beef , 1 cup crushed tortilla chips , ¾ cup shredded pepper Jack cheese , 1 small onion, chopped , 1 (1 ounce) packet taco seasoning mix , 2 eggs, beaten , ½ cup milk , ¼ cup mild red taco sauce, or more to taste",total fat: 16.6g saturated fat: 6.9g cholesterol: 120mg sodium: 468mg potassium: 264mg carbohydrates: 7.1g fiber: 0.3g sugar: 2g protein: 21.6g exchange other carbs: 1 vitamin a iu: 267IU niacin equivalents: 7mg vitamin b6: 0mg vitamin c: 1mg folate: 15mcg calcium: 105mg iron: 2mg magnesium: 23mg thiamin: 0mg,8
255,Salsa,"4 large tomatoes, chopped , 1 onion, chopped , ½ cup chopped fresh cilantro , 3 cloves garlic, minced , 1 tablespoon lime juice , 1 tomatillo, diced (optional) , salt to taste , 1 jalapeno pepper, minced",total fat: 0.5g saturated fat: 0.1g cholesterol: 0mg sodium: 13mg potassium: 545mg carbohydrates: 11.7g fiber: 3.1g sugar: 7g protein: 2.3g exchange other carbs: 1 vitamin a iu: 1944IU niacin equivalents: 2mg vitamin b6: 0mg vitamin c: 31mg folate: 39mcg calcium: 34mg iron: 1mg magnesium: 28mg thiamin: 0mg,4
256,Mexican Style Cornbread,"2 eggs , ¼ cup corn oil , 1 cup buttermilk , 1 ½ cups shredded Cheddar cheese , 1 (8 ounce) can cream-style corn , 1 large onion, chopped , 2 fresh jalapeno peppers, seeded and minced , 1 cup cornmeal , ½ cup all-purpose flour , 2 teaspoons baking powder , ½ teaspoon baking soda , ½ teaspoon salt",total fat: 10.8g saturated fat: 4g cholesterol: 47mg sodium: 387mg potassium: 139mg carbohydrates: 17.9g fiber: 1.4g sugar: 2g protein: 7.1g exchange other carbs: 1 vitamin a iu: 242IU niacin equivalents: 2mg vitamin b6: 0mg vitamin c: 3mg folate: 31mcg calcium: 168mg iron: 1mg magnesium: 26mg thiamin: 0mg,12
257,Mexican Beef Supreme,"1 tablespoon olive oil , 1 onion, diced , 1 pound cubed beef stew meat , 1 ½ teaspoons minced garlic , ½ lime, juiced , 1 jalapeno pepper, seeded and chopped , 3 green onions, chopped , ¼ cup chopped fresh cilantro, or to taste , 1 teaspoon dried oregano , 1 (7 ounce) can green salsa",total fat: 27.9g saturated fat: 10.2g cholesterol: 100mg sodium: 238mg potassium: 468mg carbohydrates: 8.6g fiber: 1.3g sugar: 3g protein: 30.2g exchange other carbs: 1 vitamin a iu: 365IU niacin equivalents: 8mg vitamin b6: 0mg vitamin c: 9mg folate: 26mcg calcium: 39mg iron: 4mg magnesium: 33mg thiamin: 0mg,4
258,Jen's Fresh and Spicy Salsa,"5 roma (plum) tomatoes, seeded and chopped , 10 green onions , 2 fresh jalapeno peppers, seeded , ¼ cup chopped fresh cilantro , 2 tablespoons fresh lime juice , 2 tablespoons hot pepper sauce , 1 teaspoon ground black pepper , 1 teaspoon garlic powder , 1 teaspoon salt",total fat: 0.1g saturated fat: 0g cholesterol: 0mg sodium: 159mg potassium: 87mg carbohydrates: 2g fiber: 0.6g sugar: 1g protein: 0.5g exchange other carbs: 0 vitamin a iu: 348IU niacin equivalents: 0mg vitamin b6: 0mg vitamin c: 6mg folate: 10mcg calcium: 11mg iron: 0mg magnesium: 5mg thiamin: 0mg,16
259,Monterey Chicken with Potatoes,"6 medium red potatoes, cubed , ½ cup butter, melted and divided , 4 skinless, boneless chicken breast halves , 1 tablespoon fresh lime juice , 1 ½ cups shredded Mexican blend cheese , ¼ cup chopped fresh cilantro , ½ cup salsa , 1 lime, cut into wedges (optional)",total fat: 42.5g saturated fat: 26.8g cholesterol: 177mg sodium: 825mg potassium: 1836mg carbohydrates: 56.7g fiber: 6.5g sugar: 5g protein: 42.8g exchange other carbs: 4 vitamin a iu: 1693IU niacin equivalents: 20mg vitamin b6: 1mg vitamin c: 35mg folate: 66mcg calcium: 391mg iron: 3mg magnesium: 101mg thiamin: 0mg,4
260,Spinach and Mushroom Quesadillas,"1 (10 ounce) package chopped spinach , 2 cups shredded Cheddar cheese , 2 tablespoons butter , 2 cloves garlic, sliced , 2 portobello mushroom caps, sliced , 4 (10 inch) flour tortillas , 1 tablespoon vegetable oil",total fat: 9.5g saturated fat: 5g cholesterol: 22mg sodium: 247mg potassium: 212mg carbohydrates: 10.9g fiber: 1.2g sugar: 1g protein: 6.7g exchange other carbs: 1 vitamin a iu: 1858IU niacin equivalents: 3mg vitamin b6: 0mg vitamin c: 5mg folate: 59mcg calcium: 167mg iron: 1mg magnesium: 24mg thiamin: 0mg,16
261,Mexican Pizza I,"1 (16 ounce) can refried beans , 1 pound ground beef , 1 (1.25 ounce) package taco seasoning mix , 1 tablespoon vegetable oil , 4 (6 inch) corn tortillas , 8 ounces shredded Cheddar cheese , 8 tablespoons sour cream , 2 roma (plum) tomatoes, chopped , 2 green onion, chopped , 1 (4 ounce) can diced green chiles, drained , ½ avocado, diced , 1 tablespoon black olives, sliced",total fat: 48.1g saturated fat: 22.7g cholesterol: 150mg sodium: 1542mg potassium: 866mg carbohydrates: 42.3g fiber: 10.4g sugar: 3g protein: 42.1g exchange other carbs: 3 vitamin a iu: 1168IU niacin equivalents: 13mg vitamin b6: 1mg vitamin c: 24mg folate: 79mcg calcium: 533mg iron: 5mg magnesium: 100mg thiamin: 0mg,4
262,Mexican Chicken Soup,"1 ¼ pounds skinless, boneless chicken breast halves , 2 tablespoons taco seasoning mix , 1 tablespoon vegetable oil , ½ cup chopped onions , ½ cup chopped celery , 2 teaspoons ground cumin , ¼ teaspoon ground black pepper , 1 cup water , 3 (14 ounce) cans chicken broth , 1 cup diced tomatoes , 1 tablespoon chopped fresh cilantro , 1 cup shredded Cheddar cheese , 1 cup crushed tortilla chips , 1 avocado - peeled, pitted and diced",total fat: 16.4g saturated fat: 5.5g cholesterol: 80mg sodium: 1368mg potassium: 565mg carbohydrates: 12.1g fiber: 3.3g sugar: 3g protein: 29.2g exchange other carbs: 1 vitamin a iu: 596IU niacin equivalents: 17mg vitamin b6: 1mg vitamin c: 10mg folate: 46mcg calcium: 175mg iron: 2mg magnesium: 56mg thiamin: 0mg,6
263,Authentic Mexican Chili Rellenos,"6 fresh Anaheim chile peppers , 1 (8 ounce) package queso asadero (white Mexican cheese), cut into 3/4-inch thick strips , 2 eggs, separated , 1 teaspoon baking powder , ¾ cup all-purpose flour , 1 cup vegetable shortening for frying",total fat: 16g saturated fat: 8.2g cholesterol: 102mg sodium: 357mg potassium: 217mg carbohydrates: 17.3g fiber: 1.1g sugar: 3g protein: 13.1g exchange other carbs: 1 vitamin a iu: 594IU niacin equivalents: 3mg vitamin b6: 0mg vitamin c: 65mg folate: 50mcg calcium: 312mg iron: 2mg magnesium: 26mg thiamin: 0mg,6
264,The Best Red Enchilada Sauce,"6 dried ancho chiles,1 (6 ounce) can tomato paste,1/4 cup corn oil,2 cloves garlic, minced,1 1/2 teaspoons salt,1 teaspoon dried oregano,1/4 teaspoon ground cumin,3 cups beef broth",Total Fat: 4.7gSaturated Fat: 1.0gCholesterol: 0mgSodium: 517mgPotassium: 331mgTotal Carbohydrates: 6.3gDietary Fiber: 2.1gProtein: 2gSugars: 1gVitamin A: 1682IUVitamin C: 3mgCalcium: 15mgIron: 1mgThiamin: 0mgNiacin: 1mgVitamin B6: 0mgMagnesium: 15mgFolate: 8mcg,14
265,Adobo Sirloin,"1 lime, juiced , 1 tablespoon minced garlic , 1 teaspoon dried oregano , 1 teaspoon ground cumin , 2 tablespoons finely chopped canned chipotle peppers in adobo sauce , adobo sauce from canned chipotle peppers to taste , 4 (8 ounce) beef sirloin steaks , salt and pepper to taste",total fat: 18.8g saturated fat: 7.4g cholesterol: 120mg sodium: 429mg potassium: 531mg carbohydrates: 3.7g fiber: 1.1g sugar: 0g protein: 37.6g exchange other carbs: 0 vitamin a iu: 41IU niacin equivalents: 12mg vitamin b6: 1mg vitamin c: 6mg folate: 14mcg calcium: 35mg iron: 5mg magnesium: 43mg thiamin: 0mg,4
266,Crab Ceviche,"1 (8 ounce) package imitation crabmeat, flaked,2 large tomatoes, chopped,1 red onion, finely chopped,1/2 bunch cilantro, chopped,2 limes, juiced,3 serrano peppers, finely chopped,1 tablespoon olive oil,salt and pepper to taste",Total Fat: 2gSaturated Fat: 0.0gCholesterol: 6mgSodium: 241mgPotassium: 195mgTotal Carbohydrates: 9.3gDietary Fiber: 1.6gProtein: 2.9gSugars: 4gVitamin A: 645IUVitamin C: 14mgCalcium: 19mgIron: 0mgThiamin: 0mgNiacin: 1mgVitamin B6: 0mgMagnesium: 21mgFolate: 13mcg,8
267,Taco Soup II,"2 pounds lean ground beef , 1 onion, chopped , 1 (4 ounce) can diced green chiles , 1 teaspoon salt , 1 teaspoon ground black pepper , 1 (15 ounce) can pinto beans, drained , 1 (15 ounce) can lima beans, drained , 1 (1.25 ounce) package taco seasoning mix , 1 ½ cups water , 1 (1 ounce) package ranch dressing mix , 1 (15 ounce) can white hominy, drained , 1 (14.5 ounce) can stewed tomatoes , 1 (15 ounce) can kidney beans, drained and rinsed",total fat: 32.9g saturated fat: 12.8g cholesterol: 114mg sodium: 2300mg potassium: 906mg carbohydrates: 52.2g fiber: 13g sugar: 6g protein: 38.5g exchange other carbs: 4 vitamin a iu: 253IU niacin equivalents: 15mg vitamin b6: 1mg vitamin c: 20mg folate: 86mcg calcium: 109mg iron: 7mg magnesium: 93mg thiamin: 0mg,6
268,Gary's Turkey Burritos,"1 pound ground turkey , 2 (7.75 ounce) cans Mexican-style hot tomato sauce (such as El Pato®) , 1 (15.25 ounce) can whole kernel corn, drained , ½ small onion, diced , 1 (16 ounce) can fat-free refried beans , 1 (16 ounce) container fat-free sour cream , ¾ cup shredded reduced-fat Cheddar cheese , 6 (10 inch) flour tortillas",total fat: 7.9g saturated fat: 2.4g cholesterol: 76mg sodium: 1549mg potassium: 385mg carbohydrates: 78.4g fiber: 7.5g sugar: 14g protein: 33.8g exchange other carbs: 5 vitamin a iu: 595IU niacin equivalents: 9mg vitamin b6: 0mg vitamin c: 1mg folate: 127mcg calcium: 346mg iron: 5mg magnesium: 47mg thiamin: 0mg,6
269,Mexican Rice I,"1 ½ teaspoons vegetable oil , ½ small small onion, diced , ⅔ cup uncooked long-grain rice , ½ teaspoon ground cumin , ½ teaspoon chili powder , 3 ounces canned diced tomatoes , 1 teaspoon salt , 1 ½ cups water",total fat: 1.2g saturated fat: 0.2g cholesterol: 0mg sodium: 364mg potassium: 34mg carbohydrates: 15.1g fiber: 0.5g sugar: 1g protein: 1.5g exchange other carbs: 1 vitamin a iu: 106IU niacin equivalents: 1mg vitamin b6: 0mg vitamin c: 2mg folate: 42mcg calcium: 8mg iron: 1mg magnesium: 6mg thiamin: 0mg,7
270,Tangy Chicken Fajitas,"½ cup olive oil , ½ cup distilled white vinegar , ½ cup fresh lime juice , 2 (.7 ounce) packages dry Italian-style salad dressing mix , 3 whole boneless, skinless chicken breast, cubed , 1 onion, sliced , 1 green bell pepper, sliced",total fat: 18.8g saturated fat: 2.7g cholesterol: 34mg sodium: 1101mg potassium: 236mg carbohydrates: 7.7g fiber: 0.7g sugar: 5g protein: 14.1g exchange other carbs: 1 vitamin a iu: 96IU niacin equivalents: 9mg vitamin b6: 0mg vitamin c: 24mg folate: 10mcg calcium: 16mg iron: 1mg magnesium: 22mg thiamin: 0mg,6
271,Easy Chicken Fajita Marinade,"½ cup vegetable oil , 2 tablespoons chili powder , 2 tablespoons lime juice , 2 tablespoons honey , 2 tablespoons garlic powder , ½ teaspoon paprika , ½ teaspoon ground black pepper , 3 pounds skinless, boneless chicken breasts, cut into strips",total fat: 14.1g saturated fat: 2.3g cholesterol: 70mg sodium: 74mg potassium: 229mg carbohydrates: 5.9g fiber: 0.8g sugar: 4g protein: 27g exchange other carbs: 1 vitamin a iu: 550IU niacin equivalents: 13mg vitamin b6: 0mg vitamin c: 2mg folate: 5mcg calcium: 19mg iron: 1mg magnesium: 26mg thiamin: 0mg,10
272,Quick Fish Tacos,"1/4 cup reduced-fat sour cream,2 tablespoons lime juice,salt and ground black pepper to taste,1 jalapeno pepper, halved lengthwise,2 1/2 cups shredded red cabbage,4 green onions, thinly sliced,2 tablespoons olive oil,1 pound tilapia fillets, cut into strips,8 (6 inch) flour tortillas,1/2 cup chopped fresh cilantro",Total Fat: 15.2gSaturated Fat: 4.0gCholesterol: 47mgSodium: 481mgPotassium: 775mgTotal Carbohydrates: 38.9gDietary Fiber: 3.6gProtein: 30.1gSugars: 4gVitamin A: 1216IUVitamin C: 35mgCalcium: 170mgIron: 3mgThiamin: 0mgNiacin: 9mgVitamin B6: 1mgMagnesium: 61mgFolate: 97mcg,4
273,Mexican Bean Pie,"1 (15 ounce) can black beans, drained and rinsed , 1 (15 ounce) can pinto beans, drained , 1 (16 ounce) can refried beans , 1 (2 ounce) can sliced black olives , ½ (15.25 ounce) can whole kernel corn, drained , ½ cup chopped green bell pepper , 1 jalapeno pepper, seeded and minced , 1 tablespoon ground cumin , 1 tablespoon chili powder , ground black pepper to taste , 5 (10 inch) whole wheat tortillas , 1 ½ cups shredded Cheddar cheese , ½ cup salsa (optional) , ½ cup sour cream (optional)",total fat: 18.6g saturated fat: 10.2g cholesterol: 49mg sodium: 1104mg potassium: 654mg carbohydrates: 52.9g fiber: 10.5g sugar: 3g protein: 20.4g exchange other carbs: 4 vitamin a iu: 1042IU niacin equivalents: 5mg vitamin b6: 0mg vitamin c: 18mg folate: 75mcg calcium: 350mg iron: 5mg magnesium: 94mg thiamin: 0mg,6
274,Chili Potato Burritos,"4 potatoes, peeled and chopped , 1 cup shredded Colby-Monterey Jack cheese , 2 teaspoons chili powder , 1 teaspoon ground cumin , 1 clove garlic, minced , salt and pepper to taste , 8 (6 inch) flour tortillas , ½ cup red enchilada sauce",total fat: 20.3g saturated fat: 11g cholesterol: 44mg sodium: 700mg potassium: 1076mg carbohydrates: 73.6g fiber: 7.4g sugar: 3g protein: 17.9g exchange other carbs: 5 vitamin a iu: 621IU niacin equivalents: 7mg vitamin b6: 1mg vitamin c: 46mg folate: 104mcg calcium: 125mg iron: 4mg magnesium: 70mg thiamin: 1mg,4
275,Mexican Tinga,"2 tablespoons olive oil , 1 large onion, cut into rings , 1 (15 ounce) can stewed tomatoes , 1 (7 ounce) can chipotle peppers in adobo sauce, or to taste , 2 pounds shredded cooked chicken meat , 16 tostada shells , ½ cup sour cream",total fat: 20g saturated fat: 5.7g cholesterol: 91mg sodium: 395mg potassium: 359mg carbohydrates: 20.5g fiber: 2.3g sugar: 3g protein: 33.6g exchange other carbs: 2 vitamin a iu: 277IU niacin equivalents: 15mg vitamin b6: 0mg vitamin c: 6mg folate: 11mcg calcium: 67mg iron: 2mg magnesium: 35mg thiamin: 0mg,8
276,White Chicken Enchilada Slow-Cooker Casserole,"15 boneless, skinless chicken thighs or breasts , 1 (26 ounce) can condensed cream of chicken soup , 2 cloves garlic, chopped (optional) , 1 (16 ounce) container sour cream , 1 (7 ounce) can diced green chile peppers , 15 flour tortillas , 3 ½ cups shredded Monterey Jack cheese , 1 (10 ounce) can sliced black olives (optional) , chives for garnish (optional) , black pepper to taste",total fat: 44g saturated fat: 19g cholesterol: 123mg sodium: 1931mg potassium: 503mg carbohydrates: 66.4g fiber: 4.8g sugar: 4g protein: 40g exchange other carbs: 5 vitamin a iu: 1517IU niacin equivalents: 16mg vitamin b6: 0mg vitamin c: 21mg folate: 145mcg calcium: 543mg iron: 7mg magnesium: 66mg thiamin: 1mg,10
277,Fantastic Mexican Dip,"2 pounds lean ground beef , 1 (16 ounce) jar taco sauce , 1 (16 ounce) container sour cream , 1 (8 ounce) package cream cheese, softened , 1 (1 ounce) package taco seasoning mix , 1 (16 ounce) package shredded Cheddar cheese , 1 cup shredded lettuce , 1 tomato, cubed , 2 green onions, sliced , 1 (2 ounce) can sliced black olives, drained",total fat: 8.1g saturated fat: 4.4g cholesterol: 25mg sodium: 151mg potassium: 65mg carbohydrates: 1.5g fiber: 0.1g sugar: 0g protein: 4.8g exchange other carbs: 0 vitamin a iu: 192IU niacin equivalents: 2mg vitamin b6: 0mg vitamin c: 0mg folate: 4mcg calcium: 64mg iron: 0mg magnesium: 6mg thiamin: 0mg,64
278,Fish Tacos Ultimo,"2 pounds tilapia fillets,2 tablespoons lime juice,2 teaspoons salt,1 teaspoon ground black pepper,1 teaspoon garlic powder,1 teaspoon paprika,cooking spray,1/2 cup plain fat-free yogurt,2 tablespoons lime juice,1 1/2 tablespoons chopped fresh cilantro,1 1/2 teaspoons canned chipotle peppers in adobo sauce,16 (5 inch) corn tortillas,2 cups shredded cabbage,1 cup shredded Monterey Jack cheese,1 tomato, chopped,1 avocado - peeled, pitted, and sliced,1/2 cup salsa,2 green onions, chopped",Total Fat: 11gSaturated Fat: 4.0gCholesterol: 55mgSodium: 847mgPotassium: 843mgTotal Carbohydrates: 29.2gDietary Fiber: 6gProtein: 31.5gSugars: 3gVitamin A: 758IUVitamin C: 17mgCalcium: 221mgIron: 1mgThiamin: 0mgNiacin: 7mgVitamin B6: 1mgMagnesium: 88mgFolate: 45mcg,8
279,Ground Beef with Homemade Taco Seasoning Mix,"2 teaspoons dried minced onion , 1 teaspoon salt , 1 teaspoon chili powder , ½ teaspoon cornstarch , ½ teaspoon ground cumin , ½ teaspoon red pepper flakes , ¼ teaspoon cayenne pepper (optional) , ¼ teaspoon dried minced garlic , ¼ teaspoon dried oregano , 1 pound ground beef , ½ cup water",total fat: 7g saturated fat: 2.7g cholesterol: 35mg sodium: 328mg potassium: 134mg carbohydrates: 0.8g fiber: 0.2g sugar: 0g protein: 9.7g exchange other carbs: 0 vitamin a iu: 173IU niacin equivalents: 4mg vitamin b6: 0mg vitamin c: 1mg folate: 5mcg calcium: 9mg iron: 1mg magnesium: 10mg thiamin: 0mg,8
