id,recipe_name,recipe_ingredients,recipe_nutrition,recipe_servings
242,Brazilian Rice,"2 tablespoons olive oil , ¼ onion, diced , 2 cloves garlic, minced , 1 cup rice , 2 cups water , 4 sprigs fresh cilantro , 1 teaspoon salt , 3 drops lemon juice",total fat: 14.2g saturated fat: 2g cholesterol: 0mg sodium: 1179mg potassium: 190mg carbohydrates: 77.9g fiber: 1.9g sugar: 1g protein: 7.2g exchange other carbs: 5 vitamin a iu: 339IU niacin equivalents: 5mg vitamin b6: 0mg vitamin c: 5mg folate: 222mcg calcium: 49mg iron: 4mg magnesium: 31mg thiamin: 1mg,2
243,Easy Taco Rolls,"½ cup uncooked instant rice , ½ cup water , 1 ½ pounds ground beef , ¾ (1 ounce) packet taco seasoning mix , ½ (15.25 ounce) can whole kernel corn, drained , ½ (8.75 ounce) can no-salt-added whole-kernel corn, drained , ½ cup water , 1 ½ cups shredded Cheddar cheese , 8 (10 inch) flour tortillas , 1 (16 ounce) jar salsa , 1 ½ cups shredded Cheddar cheese",total fat: 30.2g saturated fat: 14.4g cholesterol: 98mg sodium: 1370mg potassium: 552mg carbohydrates: 54.1g fiber: 3.9g sugar: 5g protein: 33g exchange other carbs: 4 vitamin a iu: 610IU niacin equivalents: 13mg vitamin b6: 0mg vitamin c: 2mg folate: 122mcg calcium: 421mg iron: 5mg magnesium: 55mg thiamin: 0mg,8
244,Jamaican Jerked Chicken,"½ green onion, minced , ¼ cup orange juice , 1 tablespoon minced fresh ginger root , 1 tablespoon minced jalapeno peppers , 1 tablespoon lime juice , 1 tablespoon soy sauce , 1 clove garlic, minced , 1 teaspoon ground allspice , ¼ teaspoon ground cinnamon , ½ teaspoon ground cloves , 1 (2 to 3 pound) whole chicken, cut into pieces",total fat: 57.2g saturated fat: 16.4g cholesterol: 284mg sodium: 568mg potassium: 808mg carbohydrates: 4.8g fiber: 0.6g sugar: 2g protein: 71.1g exchange other carbs: 1 vitamin a iu: 620IU niacin equivalents: 39mg vitamin b6: 1mg vitamin c: 20mg folate: 33mcg calcium: 58mg iron: 4mg magnesium: 84mg thiamin: 0mg,3
245,Habichuelas Guisadas,"1 tablespoon olive oil , ¼ cup tomato sauce , 2 tablespoons sofrito sauce , 1 (.18 ounce) packet sazon seasoning , ¼ teaspoon black pepper , 2 cups cooked pinto beans, drained , 1 ½ cups water , salt to taste",total fat: 5.2g saturated fat: 1g cholesterol: 2mg sodium: 580mg potassium: 442mg carbohydrates: 23.8g fiber: 8g sugar: 1g protein: 8.3g exchange other carbs: 2 vitamin a iu: 84IU niacin equivalents: 2mg vitamin b6: 0mg vitamin c: 4mg folate: 150mcg calcium: 46mg iron: 2mg magnesium: 47mg thiamin: 0mg,4
246,Beef Fajitas,"¼ cup olive oil , 1 lime, juiced , 3 tablespoons chopped fresh cilantro , 2 tablespoons finely chopped onion , 3 cloves garlic, finely chopped , 1 ½ teaspoons ground cumin , 1 teaspoon salt , 1 teaspoon ground black pepper , 2 (8 ounce) boneless New York strip steaks, cut into thin strips , 8 (6 inch) white corn tortillas, or more as needed , 1 (8 ounce) jar salsa , 1 (8 ounce) package shredded Mexican cheese blend",total fat: 42.3g saturated fat: 18.3g cholesterol: 121mg sodium: 1451mg potassium: 772mg carbohydrates: 31.3g fiber: 4.6g sugar: 3g protein: 49.8g exchange other carbs: 2 vitamin a iu: 1059IU niacin equivalents: 14mg vitamin b6: 1mg vitamin c: 6mg folate: 18mcg calcium: 465mg iron: 4mg magnesium: 79mg thiamin: 0mg,4
247,Pacific Cuban Black Beans and Rice,"4 cups water,2 cups rice,3 tablespoons olive oil,1 onion, chopped,1 bell pepper, chopped,2 carrots, peeled and chopped,2 ribs celery, chopped,1 tablespoon minced garlic,2 (15 ounce) cans black beans,2 smoked Spanish chorizo sausage links, coarsely chopped,1 cup chicken stock,1 (8 ounce) jar picante sauce,2 bay leaves,2 teaspoons smoked paprika,1 teaspoon red wine vinegar, or more to taste,1 teaspoon ground cumin,1 teaspoon white sugar,1 teaspoon salt, or to taste,1/2 teaspoon ground black pepper, or to taste,1 pinch red pepper flakes (optional)",Total Fat: 15.8gSaturated Fat: 4.0gCholesterol: 18mgSodium: 1609mgPotassium: 842mgTotal Carbohydrates: 84.5gDietary Fiber: 13.2gProtein: 19.6gSugars: 6gVitamin A: 4819IUVitamin C: 28mgCalcium: 113mgIron: 7mgThiamin: 1mgNiacin: 9mgVitamin B6: 0mgMagnesium: 85mgFolate: 252mcg,6
248,Watermelon Agua Fresca,"4 cups cubed seeded watermelon,1/2 cup water,1/2 cup white sugar, or to taste,4 slices lime,24 fresh mint leaves,ice",Total Fat: 0.1gSaturated Fat: 0.0gCholesterol: 0mgSodium: 1mgPotassium: 90mgTotal Carbohydrates: 18.7gDietary Fiber: 0.4gProtein: 0.5gSugars: 17gVitamin A: 436IUVitamin C: 7mgCalcium: 7mgIron: 0mgThiamin: 0mgNiacin: 0mgVitamin B6: 0mgMagnesium: 8mgFolate: 3mcg,8
249,Bermuda Fish Chowder,"2 tablespoons vegetable oil,3 stalks celery, chopped,2 carrots, chopped,1 onion, chopped,1 green bell pepper, chopped,3 cloves garlic, minced,3 tablespoons tomato paste,4 cups clam juice,2 potatoes, peeled and cubed,1 (14.5 ounce) can peeled and diced tomatoes,2 tablespoons Worcestershire sauce,1 jalapeno pepper, seeded and minced,1 teaspoon ground black pepper,1 bay leaf,1 pound red snapper fillets, cut into 1 inch pieces",Total Fat: 5.9gSaturated Fat: 1.0gCholesterol: 33mgSodium: 657mgPotassium: 1270mgTotal Carbohydrates: 23.8gDietary Fiber: 4.2gProtein: 19.4gSugars: 7gVitamin A: 5007IUVitamin C: 45mgCalcium: 112mgIron: 4mgThiamin: 0mgNiacin: 5mgVitamin B6: 1mgMagnesium: 73mgFolate: 38mcg,6
250,Authentic Mexican Enchiladas,"6 dried chile de arbol peppers , 1 clove garlic , 1 teaspoon salt , ¾ cup water , 1 cup vegetable oil for frying , 18 (6 inch) corn tortillas , 3 cups crumbled queso fresco , 1 cup sour cream , 1 cup shredded lettuce , 2 medium tomatoes, thinly sliced , ½ cup chopped green onions",total fat: 24.3g saturated fat: 12.2g cholesterol: 57mg sodium: 609mg potassium: 498mg carbohydrates: 46.1g fiber: 5.7g sugar: 2g protein: 21.1g exchange other carbs: 3 vitamin a iu: 1710IU niacin equivalents: 2mg vitamin b6: 0mg vitamin c: 8mg folate: 39mcg calcium: 474mg iron: 2mg magnesium: 87mg thiamin: 0mg,6
251,Chef John's Grilled Mojo Beef,"2 pounds beef skirt steak , 1 large navel orange, juiced , 3 limes, juiced , ¼ cup olive oil, plus more for drizzling , 6 cloves garlic, finely minced , 1 tablespoon kosher salt , 1 ½ teaspoons ground cumin , 1 teaspoon freshly ground black pepper , ½ teaspoon dried oregano , ½ teaspoon cayenne pepper , ½ onion, thinly sliced , ½ cup fresh chopped cilantro , 1 teaspoon coarse salt for finishing , Lime wedges for serving",total fat: 23.2g saturated fat: 5.7g cholesterol: 51mg sodium: 2117mg potassium: 576mg carbohydrates: 16g fiber: 3.6g sugar: 7g protein: 29.1g exchange other carbs: 1 vitamin a iu: 636IU niacin equivalents: 11mg vitamin b6: 1mg vitamin c: 45mg folate: 37mcg calcium: 85mg iron: 3mg magnesium: 40mg thiamin: 0mg,4
252,Arroz Rojo (Mexican Red Rice),"2 Roma (plum tomatoes), cored , 2 tablespoons vegetable oil , 1 cup minced onion , 2 cloves garlic, minced , 1 cup uncooked long-grain white rice , 1 ¾ cups low-sodium chicken broth , ¼ cup canned tomato sauce , 1 jalapeno pepper, chopped , 2 sprigs fresh cilantro , salt to taste",total fat: 6g saturated fat: 1.1g cholesterol: 1mg sodium: 109mg potassium: 205mg carbohydrates: 35.1g fiber: 1.6g sugar: 3g protein: 4.6g exchange other carbs: 3 vitamin a iu: 340IU niacin equivalents: 3mg vitamin b6: 0mg vitamin c: 8mg folate: 99mcg calcium: 25mg iron: 2mg magnesium: 18mg thiamin: 0mg,5
253,Chicana,"1 pound top round steak, cut into 1/2 inch pieces , ½ large bell pepper, cut in strips , 1 (15 ounce) can tomato sauce , 1 cup water , ½ onion, sliced into strips , 1 teaspoon ground cumin , 1 clove garlic, minced , 1 tablespoon chili powder",total fat: 8.4g saturated fat: 3g cholesterol: 61mg sodium: 603mg potassium: 667mg carbohydrates: 9.4g fiber: 2.8g sugar: 6g protein: 24.9g exchange other carbs: 1 vitamin a iu: 1037IU niacin equivalents: 7mg vitamin b6: 0mg vitamin c: 26mg folate: 24mcg calcium: 34mg iron: 4mg magnesium: 42mg thiamin: 0mg,4
254,Arroz con Pollo II,"1 (2 to 3 pound) whole chicken, cut into pieces , 1 tablespoon olive oil , 2 onions, chopped , 3 cloves garlic, crushed , ½ green bell pepper, chopped , ½ (15 ounce) can tomato sauce , 1 pinch saffron , salt to taste , 2 cubes chicken bouillon , 1 ½ cups uncooked white rice , 1 cup beer , 1 (15 ounce) can peas, drained , ½ red bell pepper, roasted and sliced",total fat: 16.4g saturated fat: 4.2g cholesterol: 83mg sodium: 775mg potassium: 549mg carbohydrates: 54.5g fiber: 4.2g sugar: 6g protein: 33.9g exchange other carbs: 4 vitamin a iu: 1111IU niacin equivalents: 15mg vitamin b6: 1mg vitamin c: 33mg folate: 125mcg calcium: 59mg iron: 4mg magnesium: 61mg thiamin: 0mg,6
255,Carne Con Papas,"½ green bell pepper, seeded and chopped , ½ small white onion, chopped , 3 cloves garlic, crushed , ¼ teaspoon ground cumin , ¼ teaspoon salt, divided , ⅛ cup olive oil , 1 tablespoon olive oil , 2 tablespoons achiote powder , 1 teaspoon ground cumin , 2 (8 ounce) cans tomato sauce , 2 pounds beef stew meat, cut into 1 inch cubes , 2 white potatoes , 1 cup white wine , 4 cups water , 6 cubes beef bouillon",total fat: 35.3g saturated fat: 12.1g cholesterol: 132mg sodium: 1463mg potassium: 2843mg carbohydrates: 20.4g fiber: 2.9g sugar: 5g protein: 44.5g exchange other carbs: 2 vitamin a iu: 314IU niacin equivalents: 16mg vitamin b6: 1mg vitamin c: 28mg folate: 35mcg calcium: 47mg iron: 6mg magnesium: 73mg thiamin: 0mg,6
256,Bahamian Mahi Mahi,"2 pounds mahi mahi fillets,1/2 cup dark rum,1/2 cup fresh lime juice,2 onion, sliced into thin rings,1 lemon, sliced,2 teaspoons dried oregano,4 tablespoons butter,ground black pepper to taste",Total Fat: 13.3gSaturated Fat: 8.0gCholesterol: 197mgSodium: 286mgPotassium: 1117mgTotal Carbohydrates: 11.1gDietary Fiber: 2.6gProtein: 43.3gSugars: 3gVitamin A: 800IUVitamin C: 34mgCalcium: 82mgIron: 3mgThiamin: 0mgNiacin: 21mgVitamin B6: 1mgMagnesium: 81mgFolate: 29mcg,4
257,Mexican Street Vendor Style Corn Salad,"2 (15.25 ounce) cans whole kernel corn, undrained , 1 tablespoon butter , 2 tablespoons mayonnaise , ¼ cup grated cotija cheese , 1 pinch ground red pepper to taste , 2 tablespoons lime juice, or to taste , 1 sprig cilantro for garnish",total fat: 6.4g saturated fat: 2.3g cholesterol: 9mg sodium: 395mg potassium: 155mg carbohydrates: 20.7g fiber: 2.1g sugar: 3g protein: 3.8g exchange other carbs: 2 vitamin a iu: 145IU niacin equivalents: 1mg vitamin b6: 0mg vitamin c: 2mg folate: 47mcg calcium: 35mg iron: 1mg magnesium: 18mg thiamin: 0mg,8
258,Bountiful Garden Zucchini Enchiladas,"1 tablespoon olive oil , 1 onion, chopped , 2 cloves garlic, minced , 3 cups diced zucchini , ¼ cup canned diced green chiles , 1 teaspoon chili powder , ¼ teaspoon black pepper , 2 tablespoons butter , 2 tablespoons all-purpose flour , ¼ teaspoon salt , 1 teaspoon chili powder , ⅛ teaspoon black pepper , 1 cup milk , ¼ cup canned diced green chiles , 1 cup shredded Monterey Jack cheese , 8 (8 inch) flour tortillas , ½ cup shredded Monterey Jack cheese , 1 ½ cups chopped tomatoes",total fat: 30.8g saturated fat: 14.8g cholesterol: 58mg sodium: 1135mg potassium: 812mg carbohydrates: 73.9g fiber: 6.9g sugar: 10g protein: 24.2g exchange other carbs: 5 vitamin a iu: 1884IU niacin equivalents: 10mg vitamin b6: 1mg vitamin c: 42mg folate: 190mcg calcium: 470mg iron: 5mg magnesium: 79mg thiamin: 1mg,4
259,Cuban Pork,"1 (1 1/4 pound) pork tenderloin, cut crosswise into 8 slices , 1 lime, zested and juiced , 1 teaspoon olive oil , 1 teaspoon ground cumin , ½ teaspoon salt , 1 pinch crushed red pepper flakes (optional) , 1 clove garlic, pressed",total fat: 6.7g saturated fat: 2.1g cholesterol: 79mg sodium: 347mg potassium: 409mg carbohydrates: 2.3g fiber: 0.6g sugar: 0g protein: 25.8g exchange other carbs: 0 vitamin a iu: 42IU niacin equivalents: 10mg vitamin b6: 0mg vitamin c: 6mg folate: 7mcg calcium: 16mg iron: 2mg magnesium: 33mg thiamin: 1mg,4
260,Puerto Rican Steamed Rice,"2 tablespoons vegetable oil , 3 cups water , 1 teaspoon salt , 2 cups uncooked calrose rice, rinsed",total fat: 3.6g saturated fat: 0.6g cholesterol: 0mg sodium: 291mg potassium: 26mg carbohydrates: 28.7g fiber: 1g sugar: 0g protein: 2.4g exchange other carbs: 2 vitamin a iu: 0IU niacin equivalents: 2mg vitamin b6: 0mg vitamin c: 0mg folate: 59mcg calcium: 1mg iron: 1mg magnesium: 8mg thiamin: 0mg,8
261,Pan Dulces,"1 cup milk , 6 tablespoons butter , 1 (.25 ounce) package active dry yeast , ⅓ cup white sugar , 1 teaspoon salt , 2 eggs , 5 cups all-purpose flour , ½ cup white sugar , ⅔ cup all-purpose flour , 4 tablespoons butter, softened , 2 egg yolks",total fat: 9.1g saturated fat: 5.2g cholesterol: 69mg sodium: 214mg potassium: 92mg carbohydrates: 45.2g fiber: 1.3g sugar: 11g protein: 6.4g exchange other carbs: 3 vitamin a iu: 311IU niacin equivalents: 4mg vitamin b6: 0mg vitamin c: 0mg folate: 98mcg calcium: 33mg iron: 2mg magnesium: 13mg thiamin: 0mg,16
262,Cuban Chicken,"1 tablespoon olive oil , 1 onion, chopped , 3 cloves garlic, chopped , 1 (14.5 ounce) can diced tomatoes , 1 (12 ounce) can chicken chunks, drained , ½ cup chopped red bell pepper , ½ cup raisins , ½ cup stuffed green olives, sliced , 1 tablespoon red wine vinegar , 1 teaspoon ground oregano , ¼ teaspoon ground cumin , 2 bay leaves",total fat: 12.7g saturated fat: 2.6g cholesterol: 53mg sodium: 1013mg potassium: 552mg carbohydrates: 27.7g fiber: 3.4g sugar: 18g protein: 21.3g exchange other carbs: 2 vitamin a iu: 1555IU niacin equivalents: 10mg vitamin b6: 0mg vitamin c: 39mg folate: 25mcg calcium: 93mg iron: 5mg magnesium: 31mg thiamin: 0mg,4
263,Arroz Con Pollo,"¼ cup vegetable oil , 1 (4 to 6 pound) whole chicken, cut into pieces , 1 onion, chopped , 1 green bell pepper, chopped , 2 cloves garlic, minced , 2 cloves garlic , 1 (14.5 ounce) can stewed tomatoes , 1 cup rice , 2 teaspoons salt, or to taste , 1 teaspoon dried oregano , ½ teaspoon ground black pepper , 1 bay leaf , 2 cups chicken stock, or as needed to cover , 1 cup green peas , ½ cup sliced black olives , ½ cup raisins , ¼ cup chopped pimento peppers",total fat: 20.2g saturated fat: 4.6g cholesterol: 142mg sodium: 1105mg potassium: 683mg carbohydrates: 36.3g fiber: 3g sugar: 9g protein: 50.5g exchange other carbs: 3 vitamin a iu: 826IU niacin equivalents: 26mg vitamin b6: 1mg vitamin c: 26mg folate: 68mcg calcium: 78mg iron: 5mg magnesium: 67mg thiamin: 0mg,8
264,Mexican Brownies,"1 ½ cups unsalted butter , 3 cups white sugar , 6 eggs , 1 tablespoon vanilla extract , 1 ¼ cups unsweetened cocoa powder , 1 ½ cups all-purpose flour , 1 ¾ teaspoons ground Mexican cinnamon (canela) , ½ teaspoon ground pequin chile pepper , ¾ teaspoon kosher salt , ¾ teaspoon baking powder",total fat: 10.8g saturated fat: 6.4g cholesterol: 62mg sodium: 76mg potassium: 79mg carbohydrates: 27g fiber: 1.4g sugar: 20g protein: 2.7g exchange other carbs: 2 vitamin a iu: 333IU niacin equivalents: 1mg vitamin b6: 0mg vitamin c: 0mg folate: 18mcg calcium: 22mg iron: 1mg magnesium: 21mg thiamin: 0mg,30
265,Mojo Roast Chicken (Pollo Asado),"½ cup extra-virgin olive oil , 1 ½ teaspoons ground cumin , 1 ½ teaspoons kosher salt , ½ teaspoon dried oregano , 2 tablespoons minced garlic , 3 tablespoons lime juice , 3 tablespoons orange juice , 1 (6 pound) whole chicken, cut into pieces",total fat: 39.8g saturated fat: 9.1g cholesterol: 146mg sodium: 501mg potassium: 439mg carbohydrates: 2g fiber: 0.2g sugar: 1g protein: 46.2g exchange other carbs: 0 vitamin a iu: 185IU niacin equivalents: 14mg vitamin b6: 1mg vitamin c: 5mg folate: 12mcg calcium: 33mg iron: 3mg magnesium: 42mg thiamin: 0mg,8
266,We Be Jammin' Jamaican Banana Bread,"2 tablespoons unsalted butter, softened , 2 tablespoons cream cheese , 1 cup white sugar , 1 egg , 2 cups all-purpose flour , 2 teaspoons baking powder , ½ teaspoon baking soda , ⅛ teaspoon salt , 1 cup mashed overripe bananas , ½ cup milk , 2 tablespoons dark rum, or rum flavoring , ½ teaspoon lime zest , 2 teaspoons lime juice , 1 teaspoon vanilla extract , ¼ cup chopped toasted pecans , ¼ cup flaked coconut , ¼ cup brown sugar , 2 teaspoons unsalted butter , 2 teaspoons lime juice , 2 teaspoons dark rum, or rum flavoring , 2 tablespoons chopped toasted pecans , 2 tablespoons flaked coconut",total fat: 3.8g saturated fat: 1.7g cholesterol: 13mg sodium: 92mg potassium: 73mg carbohydrates: 22g fiber: 0.8g sugar: 13g protein: 1.9g exchange other carbs: 2 vitamin a iu: 83IU niacin equivalents: 1mg vitamin b6: 0mg vitamin c: 1mg folate: 23mcg calcium: 37mg iron: 1mg magnesium: 9mg thiamin: 0mg,24
267,Arroz con Leche,"2 1/4 cups water,1 1/2 cups short grain rice,1 (1/4 inch x 3 inch) strip lime peel,1/2 cup water,1 cinnamon stick,2 tablespoons anise seed, crushed,1 (12 ounce) can evaporated milk,1 (14 ounce) can condensed milk,1 tablespoon vanilla extract,1/4 teaspoon salt,3/4 cup raisins (optional)",Total Fat: 6.4gSaturated Fat: 4.0gCholesterol: 23mgSodium: 148mgPotassium: 388mgTotal Carbohydrates: 59.4gDietary Fiber: 1.7gProtein: 8gSugars: 32gVitamin A: 189IUVitamin C: 3mgCalcium: 222mgIron: 2mgThiamin: 0mgNiacin: 3mgVitamin B6: 0mgMagnesium: 33mgFolate: 77mcg,10
268,Butternut Squash Enchiladas,"8 (5 inch) corn tortillas , ½ unpeeled butternut squash, seeded , ½ cup water , 2 tablespoons olive oil , 1 clove garlic, minced , ¼ onion, chopped , 2 cups chopped fresh spinach , 4 sun-dried tomatoes, chopped , 1 cup enchilada sauce , ¼ cup crumbled goat cheese , ¼ cup crumbled cotija cheese , 2 tablespoons chopped cilantro leaves, for garnish (optional) , ¼ cup sour cream, for topping (optional)",total fat: 18g saturated fat: 6.7g cholesterol: 22mg sodium: 429mg potassium: 1027mg carbohydrates: 46.2g fiber: 7.4g sugar: 5g protein: 10.4g exchange other carbs: 3 vitamin a iu: 16578IU niacin equivalents: 5mg vitamin b6: 1mg vitamin c: 42mg folate: 98mcg calcium: 250mg iron: 3mg magnesium: 123mg thiamin: 0mg,4
269,Chicken Mole,"1 tablespoon vegetable oil , 1 (3 pound) chicken, cut into pieces , 1 bay leaf , ¼ teaspoon black pepper , ⅛ teaspoon cayenne pepper , ½ teaspoon paprika , ½ teaspoon ground cloves , ½ teaspoon ground cinnamon , 1 onion, chopped , 2 cloves garlic, minced , 1 (14.5 ounce) can diced tomatoes , 2 teaspoons brown sugar , 1 cup chicken broth , ¼ cup semisweet chocolate chips , ¼ cup raisins , 2 tablespoons sesame seeds",total fat: 34.6g saturated fat: 9.9g cholesterol: 145mg sodium: 305mg potassium: 729mg carbohydrates: 25.2g fiber: 3.3g sugar: 18g protein: 48.7g exchange other carbs: 2 vitamin a iu: 1177IU niacin equivalents: 15mg vitamin b6: 1mg vitamin c: 11mg folate: 22mcg calcium: 126mg iron: 6mg magnesium: 75mg thiamin: 0mg,4
270,Mexican Ceviche,"5 large lemons, juiced , 1 pound jumbo shrimp, peeled and deveined , ¼ cup chopped fresh cilantro, or to taste , tomato and clam juice cocktail , 2 white onions, finely chopped , 1 cucumber, peeled and finely chopped , 1 large tomatoes, seeded and chopped , 3 fresh jalapeno peppers, seeded and minced , 1 bunch radishes, finely diced , 2 cloves fresh garlic, minced , tortilla chips",total fat: 12.4g saturated fat: 1.6g cholesterol: 86mg sodium: 733mg potassium: 593mg carbohydrates: 57.6g fiber: 7.5g sugar: 7g protein: 17.7g exchange other carbs: 4 vitamin a iu: 662IU niacin equivalents: 6mg vitamin b6: 0mg vitamin c: 71mg folate: 42mcg calcium: 182mg iron: 3mg magnesium: 116mg thiamin: 0mg,8
271,Mom's Carne Guisada,"2 pounds round steak, cut into bite size pieces , 1 tablespoon garlic powder , 1 teaspoon ground cumin , salt and pepper to taste , 2 tablespoons olive oil , ⅛ cup all-purpose flour , 2 cups water , 1 onion, sliced , 1 green bell pepper, chopped",total fat: 20.6g saturated fat: 7.3g cholesterol: 76mg sodium: 62mg potassium: 420mg carbohydrates: 4.3g fiber: 0.7g sugar: 1g protein: 22.4g exchange other carbs: 1 vitamin a iu: 59IU niacin equivalents: 8mg vitamin b6: 1mg vitamin c: 13mg folate: 16mcg calcium: 16mg iron: 3mg magnesium: 29mg thiamin: 0mg,8
272,Barbadian Plain Cake,"1 ½ cups white sugar , 2 cups butter , 4 ½ teaspoons baking powder , 3 cups all-purpose flour , 4 eggs , 1 tablespoon vanilla extract , 1 tablespoon almond extract , 2 cups milk",total fat: 33.5g saturated fat: 20.5g cholesterol: 147mg sodium: 442mg potassium: 128mg carbohydrates: 51.5g fiber: 0.8g sugar: 27g protein: 7g exchange other carbs: 4 vitamin a iu: 1103IU niacin equivalents: 3mg vitamin b6: 0mg vitamin c: 0mg folate: 68mcg calcium: 172mg iron: 2mg magnesium: 15mg thiamin: 0mg,12
273,Caribbean Pasta with Shrimp,"4 cloves garlic, minced,1/4 cup minced shallots,1 tablespoon minced fresh ginger root,3 tablespoons olive oil,1 green bell pepper, seeded and chopped,1 1/2 cups tomato - peeled, seeded and chopped,2 teaspoons curry powder,1/2 teaspoon whole allspice berries,1/2 cup chicken stock,1/4 cup brandy-based orange liqueur (such as Grand Marnier®),2 tablespoons soy sauce,1 tablespoon brown sugar,2 teaspoons cornstarch,2 tablespoons chile paste,8 ounces rotini pasta,1 1/2 pounds medium shrimp - peeled and deveined,1/2 cup fresh cilantro, chopped",Total Fat: 14.9gSaturated Fat: 3.0gCholesterol: 259mgSodium: 785mgPotassium: 647mgTotal Carbohydrates: 42.6gDietary Fiber: 2.8gProtein: 39.9gSugars: 14gVitamin A: 1525IUVitamin C: 38mgCalcium: 122mgIron: 5mgThiamin: 0mgNiacin: 14mgVitamin B6: 0mgMagnesium: 85mgFolate: 30mcg,4
274,Tex-Mex Patty Melts,"1 pound ground beef , 3 tablespoons chili seasoning mix , 2 chipotle peppers in adobo sauce, minced , ½ fluid ounce beer , ¼ cup mayonnaise , 1 chipotle pepper in adobo sauce, minced , 6 (1 ounce) slices white bread , 6 (1/2 ounce) slices pepperjack cheese",total fat: 44.2g saturated fat: 14.6g cholesterol: 129mg sodium: 1574mg potassium: 372mg carbohydrates: 35.4g fiber: 2.8g sugar: 4g protein: 37.3g exchange other carbs: 3 vitamin a iu: 856IU niacin equivalents: 14mg vitamin b6: 0mg vitamin c: 0mg folate: 74mcg calcium: 251mg iron: 5mg magnesium: 34mg thiamin: 0mg,3
275,Fresh Guacamole,"1 avocado - peeled, pitted, and diced , 1 roma (plum) tomato, diced , ½ red onion, diced , 1 serrano chile pepper, seeded and minced , ½ teaspoon kosher salt , ½ teaspoon ground black pepper , ½ teaspoon garlic powder , 1 teaspoon Worcestershire sauce , 3 drops hot sauce , 6 cilantro leaves, minced , 1 tablespoon fresh lime juice",total fat: 14.9g saturated fat: 2.2g cholesterol: 0mg sodium: 554mg potassium: 674mg carbohydrates: 14.7g fiber: 8g sugar: 3g protein: 2.9g exchange other carbs: 1 vitamin a iu: 646IU niacin equivalents: 3mg vitamin b6: 0mg vitamin c: 22mg folate: 95mcg calcium: 31mg iron: 1mg magnesium: 39mg thiamin: 0mg,2
276,Alfajores Argentinean Style,"1 ⅔ cups unbleached all-purpose flour , 2 ½ cups cornstarch , ½ teaspoon baking soda , 2 teaspoons baking powder , 1 cup unsalted butter, softened , ¾ cup white sugar , 3 egg yolks , 1 teaspoon vanilla rum , ½ teaspoon vanilla extract , ½ teaspoon lemon extract , 2 teaspoons lemon zest , 1 (11.5 ounce) jar dulce de leche , ½ cup unsweetened shredded coconut",total fat: 6.8g saturated fat: 4.1g cholesterol: 32mg sodium: 65mg potassium: 17mg carbohydrates: 22.5g fiber: 0.5g sugar: 8g protein: 1.4g exchange other carbs: 2 vitamin a iu: 178IU niacin equivalents: 0mg vitamin b6: 0mg vitamin c: 0mg folate: 11mcg calcium: 20mg iron: 0mg magnesium: 3mg thiamin: 0mg,36
277,Peruvian Arroz con Pollo,"¼ cup vegetable oil, divided , 6 chicken thighs, skinned and patted dry , 6 chicken drumsticks with skin, patted dry , salt and black pepper to taste , 1 ½ bunches fresh cilantro, leaves picked from stems , 6 cloves garlic, peeled and coarsely chopped , 1 aji (Peruvian) pepper, seeded and deveined , 1 tablespoon Worcestershire sauce , ½ cup orange juice , 2 cups uncooked white rice , 2 onions, chopped , ½ cup white wine , 3 ½ cups chicken broth , 1 teaspoon freshly ground black pepper , 1 large carrot, peeled and diced , 1 bell pepper, any color, sliced into rings , ¾ cup frozen peas",total fat: 29.7g saturated fat: 7.1g cholesterol: 136mg sodium: 198mg potassium: 723mg carbohydrates: 65.2g fiber: 3.5g sugar: 6g protein: 45.7g exchange other carbs: 5 vitamin a iu: 3664IU niacin equivalents: 21mg vitamin b6: 1mg vitamin c: 39mg folate: 155mcg calcium: 78mg iron: 5mg magnesium: 77mg thiamin: 1mg,6
278,Cuban-Style Yuca,"2 pounds yuca, peeled and sliced lengthwise , ½ teaspoon salt , ¼ cup olive oil , ½ onion, diced , 4 cloves garlic, minced , ½ teaspoon fresh lemon juice",total fat: 9g saturated fat: 1.3g cholesterol: 0mg sodium: 204mg potassium: 36mg carbohydrates: 43.4g fiber: 2.1g sugar: 3g protein: 5.7g exchange other carbs: 3 vitamin a iu: 1IU niacin equivalents: 0mg vitamin b6: 0mg vitamin c: 77mg folate: 4mcg calcium: 151mg iron: 5mg magnesium: 2mg thiamin: 0mg,6
279,Pina Colada Sorbet,"1 1/2 cups white sugar,1 1/2 cups water,1 (20 ounce) can canned crushed pineapple, drained,1 (13.5 ounce) can coconut milk,1/4 cup lime juice",Total Fat: 10.3gSaturated Fat: 9.0gCholesterol: 0mgSodium: 8mgPotassium: 201mgTotal Carbohydrates: 50.5gDietary Fiber: 1.1gProtein: 1.3gSugars: 48gVitamin A: 30IUVitamin C: 9mgCalcium: 21mgIron: 2mgThiamin: 0mgNiacin: 1mgVitamin B6: 0mgMagnesium: 33mgFolate: 11mcg,8
280,Caribbean Grilled Crab Cakes,"For Crab Cakes:,3/4 pound crabmeat,1 cup plain bread crumbs,3/4 cup mayonnaise,1 egg, beaten,2 green onions, minced,Hot sauce, to taste,Salt and pepper, to taste,For Mango Salsa:,1 mango, peeled, pitted and diced,1 red onion, diced,3 tablespoons chopped fresh basil,3 tablespoons chopped fresh cilantro,1 lime, juiced,Minced jalapeno, to taste,Salt and pepper, to taste,2 tablespoons vegetable oil",Total Fat: 10.9gSaturated Fat: 2.0gCholesterol: 32mgSodium: 195mgPotassium: 150mgTotal Carbohydrates: 8.9gDietary Fiber: 0.8gProtein: 6.4gSugars: 3gVitamin A: 250IUVitamin C: 7mgCalcium: 34mgIron: 1mgThiamin: 0mgNiacin: 3mgVitamin B6: 0mgMagnesium: 19mgFolate: 24mcg,16
