id,recipe_name,recipe_ingredients,recipe_nutrition,recipe_servings
122,Authentic Mexican Shrimp Cocktail (Coctel de Camarones estilo Mexicano),"⅓ cup Spanish onion, chopped , ¼ cup freshly squeezed lime juice , 1 pound chilled cooked medium shrimp - peeled, deveined, and tails removed , 2 roma (plum) tomatoes, chopped , 1 cucumber, finely chopped , 1 stalk celery, finely chopped , 1 jalapeno pepper, seeded and finely chopped , 2 teaspoons salt , 2 teaspoons ground black pepper , 1 ½ cups chilled tomato and clam juice cocktail (such as Clamato®) , 1 cup chilled ketchup (such as Heinz®) , 1 bunch fresh cilantro - stems discarded and leaves chopped , 2 tablespoons hot pepper sauce (such as Valentina®) , 2 avocados - peeled, pitted, and chopped",total fat: 16.5g saturated fat: 2.6g cholesterol: 221mg sodium: 2626mg potassium: 1348mg carbohydrates: 41.8g fiber: 9.2g sugar: 21g protein: 28.8g exchange other carbs: 3 vitamin a iu: 2470IU niacin equivalents: 13mg vitamin b6: 1mg vitamin c: 49mg folate: 127mcg calcium: 114mg iron: 5mg magnesium: 107mg thiamin: 0mg,4
123,Classic Cuban Midnight (Medianoche) Sandwich,"4 sweet bread rolls , ½ cup mayonnaise , ¼ cup prepared mustard , 1 pound thinly sliced cooked ham , 1 pound thinly sliced fully cooked pork , 1 pound sliced Swiss cheese , 1 cup dill pickle slices , 2 tablespoons butter, melted",total fat: 88.4g saturated fat: 36.7g cholesterol: 275mg sodium: 3309mg potassium: 1115mg carbohydrates: 69.1g fiber: 4.4g sugar: 4g protein: 92.1g exchange other carbs: 5 vitamin a iu: 1324IU niacin equivalents: 35mg vitamin b6: 2mg vitamin c: 41mg folate: 47mcg calcium: 966mg iron: 6mg magnesium: 136mg thiamin: 2mg,4
124,Green Chili Stew,"1 tablespoon vegetable oil , 2 pounds cubed beef stew meat , 1 onion, chopped , 1 (10 ounce) can diced tomatoes with green chile peppers , 1 ½ cups beef broth , 1 (4 ounce) can chopped green chile peppers , 1 teaspoon garlic salt , 1 teaspoon ground cumin , salt to taste , ground black pepper to taste , 2 large potatoes, peeled and cubed",total fat: 26.5g saturated fat: 9.6g cholesterol: 122mg sodium: 1455mg potassium: 1163mg carbohydrates: 33g fiber: 3.3g sugar: 4g protein: 43.6g exchange other carbs: 2 vitamin a iu: 482IU niacin equivalents: 16mg vitamin b6: 1mg vitamin c: 40mg folate: 36mcg calcium: 52mg iron: 5mg magnesium: 81mg thiamin: 0mg,4
125,Caribbean Chicken Salad,"2 skinless, boneless chicken breast halves , ½ cup teriyaki marinade sauce , 2 tomatoes, seeded and chopped , ½ cup chopped onion , 2 teaspoons minced jalapeno pepper , 2 teaspoons chopped fresh cilantro , ¼ cup Dijon mustard , ¼ cup honey , 1 ½ tablespoons white sugar , 1 tablespoon vegetable oil , 1 ½ tablespoons cider vinegar , 1 ½ teaspoons lime juice , ¾ pound mixed salad greens , 1 (8 ounce) can pineapple chunks, drained , 4 cups corn tortilla chips",total fat: 11.3g saturated fat: 1.6g cholesterol: 34mg sodium: 1561mg potassium: 777mg carbohydrates: 68.8g fiber: 4.8g sugar: 44g protein: 18.9g exchange other carbs: 5 vitamin a iu: 2899IU niacin equivalents: 10mg vitamin b6: 0mg vitamin c: 36mg folate: 122mcg calcium: 119mg iron: 3mg magnesium: 88mg thiamin: 0mg,4
126,Flan Mexicano (Mexican Flan),"1 cup white sugar,1 cup whole milk,1 (14 ounce) can sweetened condensed milk,3 eggs,3 egg yolks,1/4 cup freshly squeezed orange juice,1 tablespoon grated orange peel,1 tablespoon vanilla extract,1 tablespoon cornstarch,1 cup heavy cream",Total Fat: 19.8gSaturated Fat: 11.0gCholesterol: 207mgSodium: 115mgPotassium: 300mgTotal Carbohydrates: 56.3gDietary Fiber: 0.1gProtein: 8.9gSugars: 54gVitamin A: 799IUVitamin C: 6mgCalcium: 213mgIron: 1mgThiamin: 0mgNiacin: 2mgVitamin B6: 0mgMagnesium: 22mgFolate: 29mcg,8
127,Tomatillo Soup,"2 skinless, boneless chicken breast halves - pounded thin , 3 tablespoons olive oil , 1 onion, chopped , 3 cloves garlic, minced , 1 pound chopped tomatillos , 2 jalapeno peppers, seeded and minced , 4 cups chicken stock , ¼ teaspoon cayenne pepper , ½ teaspoon hot pepper sauce , 2 tablespoons chopped fresh cilantro , ¼ cup sour cream (optional) , salt to taste , ground black pepper to taste",total fat: 10.1g saturated fat: 2.4g cholesterol: 27mg sodium: 43mg potassium: 367mg carbohydrates: 7.4g fiber: 2g sugar: 4g protein: 10.5g exchange other carbs: 1 vitamin a iu: 291IU niacin equivalents: 8mg vitamin b6: 0mg vitamin c: 14mg folate: 14mcg calcium: 29mg iron: 1mg magnesium: 31mg thiamin: 0mg,6
128,Merenges,"4 egg whites , 1 pinch salt , ¼ teaspoon cream of tartar , 1 ⅓ cups sugar , ½ teaspoon grated lemon zest",total fat: 0g saturated fat: 0g cholesterol: 0mg sodium: 4mg potassium: 7mg carbohydrates: 5.4g fiber: 0g sugar: 5g protein: 0.3g exchange other carbs: 1 vitamin a iu: 0IU niacin equivalents: 0mg vitamin b6: 0mg vitamin c: 0mg folate: 0mcg calcium: 0mg iron: 0mg magnesium: 0mg thiamin: 0mg,50
129,Peruvian Lomo Saltado,"1 (16 ounce) package frozen French fries , vegetable oil as needed , 1 pound beef tri tip, sliced 1/8 to 1/4 inch thick , salt and pepper to taste , 1 large onion, sliced into strips , 3 large tomatoes, peeled, seeded, and sliced into strips , 1 yellow chili pepper (preferably Peruvian aji amarillo) , ¼ cup distilled white vinegar , 1 dash soy sauce to taste , 2 tablespoons chopped fresh parsley",total fat: 27.3g saturated fat: 8.2g cholesterol: 74mg sodium: 606mg potassium: 1250mg carbohydrates: 37.8g fiber: 4.6g sugar: 6g protein: 26.3g exchange other carbs: 3 vitamin a iu: 1433IU niacin equivalents: 12mg vitamin b6: 1mg vitamin c: 69mg folate: 80mcg calcium: 43mg iron: 4mg magnesium: 70mg thiamin: 0mg,4
130,Chiles Rellenos (Stuffed Peppers),"4 fresh poblano chile peppers , ½ pound lean ground beef , 1 onion, chopped , 1 clove garlic, chopped , salt and pepper to taste , 3 eggs, separated , 1 cup shredded mozzarella cheese , 2 roma (plum) tomatoes, chopped , ½ cup all-purpose flour , 1 cup corn oil",total fat: 70.6g saturated fat: 13.9g cholesterol: 195mg sodium: 270mg potassium: 464mg carbohydrates: 19.7g fiber: 2.8g sugar: 4g protein: 25.4g exchange other carbs: 2 vitamin a iu: 734IU niacin equivalents: 9mg vitamin b6: 0mg vitamin c: 44mg folate: 75mcg calcium: 264mg iron: 3mg magnesium: 38mg thiamin: 0mg,4
131,Frijoles a la Charra,"1 pound dry pinto beans , 5 cloves garlic, chopped , 1 teaspoon salt , ½ pound bacon, diced , 1 onion, chopped , 2 fresh tomatoes, diced , 1 (3.5 ounce) can sliced jalapeno peppers , 1 (12 fluid ounce) can beer , ⅓ cup chopped fresh cilantro",total fat: 13.8g saturated fat: 4.5g cholesterol: 19mg sodium: 741mg potassium: 775mg carbohydrates: 39.8g fiber: 12.8g sugar: 2g protein: 16g exchange other carbs: 3 vitamin a iu: 608IU niacin equivalents: 5mg vitamin b6: 0mg vitamin c: 8mg folate: 238mcg calcium: 77mg iron: 3mg magnesium: 79mg thiamin: 0mg,8
132,Ken's Kickin' Posole,"2 fresh poblano chile peppers , 8 ounces bacon, chopped , 1 tablespoon bacon drippings , 2 pounds pork loin, cut into 1-inch cubes , 1 onion, diced , 10 cloves garlic, minced , 2 jalapeno peppers, seeded and diced , 1 teaspoon dried Mexican oregano , 2 teaspoons ground cumin , 1 teaspoon New Mexico chile powder , ¼ teaspoon ground cloves , ½ teaspoon kosher salt , 1 bunch cilantro, chopped , 8 cups chicken stock , 1 (14.5 ounce) can mild red enchilada sauce , 2 (29 ounce) cans white hominy, rinsed and drained",total fat: 15.8g saturated fat: 5g cholesterol: 56mg sodium: 1103mg potassium: 532mg carbohydrates: 26.7g fiber: 5g sugar: 4g protein: 21g exchange other carbs: 2 vitamin a iu: 612IU niacin equivalents: 9mg vitamin b6: 1mg vitamin c: 19mg folate: 17mcg calcium: 60mg iron: 2mg magnesium: 54mg thiamin: 1mg,12
133,South Texas Carne Guisada,"1 tablespoon vegetable oil , 2 pounds beef sirloin, cut into 1/2-inch cubes , 1 large onion, chopped , 1 large red bell pepper, chopped , 4 large tomatoes, chopped , 5 cloves garlic, minced , 2 tablespoons ground cumin , 1 teaspoon dried, crushed Mexican oregano , 1 tablespoon garlic powder , 1 teaspoon salt , ½ teaspoon ground black pepper , ½ teaspoon paprika , ⅓ cup water",total fat: 16.9g saturated fat: 6g cholesterol: 81mg sodium: 457mg potassium: 778mg carbohydrates: 11.8g fiber: 3g sugar: 6g protein: 27.4g exchange other carbs: 1 vitamin a iu: 2014IU niacin equivalents: 10mg vitamin b6: 1mg vitamin c: 54mg folate: 44mcg calcium: 58mg iron: 5mg magnesium: 55mg thiamin: 0mg,6
134,Flan II,"1/2 cup white sugar,2 cups milk,2 eggs, beaten,2 egg yolks, beaten,3/8 cup white sugar",Total Fat: 7.1gSaturated Fat: 3.0gCholesterol: 205mgSodium: 89mgPotassium: 226mgTotal Carbohydrates: 49.9gDietary Fiber: 0gProtein: 8.5gSugars: 50gVitamin A: 472IUVitamin C: 0mgCalcium: 167mgIron: 1mgThiamin: 0mgNiacin: 2mgVitamin B6: 0mgMagnesium: 17mgFolate: 30mcg,4
135,Argentine Lentil Stew,"1 cup dry lentils,1 quart water,1 cube vegetable bouillon,3 medium tomatoes, peeled and diced,1 large onion, diced,1 carrot, sliced,1 medium apple - peeled, cored and diced,1/2 cup frozen peas,1 large clove garlic,1 tablespoon olive oil,1/4 cup barbeque sauce,1/2 teaspoon paprika,salt and pepper to taste",Total Fat: 4.3gSaturated Fat: 1.0gCholesterol: 0mgSodium: 225mgPotassium: 877mgTotal Carbohydrates: 46.3gDietary Fiber: 13.5gProtein: 13.4gSugars: 16gVitamin A: 3921IUVitamin C: 23mgCalcium: 64mgIron: 5mgThiamin: 0mgNiacin: 4mgVitamin B6: 0mgMagnesium: 70mgFolate: 253mcg,4
136,Homemade Albondigas Soup,"1 pound ground beef , 1 bunch cilantro, finely chopped , 1 small onion, chopped , 4 cloves garlic, minced , 1 pinch garlic salt , 1 pinch onion powder , salt and ground black pepper to taste , 4 (14.5 ounce) cans chicken broth , 4 large carrots, cut into 1/2 inch pieces , 3 stalks celery, cut into 1 inch pieces , 3 potatoes, cubed",total fat: 12.1g saturated fat: 4.7g cholesterol: 46mg sodium: 159mg potassium: 886mg carbohydrates: 26g fiber: 4.5g sugar: 4g protein: 15.7g exchange other carbs: 2 vitamin a iu: 8741IU niacin equivalents: 8mg vitamin b6: 1mg vitamin c: 28mg folate: 46mcg calcium: 56mg iron: 3mg magnesium: 47mg thiamin: 0mg,6
137,Carne Guisada II,"2 tablespoons cooking oil , 1 pound beef stew meat , ½ (6 ounce) can tomato paste , 1 (10.5 ounce) can beef broth , ½ cup water , 2 cloves garlic, crushed , 1 teaspoon chili powder , ½ teaspoon ground cumin , ½ teaspoon black pepper , salt to taste , 2 serrano chile peppers, seeded and chopped , 2 teaspoons cornstarch",total fat: 29.1g saturated fat: 10g cholesterol: 76mg sodium: 482mg potassium: 629mg carbohydrates: 6.6g fiber: 1.3g sugar: 3g protein: 22.8g exchange other carbs: 1 vitamin a iu: 553IU niacin equivalents: 9mg vitamin b6: 1mg vitamin c: 7mg folate: 12mcg calcium: 29mg iron: 3mg magnesium: 36mg thiamin: 0mg,4
138,Spiced Orange Cranberry Sauce,"2 pounds cranberries,2 tablespoons orange zest,3 cinnamon sticks,1 pint orange juice,2 cups packed brown sugar,2 cups water",Total Fat: 0gSaturated Fat: 0.0gCholesterol: 0mgSodium: 3mgPotassium: 38mgTotal Carbohydrates: 9.4gDietary Fiber: 0.8gProtein: 0.1gSugars: 8gVitamin A: 25IUVitamin C: 6mgCalcium: 10mgIron: 0mgThiamin: 0mgNiacin: 0mgVitamin B6: 0mgMagnesium: 3mgFolate: 3mcg,64
139,Caribbean Holiday Shrimp,"1 tablespoon vegetable oil , 2 tablespoons minced fresh ginger root , 2 limes, juiced , 2 cloves garlic, minced , 1 tablespoon soy sauce , ½ teaspoon white sugar , ½ teaspoon crushed red pepper flakes , 2 pounds large cooked shrimp, peeled, tails on , ½ cup chopped fresh cilantro",total fat: 3.1g saturated fat: 0.5g cholesterol: 221mg sodium: 369mg potassium: 256mg carbohydrates: 2.9g fiber: 0.7g sugar: 1g protein: 24.1g exchange other carbs: 0 vitamin a iu: 536IU niacin equivalents: 9mg vitamin b6: 0mg vitamin c: 9mg folate: 8mcg calcium: 54mg iron: 4mg magnesium: 42mg thiamin: 0mg,8
140,Vegetarian Refried Beans,"1 pound dry pinto beans, rinsed , 2 tablespoons minced garlic, divided , 1 medium tomato, diced , 2 tablespoons ground cumin , 1 tablespoon chili powder , 2 tablespoons olive oil , salt to taste",total fat: 3.1g saturated fat: 0.4g cholesterol: 0mg sodium: 595mg potassium: 588mg carbohydrates: 25.3g fiber: 6.3g sugar: 1g protein: 8.5g exchange other carbs: 2 vitamin a iu: 294IU niacin equivalents: 2mg vitamin b6: 0mg vitamin c: 5mg folate: 201mcg calcium: 58mg iron: 3mg magnesium: 73mg thiamin: 0mg,12
141,Picadillo,"2 tablespoons olive oil , 1 pound ground beef , ½ pound chorizo sausage, chopped , 1 large onion, chopped , ½ cup chopped red bell pepper , 2 cloves garlic, chopped , 1 tablespoon ground cumin , 2 teaspoons chili powder , 1 teaspoon dried oregano , 1 teaspoon paprika , ¼ teaspoon cayenne pepper , ¼ teaspoon ground cinnamon , 1 ½ cups canned diced tomatoes , ¾ cup beef stock , 1 tablespoon white sugar , ½ cup raisins , ¼ cup chopped pimento-stuffed green olives , 2 tablespoons apple cider vinegar , 1 tablespoon capers, drained , ⅓ cup slivered almonds, toasted , 1 tablespoon lime juice",total fat: 32.7g saturated fat: 10g cholesterol: 79mg sodium: 867mg potassium: 673mg carbohydrates: 22.6g fiber: 3.2g sugar: 14g protein: 25.5g exchange other carbs: 2 vitamin a iu: 1569IU niacin equivalents: 10mg vitamin b6: 1mg vitamin c: 28mg folate: 23mcg calcium: 85mg iron: 5mg magnesium: 54mg thiamin: 0mg,6
142,Pan de Muertos (Mexican Bread of the Dead),"¼ cup margarine , ¼ cup milk , ¼ cup warm water (110 degrees F/45 degrees C) , 3 cups all-purpose flour , 1 ¼ teaspoons active dry yeast , ½ teaspoon salt , 2 teaspoons anise seed , ¼ cup white sugar , 2 eggs, beaten , 2 teaspoons orange zest , ¼ cup white sugar , ¼ cup orange juice , 1 tablespoon orange zest , 2 tablespoons white sugar",total fat: 5.1g saturated fat: 1g cholesterol: 31mg sodium: 156mg potassium: 80mg carbohydrates: 35.7g fiber: 1.1g sugar: 11g protein: 4.8g exchange other carbs: 3 vitamin a iu: 231IU niacin equivalents: 3mg vitamin b6: 0mg vitamin c: 4mg folate: 73mcg calcium: 21mg iron: 2mg magnesium: 10mg thiamin: 0mg,12
143,Havana Slow Cooker Pork Tenderloin,"1 onion, sliced , 3 pounds pork tenderloin , 3 tablespoons minced garlic , ½ cup orange juice , 3 tablespoons red wine vinegar , 1 lemon, juiced , 1 tablespoon ground cumin , 1 tablespoon grill seasoning (such as Montreal Steak Seasoning®) , 1 teaspoon salt , 1 teaspoon ground red pepper , 3 bay leaves , 2 tablespoons grated lemon peel",total fat: 5.1g saturated fat: 1.7g cholesterol: 98mg sodium: 927mg potassium: 696mg carbohydrates: 7.3g fiber: 0.9g sugar: 3g protein: 36.1g exchange other carbs: 1 vitamin a iu: 185IU niacin equivalents: 16mg vitamin b6: 1mg vitamin c: 16mg folate: 11mcg calcium: 45mg iron: 2mg magnesium: 50mg thiamin: 1mg,6
144,Jerk Chicken Wings,"½ yellow onion, chopped , ½ cup green onions, sliced , 6 cloves garlic , 3 habanero peppers, seeded and chopped , 2 tablespoons fresh thyme leaves , 1 tablespoon kosher salt , 2 teaspoons ground black pepper , 2 teaspoons ground allspice , 1 teaspoon dried thyme , ½ teaspoon ground cinnamon , ½ teaspoon ground cumin , ½ teaspoon freshly grated nutmeg , 2 tablespoons vegetable oil , 3 tablespoons soy sauce , 2 tablespoons brown sugar , ⅓ cup lime juice , 3 pounds chicken wing drumettes , cooking spray",total fat: 15.9g saturated fat: 3.9g cholesterol: 48mg sodium: 1463mg potassium: 244mg carbohydrates: 11.4g fiber: 1.5g sugar: 6g protein: 16.6g exchange other carbs: 1 vitamin a iu: 268IU niacin equivalents: 7mg vitamin b6: 0mg vitamin c: 11mg folate: 16mcg calcium: 51mg iron: 2mg magnesium: 26mg thiamin: 0mg,6
145,Salsa Cube Steaks,"1 pound beef cube steak , ½ teaspoon ground cumin , salt and pepper to taste , 1 green bell pepper, sliced , 1 onion, sliced , 1 (16 ounce) jar salsa , water as needed",total fat: 11g saturated fat: 4.2g cholesterol: 69mg sodium: 1022mg potassium: 831mg carbohydrates: 11.1g fiber: 2.8g sugar: 5g protein: 26.7g exchange other carbs: 1 vitamin a iu: 441IU niacin equivalents: 10mg vitamin b6: 1mg vitamin c: 28mg folate: 22mcg calcium: 47mg iron: 3mg magnesium: 50mg thiamin: 0mg,4
146,Jamaican Oxtail with Broad Beans,"1 pound beef oxtail, cut into pieces , 1 large onion, chopped , 1 green onion, thinly sliced , 2 cloves garlic, minced , 1 teaspoon minced fresh ginger root , 1 scotch bonnet chile pepper, chopped , 2 tablespoons soy sauce , 1 sprig fresh thyme, chopped , ½ teaspoon salt , 1 teaspoon black pepper , 2 tablespoons vegetable oil , 1 ½ cups water , 1 cup canned fava beans, drained , 1 teaspoon whole allspice berries , 1 tablespoon cornstarch , 2 tablespoons water",total fat: 22.4g saturated fat: 7.5g cholesterol: 125mg sodium: 1089mg potassium: 302mg carbohydrates: 17.6g fiber: 3.7g sugar: 2g protein: 38.8g exchange other carbs: 1 vitamin a iu: 62IU niacin equivalents: 1mg vitamin b6: 0mg vitamin c: 5mg folate: 22mcg calcium: 51mg iron: 6mg magnesium: 12mg thiamin: 0mg,4
147,Migas II,"4 teaspoons corn oil,12 (6 inch) corn tortillas,6 eggs, beaten,salt to taste",Total Fat: 12.8gSaturated Fat: 3.0gCholesterol: 166mgSodium: 115mgPotassium: 199mgTotal Carbohydrates: 29.2gDietary Fiber: 3.9gProtein: 10.2gSugars: 2gVitamin A: 317IUVitamin C: 0mgCalcium: 93mgIron: 1mgThiamin: 0mgNiacin: 3mgVitamin B6: 0mgMagnesium: 52mgFolate: 21mcg,5
148,Roasted Tomatillo and Garlic Salsa,"1 pound fresh tomatillos, husks removed , 1 head garlic cloves, separated and peeled , 3 fresh jalapeno peppers , 1 bunch fresh cilantro , ½ cup water, or as needed , salt and pepper to taste",total fat: 0.3g saturated fat: 0g cholesterol: 0mg sodium: 2mg potassium: 91mg carbohydrates: 2.5g fiber: 0.6g sugar: 1g protein: 0.5g exchange other carbs: 0 vitamin a iu: 232IU niacin equivalents: 1mg vitamin b6: 0mg vitamin c: 5mg folate: 4mcg calcium: 9mg iron: 0mg magnesium: 6mg thiamin: 0mg,20
149,Cuban Marinated Steak,"½ teaspoon cumin seeds , ¼ cup orange juice , 2 tablespoons vegetable oil , 2 tablespoons Montreal-style steak seasoning , 2 ¼ teaspoons lime juice , 1 ½ teaspoons dried oregano , 1 ½ pounds beef rib-eye steaks",total fat: 15.8g saturated fat: 4.4g cholesterol: 59mg sodium: 1428mg potassium: 372mg carbohydrates: 3.9g fiber: 0.5g sugar: 1g protein: 21.2g exchange other carbs: 1 vitamin a iu: 75IU niacin equivalents: 8mg vitamin b6: 0mg vitamin c: 9mg folate: 13mcg calcium: 52mg iron: 3mg magnesium: 27mg thiamin: 0mg,4
150,Empanadas (Beef Turnovers),"1 tablespoon Goya Extra Virgin Olive Oil , ½ pound ground beef , ½ medium yellow onion, finely chopped , ¼ cup Goya Tomato Sauce , 6 Goya Spanish Olives Stuffed with Minced Pimientos, thinly sliced , 2 tablespoons Goya Sofrito , 1 packet Sazon Goya with Coriander and Annatto , 1 teaspoon Goya Minced Garlic , ½ teaspoon Goya Dried Oregano , Goya Ground Black Pepper, to taste , 1 (14 ounce) package Goya Discos (yellow or white), thawed , Goya Corn Oil, for frying",,4
151,Chile Colorado,"9 New Mexico dry chiles - washed, with stems and seeds removed , 3 cups water , 5 pounds boneless beef chuck roast, trimmed of fat , ½ cup all-purpose flour , 1 tablespoon kosher salt , 1 tablespoon black pepper , 3 tablespoons olive oil , 1 large yellow onion, chopped , 2 cups beef stock or water",total fat: 41.6g saturated fat: 15.9g cholesterol: 136mg sodium: 624mg potassium: 571mg carbohydrates: 6.3g fiber: 0.7g sugar: 1g protein: 33.7g exchange other carbs: 1 vitamin a iu: 212IU niacin equivalents: 11mg vitamin b6: 1mg vitamin c: 4mg folate: 22mcg calcium: 30mg iron: 4mg magnesium: 37mg thiamin: 0mg,12
152,Chilaquiles II,"2 cups oil for frying , ¼ cup chopped onion , 30 (6 inch) corn tortillas, torn into strips , 6 eggs, lightly beaten , 2 teaspoons salt , 1 (7.75 ounce) can Mexican style hot tomato sauce , ½ cup water , ½ cup shredded Monterey Jack cheese",total fat: 11.3g saturated fat: 2.9g cholesterol: 117mg sodium: 677mg potassium: 196mg carbohydrates: 36.3g fiber: 5g sugar: 2g protein: 9.6g exchange other carbs: 3 vitamin a iu: 191IU niacin equivalents: 3mg vitamin b6: 0mg vitamin c: 0mg folate: 20mcg calcium: 122mg iron: 2mg magnesium: 62mg thiamin: 0mg,10
153,Fideo (Mexican Spaghetti),"2 tablespoons vegetable oil , 4 skinless, boneless chicken breast halves , 1 (12 ounce) package spaghetti noodles, broken in half , 5 roma (plum) tomatoes, chopped , 1 large onion, chopped , ½ tablespoon ground cumin , 2 ½ teaspoons chili powder , salt and pepper to taste , 1 ½ cups water , 1 cup shredded Cheddar cheese",total fat: 14.4g saturated fat: 6g cholesterol: 70mg sodium: 213mg potassium: 539mg carbohydrates: 47.9g fiber: 3.3g sugar: 4g protein: 32.2g exchange other carbs: 3 vitamin a iu: 1011IU niacin equivalents: 20mg vitamin b6: 1mg vitamin c: 10mg folate: 156mcg calcium: 205mg iron: 3mg magnesium: 70mg thiamin: 1mg,6
154,Tostones (Fried Plantains),"2 cups vegetable oil for frying , 3 plantains, peeled and sliced into 1-inch pieces , salt to taste , garlic powder to taste",total fat: 7.7g saturated fat: 1.1g cholesterol: 0mg sodium: 197mg potassium: 449mg carbohydrates: 28.7g fiber: 2.1g sugar: 13g protein: 1.2g exchange other carbs: 2 vitamin a iu: 1009IU niacin equivalents: 1mg vitamin b6: 0mg vitamin c: 17mg folate: 20mcg calcium: 3mg iron: 1mg magnesium: 33mg thiamin: 0mg,6
155,Spicy Lime-Cilantro Marinated Flank Steak,"6 cloves garlic , ½ red onion, chopped , 2 limes, juiced , 1 medium jalapeno chile pepper , 2 tablespoons fresh thyme leaves , 1 cup loosely packed cilantro leaves , ¾ cup corn oil , 2 tablespoons honey , 3 pounds beef flank steak , kosher salt to taste",total fat: 24.6g saturated fat: 4.9g cholesterol: 34mg sodium: 83mg potassium: 270mg carbohydrates: 5.6g fiber: 0.4g sugar: 4g protein: 18.6g exchange other carbs: 1 vitamin a iu: 384IU niacin equivalents: 7mg vitamin b6: 0mg vitamin c: 4mg folate: 12mcg calcium: 23mg iron: 1mg magnesium: 18mg thiamin: 0mg,9
156,Cuban-Style Roast Pork,"4 cloves garlic , 2 teaspoons kosher salt , 1 teaspoon ground black pepper , 1 teaspoon ground cumin , 1 teaspoon dried oregano , 1 teaspoon ground coriander , 3 tablespoons lime juice , 3 tablespoons orange juice , 3 tablespoons olive oil , 1 ½ teaspoons white wine vinegar , 1 (4 pound) pork shoulder roast",total fat: 14.8g saturated fat: 4.1g cholesterol: 85mg sodium: 540mg potassium: 408mg carbohydrates: 2.1g fiber: 0.4g sugar: 1g protein: 29.4g exchange other carbs: 0 vitamin a iu: 39IU niacin equivalents: 11mg vitamin b6: 0mg vitamin c: 6mg folate: 4mcg calcium: 34mg iron: 2mg magnesium: 29mg thiamin: 1mg,8
157,Caribbean Coconut Chicken,"4 skinless, boneless chicken breasts , 1 teaspoon vegetable oil , 1 ½ onions, chopped , 1 red bell pepper, chopped , 1 green bell pepper, chopped , 1 tablespoon chopped roasted garlic , ½ (14 ounce) can coconut milk , salt and pepper to taste , 1 pinch crushed red pepper flakes",total fat: 13.3g saturated fat: 9.9g cholesterol: 68mg sodium: 87mg potassium: 597mg carbohydrates: 9.2g fiber: 2.5g sugar: 4g protein: 29.4g exchange other carbs: 1 vitamin a iu: 1171IU niacin equivalents: 20mg vitamin b6: 1mg vitamin c: 68mg folate: 36mcg calcium: 41mg iron: 3mg magnesium: 67mg thiamin: 0mg,4
158,Chicken Taquitos,"4 skinless, boneless chicken breast halves - cooked and shredded , 1 ½ cups shredded smoked Cheddar and Swiss cheese blend , 1 (7 ounce) can green salsa , 1 cup chopped onion , 20 (6 inch) corn tortillas , 1 quart peanut oil for frying, or as needed , 1 cup sour cream (optional) , 1 cup chunky salsa (optional) , 1 cup guacamole (optional)",total fat: 13.9g saturated fat: 5g cholesterol: 32mg sodium: 207mg potassium: 221mg carbohydrates: 15.4g fiber: 2.4g sugar: 2g protein: 10.9g exchange other carbs: 1 vitamin a iu: 305IU niacin equivalents: 4mg vitamin b6: 0mg vitamin c: 2mg folate: 12mcg calcium: 118mg iron: 1mg magnesium: 34mg thiamin: 0mg,20
159,West Indian Curried Chicken,"3 tablespoons vegetable oil , 1 (3 pound) chicken, cut into pieces , 1 large onion, diced , 6 cloves garlic, minced , 4 large potatoes - peeled and cubed , 2 tablespoons salt , ¼ cup Jamaican curry powder , hot pepper sauce to taste",total fat: 31.4g saturated fat: 8.3g cholesterol: 128mg sodium: 1908mg potassium: 1185mg carbohydrates: 36.6g fiber: 5.5g sugar: 2g protein: 36.1g exchange other carbs: 3 vitamin a iu: 275IU niacin equivalents: 21mg vitamin b6: 1mg vitamin c: 42mg folate: 48mcg calcium: 65mg iron: 4mg magnesium: 87mg thiamin: 0mg,8
160,Black Beans a la Olla,"2 tablespoons olive oil , 2 large onions, diced , 6 cloves garlic, chopped , 1 (19 ounce) can black beans, rinsed and drained , 1 (16 ounce) can tomato sauce , 2 tomatoes, diced , 2 teaspoons ground cumin , ½ teaspoon cayenne pepper , ¾ cup chopped fresh cilantro , ½ cup chopped green onions , ¼ cup chopped fresh cilantro",total fat: 5.3g saturated fat: 0.8g cholesterol: 0mg sodium: 753mg potassium: 788mg carbohydrates: 27.5g fiber: 9.2g sugar: 7g protein: 8g exchange other carbs: 2 vitamin a iu: 1281IU niacin equivalents: 3mg vitamin b6: 0mg vitamin c: 21mg folate: 89mcg calcium: 80mg iron: 4mg magnesium: 60mg thiamin: 0mg,6
161,Pressure Cooker Carnitas,"3 tablespoons canola oil , 3 pounds boneless pork shoulder, cut into 1 1/2-inch cubes , 2 fresh poblano peppers, roughly chopped, or more to taste , 3 jalapeno peppers, roughly chopped, or more to taste , 1 serrano pepper, roughly chopped, or more to taste , 1 large onion, roughly chopped , 4 cloves garlic, roughly chopped , 2 teaspoons ground coriander , 3 teaspoons ground cumin , 1 ½ cups beef broth",total fat: 8.6g saturated fat: 2g cholesterol: 43mg sodium: 131mg potassium: 275mg carbohydrates: 2.8g fiber: 1g sugar: 1g protein: 15.5g exchange other carbs: 0 vitamin a iu: 86IU niacin equivalents: 6mg vitamin b6: 0mg vitamin c: 14mg folate: 9mcg calcium: 26mg iron: 1mg magnesium: 20mg thiamin: 0mg,12
