id,recipe_name,recipe_ingredients,recipe_nutrition,recipe_servings
359,Flan Mexicano (Mexican Flan),"1 cup white sugar,1 cup whole milk,1 (14 ounce) can sweetened condensed milk,3 eggs,3 egg yolks,1/4 cup freshly squeezed orange juice,1 tablespoon grated orange peel,1 tablespoon vanilla extract,1 tablespoon cornstarch,1 cup heavy cream",Total Fat: 19.8gSaturated Fat: 11.0gCholesterol: 207mgSodium: 115mgPotassium: 300mgTotal Carbohydrates: 56.3gDietary Fiber: 0.1gProtein: 8.9gSugars: 54gVitamin A: 799IUVitamin C: 6mgCalcium: 213mgIron: 1mgThiamin: 0mgNiacin: 2mgVitamin B6: 0mgMagnesium: 22mgFolate: 29mcg,8
360,Beef Enchiladas with Spicy Red Sauce,"1 tablespoon olive oil , ½ cup finely chopped onion , 4 teaspoons minced garlic , 1 teaspoon dried oregano , 3 ½ teaspoons chili powder , 1 teaspoon dried basil , ¼ teaspoon salt , ¼ teaspoon ground black pepper , 1 teaspoon ground cumin , 1 teaspoon dried cilantro , ½ cup prepared salsa , 1 (6 ounce) can tomato sauce , 1 (6 ounce) can tomato paste , 2 cups chicken broth , 1 pound ground beef , ¾ cup finely chopped onion , 1 tablespoon minced garlic , ½ teaspoon chili powder , ½ teaspoon ground cumin , ½ cup prepared red enchilada sauce , ½ cup beef broth , ½ cup shredded Mexican-style cheese blend , cooking spray , 8 (6 inch) flour tortillas , 2 cups shredded Mexican-style cheese blend , ½ cup chopped fresh cilantro",total fat: 46.9g saturated fat: 24.2g cholesterol: 146mg sodium: 2486mg potassium: 1134mg carbohydrates: 58.4g fiber: 7.3g sugar: 11g protein: 45.2g exchange other carbs: 4 vitamin a iu: 2419IU niacin equivalents: 14mg vitamin b6: 1mg vitamin c: 27mg folate: 101mcg calcium: 180mg iron: 7mg magnesium: 74mg thiamin: 1mg,4
361,Tomatillo Soup,"2 skinless, boneless chicken breast halves - pounded thin , 3 tablespoons olive oil , 1 onion, chopped , 3 cloves garlic, minced , 1 pound chopped tomatillos , 2 jalapeno peppers, seeded and minced , 4 cups chicken stock , ¼ teaspoon cayenne pepper , ½ teaspoon hot pepper sauce , 2 tablespoons chopped fresh cilantro , ¼ cup sour cream (optional) , salt to taste , ground black pepper to taste",total fat: 10.1g saturated fat: 2.4g cholesterol: 27mg sodium: 43mg potassium: 367mg carbohydrates: 7.4g fiber: 2g sugar: 4g protein: 10.5g exchange other carbs: 1 vitamin a iu: 291IU niacin equivalents: 8mg vitamin b6: 0mg vitamin c: 14mg folate: 14mcg calcium: 29mg iron: 1mg magnesium: 31mg thiamin: 0mg,6
362,Super Fajita Marinade,"3 limes, juiced,2 green onions, chopped,3 cloves garlic, minced,3 tablespoons chopped fresh cilantro,2 tablespoons vegetable oil,1/2 teaspoon red pepper flakes,1/4 teaspoon ground coriander,1/4 teaspoon ground anise seed (optional)",,4
363,Cilantro Tomato Corn Salad,"3 ears fresh corn in husks,1/4 cup butter, melted,2 roma (plum) tomatoes, chopped,1 jalapeno pepper, seeded and finely chopped,1/2 small red onion, finely chopped,2 cloves garlic, minced,1/2 bunch fresh cilantro, chopped,salt and freshly ground black pepper to taste,1 pinch salt-free lemon-herb seasoning (such as Mrs. Dash)",Total Fat: 12.4gSaturated Fat: 7.0gCholesterol: 31mgSodium: 97mgPotassium: 325mgTotal Carbohydrates: 15.8gDietary Fiber: 2.7gProtein: 3gSugars: 4gVitamin A: 1240IUVitamin C: 13mgCalcium: 18mgIron: 1mgThiamin: 0mgNiacin: 2mgVitamin B6: 0mgMagnesium: 32mgFolate: 44mcg,4
364,Easy White Chicken Enchiladas,"4 ounces cream cheese, softened , ½ cup sour cream , ½ cup green salsa , 2 (6 ounce) packages seasoned cooked chicken cubes , 1 cup shredded Mexican-style cheese blend , 1 ½ cups white cheese sauce, or queso dip , 6 (8 inch) flour tortillas",total fat: 37.4g saturated fat: 21.3g cholesterol: 138mg sodium: 1588mg potassium: 372mg carbohydrates: 36.7g fiber: 1.8g sugar: 5g protein: 33.7g exchange other carbs: 3 vitamin a iu: 850IU niacin equivalents: 10mg vitamin b6: 0mg vitamin c: 0mg folate: 67mcg calcium: 299mg iron: 3mg magnesium: 28mg thiamin: 0mg,6
365,Pinto Beans With Mexican-Style Seasonings,"1 pound dried pinto beans, rinsed , 2 (10 ounce) cans diced tomatoes with green chile peppers (such as RO*TEL®) , ½ pound bacon, cut into 1/2-inch pieces , 1 yellow onion, chopped , 1 tablespoon chili powder, or to taste , 1 tablespoon ground cumin, or to taste , 1 ½ teaspoons garlic powder, or to taste , ½ bunch fresh cilantro, chopped , salt to taste",total fat: 5.2g saturated fat: 1.5g cholesterol: 10mg sodium: 510mg potassium: 794mg carbohydrates: 40.9g fiber: 13.5g sugar: 2g protein: 16.4g exchange other carbs: 3 vitamin a iu: 817IU niacin equivalents: 5mg vitamin b6: 0mg vitamin c: 9mg folate: 240mcg calcium: 94mg iron: 4mg magnesium: 84mg thiamin: 0mg,8
366,Barbacoa-Style Shredded Beef,"1 (3 pound) beef chuck roast, cut into 6 to 8 chunks , salt and ground black pepper to taste , 2 tablespoons vegetable oil , ½ cup beef broth , ¼ cup apple cider vinegar , ¼ cup fresh lime juice , 4 chipotle peppers in adobo sauce, chopped , 5 cloves garlic, chopped , 1 tablespoon ground cumin , 1 tablespoon dried oregano , ¼ teaspoon ground cloves , 3 bay leaves",total fat: 22.9g saturated fat: 8.2g cholesterol: 77mg sodium: 150mg potassium: 226mg carbohydrates: 2.6g fiber: 0.7g sugar: 0g protein: 20.3g exchange other carbs: 0 vitamin a iu: 56IU niacin equivalents: 6mg vitamin b6: 0mg vitamin c: 3mg folate: 7mcg calcium: 32mg iron: 3mg magnesium: 20mg thiamin: 0mg,8
367,Pork and Green Chile Casserole,"3 tablespoons vegetable oil , 1 ½ pounds boneless pork loin chops, cut into bite-size pieces , 1 ½ cups instant brown rice, uncooked , 1 (10.5 ounce) can condensed cream of chicken soup , 1 (15 ounce) can black beans, rinsed and drained , 1 (14.5 ounce) can diced tomatoes , 2 (4 ounce) cans diced green chile peppers , 3 tablespoons chunky salsa , ¼ cup water , 2 tablespoons ground cumin , 1 cup shredded Colby cheese",total fat: 13.6g saturated fat: 4.9g cholesterol: 37mg sodium: 811mg potassium: 415mg carbohydrates: 22.8g fiber: 4.5g sugar: 2g protein: 16.3g exchange other carbs: 2 vitamin a iu: 715IU niacin equivalents: 7mg vitamin b6: 0mg vitamin c: 20mg folate: 33mcg calcium: 144mg iron: 3mg magnesium: 54mg thiamin: 0mg,10
368,Mexican Turkey Burgers,"1 tablespoon olive oil,1 medium onion, finely chopped,1 medium green bell pepper, finely chopped,2 cloves garlic, minced,1 cup salsa,1 (15.25 ounce) can whole kernel corn, drained,1 pound ground turkey,1 (1.25 ounce) package taco seasoning mix,1/3 cup dry bread crumbs,6 (10 inch) flour tortillas,6 tablespoons sour cream,2 cups shredded lettuce",Total Fat: 17.5gSaturated Fat: 5.0gCholesterol: 62mgSodium: 1445mgPotassium: 605mgTotal Carbohydrates: 64.5gDietary Fiber: 5.4gProtein: 25.2gSugars: 8gVitamin A: 417IUVitamin C: 20mgCalcium: 158mgIron: 5mgThiamin: 1mgNiacin: 11mgVitamin B6: 0mgMagnesium: 55mgFolate: 128mcg,6
369,Chiliquilla,"8 ounces ground beef , 4 tablespoons margarine, divided , 8 (6 inch) corn tortillas, torn into strips , 3 eggs, beaten , ¾ cup canned mild enchilada sauce , ½ cup sliced black olives , ¼ cup chopped green onions , ½ cup sour cream , ½ cup shredded Cheddar cheese",total fat: 50.4g saturated fat: 20.1g cholesterol: 236mg sodium: 524mg potassium: 423mg carbohydrates: 28.5g fiber: 4.4g sugar: 1g protein: 23.2g exchange other carbs: 2 vitamin a iu: 1476IU niacin equivalents: 8mg vitamin b6: 0mg vitamin c: 5mg folate: 38mcg calcium: 259mg iron: 3mg magnesium: 65mg thiamin: 0mg,4
370,Double Chili Cheese Dip,"1 (8 ounce) package cream cheese, softened , 1 (15 ounce) can chili without beans , 4 green onions, thinly sliced , ¼ cup diced green chiles, drained , 1 cup shredded Cheddar cheese",total fat: 10.6g saturated fat: 6.4g cholesterol: 36mg sodium: 270mg potassium: 100mg carbohydrates: 3.8g fiber: 0.6g sugar: 1g protein: 6.4g exchange other carbs: 1 vitamin a iu: 753IU niacin equivalents: 1mg vitamin b6: 0mg vitamin c: 2mg folate: 9mcg calcium: 95mg iron: 1mg magnesium: 10mg thiamin: 0mg,12
371,Chiles Rellenos (Stuffed Peppers),"4 fresh poblano chile peppers , ½ pound lean ground beef , 1 onion, chopped , 1 clove garlic, chopped , salt and pepper to taste , 3 eggs, separated , 1 cup shredded mozzarella cheese , 2 roma (plum) tomatoes, chopped , ½ cup all-purpose flour , 1 cup corn oil",total fat: 70.6g saturated fat: 13.9g cholesterol: 195mg sodium: 270mg potassium: 464mg carbohydrates: 19.7g fiber: 2.8g sugar: 4g protein: 25.4g exchange other carbs: 2 vitamin a iu: 734IU niacin equivalents: 9mg vitamin b6: 0mg vitamin c: 44mg folate: 75mcg calcium: 264mg iron: 3mg magnesium: 38mg thiamin: 0mg,4
372,Easy Chicken Taquitos,"1 (10 ounce) can chicken chunks, drained , ¼ cup shredded Cheddar cheese , 5 drops hot pepper sauce (such as Tabasco®) , 12 corn tortillas",total fat: 6.8g saturated fat: 2.3g cholesterol: 34mg sodium: 292mg potassium: 167mg carbohydrates: 23.3g fiber: 3.3g sugar: 0g protein: 14.3g exchange other carbs: 2 vitamin a iu: 116IU niacin equivalents: 6mg vitamin b6: 0mg vitamin c: 1mg folate: 5mcg calcium: 83mg iron: 1mg magnesium: 44mg thiamin: 0mg,6
373,Ranch Chicken Tacos,"½ cup ranch dressing , ¼ cup reduced-fat sour cream , 1 (1 ounce) packet taco seasoning mix, divided , 1 tablespoon mild chunky salsa , 2 cups shredded rotisserie chicken , 8 (6 inch) corn tortillas , shredded lettuce , 1 tomato, chopped , 4 green onions, sliced , 1 (4 ounce) can sliced black olives , 1 avocado - peeled, pitted and diced (optional) , 1 cup shredded Colby-Monterey Jack cheese",total fat: 49g saturated fat: 15.3g cholesterol: 101mg sodium: 1419mg potassium: 653mg carbohydrates: 40.3g fiber: 8.7g sugar: 5g protein: 30.7g exchange other carbs: 3 vitamin a iu: 895IU niacin equivalents: 10mg vitamin b6: 0mg vitamin c: 13mg folate: 68mcg calcium: 124mg iron: 3mg magnesium: 77mg thiamin: 0mg,4
374,Frijoles a la Charra,"1 pound dry pinto beans , 5 cloves garlic, chopped , 1 teaspoon salt , ½ pound bacon, diced , 1 onion, chopped , 2 fresh tomatoes, diced , 1 (3.5 ounce) can sliced jalapeno peppers , 1 (12 fluid ounce) can beer , ⅓ cup chopped fresh cilantro",total fat: 13.8g saturated fat: 4.5g cholesterol: 19mg sodium: 741mg potassium: 775mg carbohydrates: 39.8g fiber: 12.8g sugar: 2g protein: 16g exchange other carbs: 3 vitamin a iu: 608IU niacin equivalents: 5mg vitamin b6: 0mg vitamin c: 8mg folate: 238mcg calcium: 77mg iron: 3mg magnesium: 79mg thiamin: 0mg,8
375,Pineapple Enchiladas,"1 (20 ounce) can crushed pineapple , ¼ cup sour cream , 2 cups shredded Cheddar cheese, divided , 1 (10 ounce) can enchilada sauce, divided , 6 (8 inch) flour tortillas",total fat: 28.7g saturated fat: 15.8g cholesterol: 73mg sodium: 577mg potassium: 350mg carbohydrates: 53.6g fiber: 3.3g sugar: 16g protein: 17.8g exchange other carbs: 4 vitamin a iu: 960IU niacin equivalents: 6mg vitamin b6: 0mg vitamin c: 15mg folate: 91mcg calcium: 390mg iron: 3mg magnesium: 49mg thiamin: 0mg,5
376,Ken's Kickin' Posole,"2 fresh poblano chile peppers , 8 ounces bacon, chopped , 1 tablespoon bacon drippings , 2 pounds pork loin, cut into 1-inch cubes , 1 onion, diced , 10 cloves garlic, minced , 2 jalapeno peppers, seeded and diced , 1 teaspoon dried Mexican oregano , 2 teaspoons ground cumin , 1 teaspoon New Mexico chile powder , ¼ teaspoon ground cloves , ½ teaspoon kosher salt , 1 bunch cilantro, chopped , 8 cups chicken stock , 1 (14.5 ounce) can mild red enchilada sauce , 2 (29 ounce) cans white hominy, rinsed and drained",total fat: 15.8g saturated fat: 5g cholesterol: 56mg sodium: 1103mg potassium: 532mg carbohydrates: 26.7g fiber: 5g sugar: 4g protein: 21g exchange other carbs: 2 vitamin a iu: 612IU niacin equivalents: 9mg vitamin b6: 1mg vitamin c: 19mg folate: 17mcg calcium: 60mg iron: 2mg magnesium: 54mg thiamin: 1mg,12
377,Flan II,"1/2 cup white sugar,2 cups milk,2 eggs, beaten,2 egg yolks, beaten,3/8 cup white sugar",Total Fat: 7.1gSaturated Fat: 3.0gCholesterol: 205mgSodium: 89mgPotassium: 226mgTotal Carbohydrates: 49.9gDietary Fiber: 0gProtein: 8.5gSugars: 50gVitamin A: 472IUVitamin C: 0mgCalcium: 167mgIron: 1mgThiamin: 0mgNiacin: 2mgVitamin B6: 0mgMagnesium: 17mgFolate: 30mcg,4
378,South Texas Carne Guisada,"1 tablespoon vegetable oil , 2 pounds beef sirloin, cut into 1/2-inch cubes , 1 large onion, chopped , 1 large red bell pepper, chopped , 4 large tomatoes, chopped , 5 cloves garlic, minced , 2 tablespoons ground cumin , 1 teaspoon dried, crushed Mexican oregano , 1 tablespoon garlic powder , 1 teaspoon salt , ½ teaspoon ground black pepper , ½ teaspoon paprika , ⅓ cup water",total fat: 16.9g saturated fat: 6g cholesterol: 81mg sodium: 457mg potassium: 778mg carbohydrates: 11.8g fiber: 3g sugar: 6g protein: 27.4g exchange other carbs: 1 vitamin a iu: 2014IU niacin equivalents: 10mg vitamin b6: 1mg vitamin c: 54mg folate: 44mcg calcium: 58mg iron: 5mg magnesium: 55mg thiamin: 0mg,6
379,Taco Pies,"2 (9 inch) deep dish frozen pie crusts, thawed , 1 pound ground beef , 1 (16 ounce) can refried beans , 1 onion, chopped , 1 cup crushed tortilla chips , 1 cup shredded Cheddar cheese , 2 cups shredded lettuce , 1 large tomato, diced , sour cream , black olives",total fat: 40.9g saturated fat: 16.8g cholesterol: 76mg sodium: 696mg potassium: 467mg carbohydrates: 37.3g fiber: 4.5g sugar: 4g protein: 19.9g exchange other carbs: 3 vitamin a iu: 549IU niacin equivalents: 8mg vitamin b6: 0mg vitamin c: 8mg folate: 50mcg calcium: 190mg iron: 4mg magnesium: 52mg thiamin: 0mg,8
380,Mexican Cornbread Salad,"1 (8.5 ounce) package dry corn bread mix , 1 (4 ounce) can chopped green chile peppers , 2 (16 ounce) cans pinto beans, drained , 1 (16 ounce) bottle Ranch-style salad dressing , 1 green bell pepper, chopped , 2 (15.25 ounce) cans whole kernel corn, drained , 2 tomatoes, chopped , 1 (3 ounce) can bacon bits , 8 ounces shredded Cheddar cheese , 1 green onions",total fat: 46.3g saturated fat: 12.3g cholesterol: 54mg sodium: 2258mg potassium: 523mg carbohydrates: 57.7g fiber: 6.9g sugar: 11g protein: 22g exchange other carbs: 4 vitamin a iu: 838IU niacin equivalents: 4mg vitamin b6: 0mg vitamin c: 27mg folate: 123mcg calcium: 336mg iron: 3mg magnesium: 53mg thiamin: 0mg,8
381,Tex-Mex Beef and Cheese Enchiladas,"2 pounds ground beef , 3 tablespoons chili powder , 2 tablespoons paprika , 1 tablespoon ground cumin , 1 tablespoon garlic powder , 1 teaspoon salt , 1 (8 ounce) can tomato sauce , 4 cups water , ½ cup all-purpose flour, divided , 1 ½ teaspoons sugar , 2 tablespoons cooking oil , 12 (6 inch) corn tortillas , 4 cups shredded American cheese",total fat: 49.1g saturated fat: 24.1g cholesterol: 172mg sodium: 1915mg potassium: 747mg carbohydrates: 40.4g fiber: 6.5g sugar: 4g protein: 47.1g exchange other carbs: 3 vitamin a iu: 2524IU niacin equivalents: 14mg vitamin b6: 1mg vitamin c: 7mg folate: 42mcg calcium: 491mg iron: 6mg magnesium: 83mg thiamin: 0mg,6
382,Carne Guisada II,"2 tablespoons cooking oil , 1 pound beef stew meat , ½ (6 ounce) can tomato paste , 1 (10.5 ounce) can beef broth , ½ cup water , 2 cloves garlic, crushed , 1 teaspoon chili powder , ½ teaspoon ground cumin , ½ teaspoon black pepper , salt to taste , 2 serrano chile peppers, seeded and chopped , 2 teaspoons cornstarch",total fat: 29.1g saturated fat: 10g cholesterol: 76mg sodium: 482mg potassium: 629mg carbohydrates: 6.6g fiber: 1.3g sugar: 3g protein: 22.8g exchange other carbs: 1 vitamin a iu: 553IU niacin equivalents: 9mg vitamin b6: 1mg vitamin c: 7mg folate: 12mcg calcium: 29mg iron: 3mg magnesium: 36mg thiamin: 0mg,4
383,Anaheim Fish Tacos,"1 teaspoon vegetable oil,1 Anaheim chile pepper, chopped,1 leek, chopped,2 cloves garlic, crushed,salt and pepper to taste,1 cup chicken broth,2 large tomatoes, diced,1/2 teaspoon ground cumin,1 1/2 pounds halibut fillets,1 lime,12 corn tortillas",Total Fat: 5.1gSaturated Fat: 1.0gCholesterol: 36mgSodium: 286mgPotassium: 821mgTotal Carbohydrates: 29.9gDietary Fiber: 4.7gProtein: 27.7gSugars: 3gVitamin A: 1011IUVitamin C: 24mgCalcium: 119mgIron: 2mgThiamin: 0mgNiacin: 13mgVitamin B6: 1mgMagnesium: 146mgFolate: 37mcg,6
384,Mexican Rice,"1 pound lean ground beef , 1 onion, diced , 1 green bell pepper, diced , 1 (14 ounce) can beef broth , 2 cups fresh corn kernels , 1 (10 ounce) can diced tomatoes with green chile peppers , 1 (15 ounce) can tomato sauce , ½ cup salsa , ½ teaspoon chili powder , ½ teaspoon paprika , ½ teaspoon garlic powder , ½ teaspoon salt , ½ teaspoon ground black pepper , 1 teaspoon minced cilantro , 1 ½ cups uncooked white rice , 1 cup shredded Cheddar cheese",total fat: 18.3g saturated fat: 8.8g cholesterol: 74mg sodium: 1294mg potassium: 844mg carbohydrates: 59.1g fiber: 4.6g sugar: 7g protein: 28.3g exchange other carbs: 4 vitamin a iu: 1066IU niacin equivalents: 12mg vitamin b6: 1mg vitamin c: 29mg folate: 133mcg calcium: 223mg iron: 5mg magnesium: 80mg thiamin: 0mg,6
385,Linnie's Spanish Rice,"1 cup uncooked white rice , 1 teaspoon minced garlic , 2 cups water , 1 (16 ounce) jar salsa",total fat: 0.5g saturated fat: 0.1g cholesterol: 0mg sodium: 674mg potassium: 389mg carbohydrates: 44.2g fiber: 2.4g sugar: 3g protein: 5.1g exchange other carbs: 3 vitamin a iu: 327IU niacin equivalents: 3mg vitamin b6: 0mg vitamin c: 2mg folate: 111mcg calcium: 44mg iron: 3mg magnesium: 29mg thiamin: 0mg,4
386,Guacamole Cilantro Lime Cheeseburger,"2 avocados - halved, peeled, and pitted , ½ lime, juiced , 1 fresh jalapeno peppers, seeded and minced , ½ cup diced tomatoes , ¼ cup minced onion , 1 ½ teaspoons minced garlic , ¼ teaspoon salt to taste , 2 pounds lean ground beef , ½ lime, juiced , 1 tablespoon minced garlic , 1 teaspoon chili powder , ½ cup diced onion , ½ cup chopped cilantro , 6 slices Monterey Jack cheese , 6 hamburger buns",total fat: 41.5g saturated fat: 15.5g cholesterol: 117mg sodium: 587mg potassium: 853mg carbohydrates: 32.5g fiber: 6.9g sugar: 2g protein: 39g exchange other carbs: 2 vitamin a iu: 855IU niacin equivalents: 15mg vitamin b6: 1mg vitamin c: 16mg folate: 121mcg calcium: 308mg iron: 5mg magnesium: 65mg thiamin: 0mg,6
387,Vegetarian Black Bean Enchiladas,"cooking spray,2 tablespoons olive oil,1 onion, chopped,1 small red bell pepper, chopped,1 (14.25 ounce) can vegetarian refried black beans,1 cup corn kernels, thawed,1 (4 ounce) package cream cheese, softened,1 teaspoon ground cumin,salt and ground black pepper to taste,1 cup loosely packed and chopped fresh cilantro,1 (4 ounce) can canned green chiles, undrained,1/2 cup tomato salsa,1/2 cup tomato sauce,1/2 cup vegetable broth,1/2 lime, juiced,2 cloves garlic, peeled,2 teaspoons dried oregano,6 flour tortillas,2 cups shredded Cheddar cheese, divided,1 cup chopped avocado,1 cup chopped tomatoes,1/2 cup sour cream, or to taste",Total Fat: 38.1gSaturated Fat: 17.0gCholesterol: 69mgSodium: 1577mgPotassium: 730mgTotal Carbohydrates: 65gDietary Fiber: 10.3gProtein: 23.9gSugars: 8gVitamin A: 2391IUVitamin C: 43mgCalcium: 467mgIron: 5mgThiamin: 1mgNiacin: 8mgVitamin B6: 0mgMagnesium: 63mgFolate: 141mcg,6
388,Mexican Bean Burgers,"1 carrot, sliced,1 (15 ounce) can kidney beans,1/2 cup chopped green bell pepper,1/2 cup chopped onion,2 cups salsa,1 cup dried bread crumbs,1/2 cup whole wheat flour,1/2 teaspoon ground black pepper,salt to taste,1 pinch chili powder",Total Fat: 1.2gSaturated Fat: 0.0gCholesterol: 0mgSodium: 609mgPotassium: 313mgTotal Carbohydrates: 29.7gDietary Fiber: 6.4gProtein: 7gSugars: 4gVitamin A: 1765IUVitamin C: 10mgCalcium: 68mgIron: 2mgThiamin: 0mgNiacin: 2mgVitamin B6: 0mgMagnesium: 29mgFolate: 25mcg,8
389,Spicy Southwestern Slaw,"3 cups shredded cabbage,1 carrot, shredded,1 onion, diced,1 red bell pepper, diced,1 jalapeno pepper, seeded and diced,1 tablespoon chopped fresh cilantro,1/2 cup canola oil,2 tablespoons apple cider vinegar,1 tablespoon white sugar,1 teaspoon cayenne pepper,salt and pepper to taste",Total Fat: 18.9gSaturated Fat: 1.0gCholesterol: 0mgSodium: 15mgPotassium: 178mgTotal Carbohydrates: 8.4gDietary Fiber: 2gProtein: 1gSugars: 5gVitamin A: 2530IUVitamin C: 41mgCalcium: 24mgIron: 0mgThiamin: 0mgNiacin: 1mgVitamin B6: 0mgMagnesium: 11mgFolate: 31mcg,6
390,Vegan Fajitas,"1/4 cup olive oil,1/4 cup red wine vinegar,1 teaspoon dried oregano,1 teaspoon chili powder,garlic salt to taste,salt and pepper to taste,1 teaspoon white sugar,2 small zucchini, julienned,2 medium small yellow squash, julienned,1 large onion, sliced,1 green bell pepper, cut into thin strips,1 red bell pepper, cut into thin strips,2 tablespoons olive oil,1 (8.75 ounce) can whole kernel corn, drained,1 (15 ounce) can black beans, drained",Total Fat: 14.4gSaturated Fat: 2.0gCholesterol: 0mgSodium: 130mgPotassium: 404mgTotal Carbohydrates: 17.9gDietary Fiber: 3.7gProtein: 3gSugars: 7gVitamin A: 1547IUVitamin C: 56mgCalcium: 39mgIron: 1mgThiamin: 0mgNiacin: 1mgVitamin B6: 0mgMagnesium: 34mgFolate: 52mcg,6
391,Spanish Rice,"1 tablespoon vegetable oil , 2 cups uncooked long-grain white rice , ¼ onion, chopped , 1 green bell pepper, chopped , salt and pepper to taste , 1 (14.5 ounce) can stewed tomatoes , 4 cups water",total fat: 2.9g saturated fat: 0.4g cholesterol: 0mg sodium: 153mg potassium: 252mg carbohydrates: 54.8g fiber: 1.9g sugar: 3g protein: 5.2g exchange other carbs: 4 vitamin a iu: 190IU niacin equivalents: 4mg vitamin b6: 0mg vitamin c: 22mg folate: 149mcg calcium: 43mg iron: 4mg magnesium: 26mg thiamin: 0mg,6
392,Black Bean and Rice Enchiladas,"1 tablespoon olive oil,1 green bell pepper, chopped,1 onion, chopped,3 cloves garlic, minced,1 (15 ounce) can black beans, rinsed and drained,1 (14.5 ounce) can diced tomatoes and green chilies,1/4 cup picante sauce,1 tablespoon chili powder,1 teaspoon ground cumin,1/4 teaspoon red pepper flakes,2 cups cooked brown rice,8 (6 inch) flour tortillas, warmed,1 cup salsa,1 cup shredded Cheddar cheese,3 tablespoons chopped fresh cilantro leaves,1/4 cup shredded Cheddar cheese",Total Fat: 11gSaturated Fat: 5.0gCholesterol: 19mgSodium: 994mgPotassium: 501mgTotal Carbohydrates: 44.4gDietary Fiber: 7.7gProtein: 12.8gSugars: 3gVitamin A: 963IUVitamin C: 20mgCalcium: 224mgIron: 3mgThiamin: 0mgNiacin: 5mgVitamin B6: 0mgMagnesium: 69mgFolate: 83mcg,8
393,Ground Turkey Taco Meat,"1 1/2 tablespoons chili powder,2 teaspoons ground cumin,1 teaspoon ground paprika,1 teaspoon salt,1/2 teaspoon garlic powder,1/2 teaspoon onion powder,1/2 teaspoon dried oregano,1/4 teaspoon cayenne pepper,1 (12 ounce) package ground turkey,1/2 cup water,1 tablespoon cider vinegar,1 1/2 teaspoons brown sugar",Total Fat: 7.2gSaturated Fat: 2.0gCholesterol: 63mgSodium: 663mgPotassium: 272mgTotal Carbohydrates: 4.8gDietary Fiber: 1.5gProtein: 17.6gSugars: 2gVitamin A: 1257IUVitamin C: 3mgCalcium: 42mgIron: 3mgThiamin: 0mgNiacin: 7mgVitamin B6: 0mgMagnesium: 27mgFolate: 9mcg,4
394,Southwestern Black Bean Stew,"1 pound ground beef , 1 (1.25 ounce) package taco seasoning mix , 1 (15 ounce) can whole kernel corn, drained , 1 (15 ounce) can black beans, undrained , 1 (6 ounce) can tomato paste , 1 ½ cups water , ½ cup sour cream , 2 (8 ounce) packages shredded Cheddar cheese",total fat: 38.9g saturated fat: 21.9g cholesterol: 133mg sodium: 1596mg potassium: 638mg carbohydrates: 33.5g fiber: 6.3g sugar: 7g protein: 38.7g exchange other carbs: 2 vitamin a iu: 1336IU niacin equivalents: 11mg vitamin b6: 0mg vitamin c: 7mg folate: 54mcg calcium: 602mg iron: 5mg magnesium: 56mg thiamin: 0mg,6
395,Cheesy Onion Roll-Ups,"1 cup sour cream , 1 (8 ounce) package cream cheese, softened , ½ cup shredded Cheddar cheese , ¾ cup sliced green onions , 1 tablespoon lime juice , 1 tablespoon seeded and minced jalapeno peppers , 10 (6 inch) flour tortillas , 1 (16 ounce) jar picante sauce",total fat: 5.7g saturated fat: 3.2g cholesterol: 14mg sodium: 146mg potassium: 47mg carbohydrates: 6.7g fiber: 0.4g sugar: 1g protein: 2.3g exchange other carbs: 1 vitamin a iu: 234IU niacin equivalents: 1mg vitamin b6: 0mg vitamin c: 1mg folate: 15mcg calcium: 45mg iron: 1mg magnesium: 5mg thiamin: 0mg,30
396,Double Crust Bean Pie,"1 tablespoon vegetable oil , 1 onion, finely chopped , 1 small green bell pepper, chopped , 1 (15 ounce) can black beans, drained , ⅓ cup salsa , ¼ cup chopped red bell pepper , ¾ teaspoon chili powder , ¼ teaspoon cayenne pepper , ¼ teaspoon ground black pepper , 2 (9 inch) unbaked 9 inch pie crusts , 1 ½ cups shredded Cheddar cheese",total fat: 31.7g saturated fat: 11.3g cholesterol: 30mg sodium: 578mg potassium: 179mg carbohydrates: 32g fiber: 3.1g sugar: 2g protein: 11.4g exchange other carbs: 2 vitamin a iu: 695IU niacin equivalents: 4mg vitamin b6: 0mg vitamin c: 21mg folate: 58mcg calcium: 220mg iron: 2mg magnesium: 23mg thiamin: 0mg,6
397,Mijo's Slow Cooker Shredded Beef,"5 pounds chuck roast , 3 cloves garlic, crushed , 1 tablespoon paprika , 1 tablespoon celery salt , 1 tablespoon garlic powder , 1 tablespoon dried parsley , ½ tablespoon ground black pepper , ½ tablespoon chili powder , ½ tablespoon cayenne pepper , ½ teaspoon seasoned salt , ½ teaspoon mustard powder , ½ teaspoon dried tarragon , 4 fluid ounces beer , 1 ½ tablespoons Worcestershire sauce , 4 tablespoons hot pepper sauce , 2 teaspoons liquid smoke flavoring , 1 large onion, chopped , 1 green bell pepper, chopped , 2 jalapeno chile peppers, chopped",total fat: 39.7g saturated fat: 15.3g cholesterol: 184mg sodium: 917mg potassium: 1077mg carbohydrates: 6.6g fiber: 1.6g sugar: 2g protein: 55.8g exchange other carbs: 1 vitamin a iu: 979IU niacin equivalents: 18mg vitamin b6: 1mg vitamin c: 18mg folate: 28mcg calcium: 59mg iron: 8mg magnesium: 71mg thiamin: 0mg,8
